{"success": true, "universities": [{"university_id": "colorado_state_university", "official_name": "colorado_state_university", "location": {}, "acceptance_rate": null, "soft_fit_category": "UNKNOWN", "market_position": "Land-Grant Research Powerhouse", "us_news_rank": 151, "summary": "**This university** is a university university, ranked #151 in US News National Universities and a standard testing testing policy.\n\n**Academics:** The university comprises 2 colleges/schools including College of Business, Walter Scott, Jr. College of Engineering. Land-Grant Research Powerhouse.\n\n**Outcomes:** Graduates have top employers include Amazon, Deloitte, Lockheed Martin.", "media": null, "indexed_at": "2025-12-29T08:15:31.031384+00:00", "last_updated": null}, {"university_id": "university_of_san_francisco", "official_name": "University of San Francisco", "location": {"city": "San Francisco", "state": "CA", "type": "Private"}, "acceptance_rate": null, "soft_fit_category": "UNKNOWN", "market_position": "Elite Private", "us_news_rank": 110, "summary": "**University of San Francisco** is a private university located in San Francisco, CA, ranked #110 in US News National Universities and a standard testing testing policy.\n\n**Academics:** The university comprises 4 colleges/schools including College of Arts and Sciences, School of Management, School of Nursing and Health Professions, School of Education. Elite Private.\n\n**Outcomes:** Graduates have median earnings of $89,812 ten years after graduation, 81.0% employment rate within 2 years, 13.0% pursue graduate studies, top employers include Apple, Deloitte, Salesforce.", "media": null, "indexed_at": "2025-12-29T08:15:40.733257+00:00", "last_updated": null}, {"university_id": "the_catholic_university_of_america", "official_name": "The Catholic University of America", "location": {"city": "Washington", "state": "DC", "type": "Private"}, "acceptance_rate": null, "soft_fit_category": "UNKNOWN", "market_position": "National Catholic Research University", "us_news_rank": 171, "summary": "**The Catholic University of America** is a private university located in Washington, DC, ranked #171 in US News National Universities and a standard testing testing policy.\n\n**Academics:** The university comprises 5 colleges/schools including School of Architecture and Planning, School of Arts and Sciences, Tim and Steph Busch School of Business, College of Engineering, Physics, and Computing. National Catholic Research University.\n\n**Outcomes:** Graduates have median earnings of $73,250 ten years after graduation, 95.0% employment rate within 2 years, 27.0% pursue graduate studies, top employers include Ernst & Young (EY), Lockheed Martin, NASA.", "media": null, "indexed_at": "2025-12-29T08:15:53.816522+00:00", "last_updated": null}, {"university_id": "university_of_arkansas", "official_name": "University of Arkansas", "location": {"city": "Fayetteville", "state": "Arkansas", "type": "Public"}, "acceptance_rate": null, "soft_fit_category": "UNKNOWN", "market_position": "Public Flagship Research University", "us_news_rank": 173, "summary": "**University of Arkansas** is a public university located in Fayetteville, Arkansas, ranked #173 in US News National Universities and a standard testing testing policy.\n\n**Academics:** The university comprises 6 colleges/schools including Fulbright College of Arts and Sciences, Sam M. Walton College of Business, College of Engineering, Fay Jones School of Architecture and Design. Public Flagship Research University.\n\n**Outcomes:** Graduates have median earnings of $54,417 ten years after graduation, 93.0% employment rate within 2 years, 21.2% pursue graduate studies, top employers include Walmart, Tyson Foods, J.B. Hunt Transport.", "media": null, "indexed_at": "2025-12-29T08:14:12.023863+00:00", "last_updated": "2025-12-19"}, {"university_id": "university_of_kansas", "official_name": "University of Kansas", "location": {"city": "Lawrence", "state": "Kansas", "type": "Public"}, "acceptance_rate": null, "soft_fit_category": "UNKNOWN", "market_position": "Public Ivy", "us_news_rank": 152, "summary": "**University of Kansas** is a public university located in Lawrence, Kansas, ranked #152 in US News National Universities and a standard testing testing policy.\n\n**Academics:** The university comprises 8 colleges/schools including College of Liberal Arts & Sciences, School of Engineering, School of Business, School of Architecture & Design. Public Ivy.\n\n**Outcomes:** Graduates have median earnings of $54,600 ten years after graduation, top employers include Cerner, Garmin, Burns & McDonnell.", "media": null, "indexed_at": "2025-12-29T08:14:28.328393+00:00", "last_updated": null}, {"university_id": "university_of_nebraska_lincoln", "official_name": "University of Nebraska-Lincoln", "location": {"city": "Lincoln", "state": "NE", "type": "Public"}, "acceptance_rate": null, "soft_fit_category": "UNKNOWN", "market_position": "Public Flagship", "us_news_rank": 159, "summary": "**University of Nebraska-Lincoln** is a public university located in Lincoln, NE, ranked #159 in US News National Universities and a standard testing testing policy.\n\n**Academics:** The university comprises 3 colleges/schools including College of Agricultural Sciences and Natural Resources (CASNR), College of Engineering, College of Business. Public Flagship.", "media": null, "indexed_at": "2025-12-29T08:14:37.715048+00:00", "last_updated": null}, {"university_id": "new_jersey_institute_of_technology", "official_name": "New Jersey Institute of Technology", "location": {"city": "Newark", "state": "NJ", "type": "Public"}, "acceptance_rate": null, "soft_fit_category": "UNKNOWN", "market_position": "Public Polytechnic Leader", "us_news_rank": 80, "summary": "**New Jersey Institute of Technology** is a public university located in Newark, NJ, ranked #80 in US News National Universities and a standard testing testing policy.\n\n**Academics:** The university comprises 3 colleges/schools including Newark College of Engineering, Ying Wu College of Computing, Albert Dorman Honors College. Public Polytechnic Leader.\n\n**Outcomes:** Graduates have median earnings of $84,276 ten years after graduation, 85.0% employment rate within 2 years, 12.4% pursue graduate studies, top employers include Amazon, Apple, Google.", "media": null, "indexed_at": "2025-12-29T08:14:53.224531+00:00", "last_updated": "2025-12-19"}, {"university_id": "yeshiva_university", "official_name": "Yeshiva University", "location": {"city": "New York", "state": "NY", "type": "Private"}, "acceptance_rate": null, "soft_fit_category": "UNKNOWN", "market_position": "Elite Private", "us_news_rank": 84, "summary": "**Yeshiva University** is a private university located in New York, NY, ranked #84 in US News National Universities and a standard testing testing policy.\n\n**Academics:** The university comprises 3 colleges/schools including Yeshiva College, Stern College for Women, Sy Syms School of Business. Elite Private.\n\n**Outcomes:** Graduates have median earnings of $71,353 ten years after graduation, 97.6% employment rate within 2 years, 39.9% pursue graduate studies, top employers include Goldman Sachs, Morgan Stanley, Deloitte.", "media": null, "indexed_at": "2025-12-29T08:14:58.130338+00:00", "last_updated": "2025-12-19"}, {"university_id": "arizona_state_university", "official_name": "Arizona State University", "location": {"city": "Tempe", "state": "AZ", "type": "Public"}, "acceptance_rate": null, "soft_fit_category": "UNKNOWN", "market_position": "Public Ivy", "us_news_rank": 117, "summary": "**Arizona State University** is a public university located in Tempe, AZ, ranked #117 in US News National Universities and a standard testing testing policy.\n\n**Academics:** The university comprises 3 colleges/schools including Ira A. Fulton Schools of Engineering, W. P. Carey School of Business, Barrett, The Honors College. Public Ivy.\n\n**Outcomes:** Graduates have median earnings of $62,668 ten years after graduation, 89.0% employment rate within 2 years, 20.0% pursue graduate studies, top employers include Amazon, Intel, Banner Health.", "media": null, "indexed_at": "2025-12-29T08:15:04.478189+00:00", "last_updated": null}, {"university_id": "duquesne_university", "official_name": "duquesne_university", "location": {}, "acceptance_rate": null, "soft_fit_category": "UNKNOWN", "market_position": "Hidden Gem", "us_news_rank": 169, "summary": "**This university** is a university university, ranked #169 in US News National Universities and a standard testing testing policy.\n\n**Academics:** The university comprises 3 colleges/schools including McAnulty College of Liberal Arts, School of Nursing, School of Pharmacy. Hidden Gem.\n\n**Outcomes:** Graduates have median earnings of $65,100 ten years after graduation, 95.0% employment rate within 2 years, 23.0% pursue graduate studies, top employers include PNC Financial Services, BNY Mellon, UPMC.", "media": null, "indexed_at": "2025-12-29T08:16:34.517680+00:00", "last_updated": null}, {"university_id": "university_of_oklahoma", "official_name": "University of Oklahoma", "location": {"city": "Norman", "state": "OK", "type": "Public"}, "acceptance_rate": null, "soft_fit_category": "UNKNOWN", "market_position": "Flagship Research Powerhouse", "us_news_rank": 110, "summary": "**University of Oklahoma** is a public university located in Norman, OK, ranked #110 in US News National Universities and a standard testing testing policy.\n\n**Academics:** The university comprises 9 colleges/schools including Dodge Family College of Arts and Sciences, Michael F. Price College of Business, Gallogly College of Engineering, Gaylord College of Journalism and Mass Communication. Flagship Research Powerhouse.", "media": null, "indexed_at": "2025-12-29T08:17:06.543243+00:00", "last_updated": "2025-12-19"}, {"university_id": "clark_university", "official_name": "Clark University", "location": {"city": "Worcester", "state": "MA", "type": "Private"}, "acceptance_rate": null, "soft_fit_category": "UNKNOWN", "market_position": "Hidden Gem Research Powerhouse", "us_news_rank": 132, "summary": "**Clark University** is a private university located in Worcester, MA, ranked #132 in US News National Universities and a standard testing testing policy.\n\n**Academics:** The university comprises 5 colleges/schools including Arts and Sciences, Becker School of Design & Technology, School of Business, School of Climate, Environment, and Society. Hidden Gem Research Powerhouse.", "media": null, "indexed_at": "2025-12-29T08:17:27.514281+00:00", "last_updated": "2025-12-19"}, {"university_id": "texas_a_m_university", "official_name": "Texas A&M University", "location": {"city": "College Station", "state": "TX", "type": "Public"}, "acceptance_rate": 57.3, "soft_fit_category": "SAFETY", "market_position": "Public Ivy", "us_news_rank": 51, "summary": "**Texas A&M University** is a public university located in College Station, TX, ranked #51 in US News National Universities with a 57.3% acceptance rate and a test optional (note: sat/act requirements reinstated for fall 2026) testing policy.\n\n**Admissions:** SAT middle 50%: 1160-1390. ACT middle 50%: 25-31.\n\n**Academics:** The university comprises 9 colleges/schools including College of Engineering, Mays Business School, College of Arts and Sciences, College of Veterinary Medicine and Biomedical Sciences. Public Ivy.\n\n**Outcomes:** Graduates have median earnings of $72,097 ten years after graduation, 92.0% employment rate within 2 years, top employers include Amazon, Dell Technologies, Apple.", "media": null, "indexed_at": "2025-12-29T08:17:31.529476+00:00", "last_updated": null}, {"university_id": "missouri_university_of_science_and_technology", "official_name": "Missouri University of Science and Technology", "location": {"city": "Rolla", "state": "MO", "type": "Public"}, "acceptance_rate": null, "soft_fit_category": "UNKNOWN", "market_position": "Hidden Gem", "us_news_rank": 192, "summary": "**Missouri University of Science and Technology** is a public university located in Rolla, MO, ranked #192 in US News National Universities and a standard testing testing policy.\n\n**Academics:** The university comprises 1 colleges/schools including College of Engineering and Computing (CEC). Hidden Gem.\n\n**Outcomes:** Graduates have median earnings of $82,957 ten years after graduation, 96.06% employment rate within 2 years, 14.5% pursue graduate studies, top employers include Boeing, Microsoft.", "media": null, "indexed_at": "2025-12-29T08:17:37.820922+00:00", "last_updated": "2025-12-19"}, {"university_id": "university_of_louisville", "official_name": "University of Louisville", "location": {"city": "Louisville", "state": "KY", "type": "Public"}, "acceptance_rate": null, "soft_fit_category": "UNKNOWN", "market_position": "Metropolitan Research Powerhouse", "us_news_rank": 158, "summary": "**University of Louisville** is a public university located in Louisville, KY, ranked #158 in US News National Universities and a standard testing testing policy.\n\n**Academics:** The university comprises 2 colleges/schools including College of Arts & Sciences, J.B. Speed School of Engineering. Metropolitan Research Powerhouse.\n\n**Outcomes:** Graduates have median earnings of $53,899 ten years after graduation, 93.0% employment rate within 2 years, 28.2% pursue graduate studies, top employers include Humana, UPS, Ford.", "media": null, "indexed_at": "2025-12-29T08:17:47.317876+00:00", "last_updated": null}, {"university_id": "university_of_hawaii_at_manoa", "official_name": "University of Hawai\u02bbi at M\u0101noa", "location": {"city": "Honolulu", "state": "Hawaii", "type": "Public"}, "acceptance_rate": 86.6, "soft_fit_category": "SAFETY", "market_position": "Flagship Public Research University with Global Research Strengths and Excellent Value", "us_news_rank": 169, "summary": "**University of Hawai\u02bbi at M\u0101noa** is a public university located in Honolulu, Hawaii, ranked #169 in US News National Universities with a 86.6% acceptance rate and a the university of hawai\u02bbi at m\u0101noa is test-optional, meaning students can choose whether or not to submit sat or act scores for admission consideration. the university has a \u201cdo no harm\u201d policy, which ensures that submitted test scores will not penalize an applicant. if a submitted score would negatively impact the likelihood for admission or scholarship, it will be excluded from consideration. however, certain scholarships or direct entry programs to specific departments may still require test scores for consideration. testing policy.\n\n**Admissions:** SAT middle 50%: 1070-1270. ACT middle 50%: 21-29. GPA middle 50%: 3.49-4.04.\n\n**Academics:** The university comprises 20 colleges/schools including School of Architecture, College of Arts, Languages & Letters, College of Natural Sciences, College of Social Sciences. Flagship Public Research University with Global Research Strengths and Excellent Value.\n\n**Outcomes:** Graduates have median earnings of $57,624 ten years after graduation, top employers include Google, Amazon, Microsoft.", "media": null, "indexed_at": "2026-01-01T00:07:34.378079+00:00", "last_updated": "2025-12-30"}, {"university_id": "university_of_maryland_college_park", "official_name": "University of Maryland, College Park", "location": {"city": "College Park", "state": "MD", "type": "Public"}, "acceptance_rate": 44.8, "soft_fit_category": "TARGET", "market_position": "Public Ivy", "us_news_rank": 42, "summary": "**University of Maryland, College Park** is a public university located in College Park, MD, ranked #42 in US News National Universities with a 44.8% acceptance rate and a test optional testing policy.\n\n**Admissions:** SAT middle 50%: 1410-1520. ACT middle 50%: 32-35. GPA middle 50%: 4.10-4.30. EA acceptance rate: 33.0%.\n\n**Academics:** The university comprises 13 colleges/schools including A. James Clark School of Engineering, College of Agriculture and Natural Resources, College of Arts and Humanities, College of Behavioral and Social Sciences. Public Ivy.\n\n**Outcomes:** Graduates have median earnings of $82,860 ten years after graduation, top employers include Northrop Grumman, Capital One, EY.", "media": null, "indexed_at": "2026-01-01T00:07:35.569706+00:00", "last_updated": "2025-12-07"}, {"university_id": "florida_international_university", "official_name": "Florida International University", "location": {"city": "Miami", "state": "Florida", "region": "", "type": "main_campus"}, "acceptance_rate": 54.7, "soft_fit_category": "SAFETY", "market_position": "Large, diverse public research university with strong STEM programs, especially engineering and hospitality, serving a significant local and international student population. Known for its value and research output in specific niche areas.", "us_news_rank": 162, "summary": "**Florida International University** is a main_campus university located in Miami, Florida, ranked #162 in US News National Universities with a 54.7% acceptance rate and a sat, act and/or clt scores are required for first-time-in-college applicants as outlined in the florida board of governors regulation 6.002. for transfer students, those with 12-29 transferable credits must also provide sat/act/clt scores and their high school transcript. transfer students with 30 or more transferable credits and a 'c' or higher in both enc1101 (or equivalent) and a college-level math course are not required to submit standardized test scores or a high school transcript. testing policy.\n\n**Admissions:** SAT middle 50%: 1070-1250. ACT middle 50%: 21-27. GPA middle 50%: 4.1-4.7. Early Decision acceptance rate: None%.\n\n**Academics:** The university comprises 9 colleges/schools including College of Arts, Sciences & Education, College of Business, College of Communication, Architecture + The Arts, College of Engineering and Computing. Large, diverse public research university with strong STEM programs, especially engineering and hospitality, serving a significant local and international student population. Known for its value and research output in specific niche areas..\n\n**Outcomes:** Graduates have median earnings of $49,900 ten years after graduation, 93.0% employment rate within 2 years, 71.0% pursue graduate studies, top employers include Google, Goldman Sachs, Amazon.", "media": null, "indexed_at": "2026-01-01T00:07:36.677500+00:00", "last_updated": "2024-07-26"}, {"university_id": "university_of_pittsburgh", "official_name": "University of Pittsburgh", "location": {"city": "Pittsburgh", "state": "PA", "type": "Public"}, "acceptance_rate": 59.45, "soft_fit_category": "SAFETY", "market_position": "Public Ivy", "us_news_rank": 69, "summary": "**University of Pittsburgh** is a public university located in Pittsburgh, PA, ranked #69 in US News National Universities with a 59.45% acceptance rate and a test optional testing policy.\n\n**Admissions:** SAT middle 50%: 1270-1450. ACT middle 50%: 29-33. GPA middle 50%: 3.74-4.34.\n\n**Academics:** The university comprises 9 colleges/schools including Kenneth P. Dietrich School of Arts and Sciences, College of Business Administration, Swanson School of Engineering, School of Computing and Information. Public Ivy.\n\n**Outcomes:** Graduates have median earnings of $66,125 ten years after graduation, 64.0% employment rate within 2 years, 30.0% pursue graduate studies, top employers include UPMC, University of Pittsburgh, PNC Financial Services.", "media": null, "indexed_at": "2026-01-01T00:07:37.773400+00:00", "last_updated": "2025-12-07"}, {"university_id": "virginia_tech", "official_name": "Virginia Polytechnic Institute and State University", "location": {"city": "Blacksburg", "state": "VA", "type": "Public"}, "acceptance_rate": 54.8, "soft_fit_category": "SAFETY", "market_position": "Public Ivy", "us_news_rank": 51, "summary": "**Virginia Polytechnic Institute and State University** is a public university located in Blacksburg, VA, ranked #51 in US News National Universities with a 54.8% acceptance rate and a test optional testing policy.\n\n**Admissions:** SAT middle 50%: 1240-1430. ACT middle 50%: 28-32. ED acceptance rate: None%.\n\n**Academics:** The university comprises 9 colleges/schools including College of Agriculture and Life Sciences, College of Architecture, Arts, and Design, Pamplin College of Business, College of Engineering. Public Ivy.\n\n**Outcomes:** Graduates have median earnings of $81,698 ten years after graduation, 20.4% pursue graduate studies, top employers include The Boeing Company, Deloitte, Capital One.", "media": null, "indexed_at": "2026-01-01T00:07:38.782292+00:00", "last_updated": "2025-12-07"}, {"university_id": "kansas_state_university", "official_name": "Kansas State University", "location": {"city": "Manhattan", "state": "Kansas", "type": "main_campus"}, "acceptance_rate": 81.69, "soft_fit_category": "SAFETY", "market_position": "Hidden Gem", "us_news_rank": 158, "summary": "**Kansas State University** is a main_campus university located in Manhattan, Kansas, ranked #158 in US News National Universities with a 81.69% acceptance rate and a kansas state university is test-optional for admission for the 2024-2025 application cycle, meaning applicants are not required to submit standardized test scores (act or sat). however, some scholarships and awards for freshmen may require act or sat scores. the university accepts superscores, using the highest subject scores when calculating an act composite and when combining the sat erw+m. k-state does not prefer the act or sat, and both scores are accepted. self-reporting of scores is allowed, but submitting scores can enhance an application. testing policy.\n\n**Admissions:** SAT middle 50%: 1050-1240. ACT middle 50%: 20-27. GPA middle 50%: 3.50-4.00.\n\n**Academics:** The university comprises 9 colleges/schools including College of Agriculture, College of Architecture, Planning and Design, College of Arts and Sciences, College of Business Administration. Hidden Gem.\n\n**Outcomes:** Graduates have median earnings of $57,260 ten years after graduation, 96.0% employment rate within 2 years, 19.0% pursue graduate studies, top employers include Goldman Sachs, JPMorgan, Deloitte.", "media": null, "indexed_at": "2026-01-01T00:07:39.879104+00:00", "last_updated": "2024-07-27"}, {"university_id": "creighton_university", "official_name": "Creighton University", "location": {"city": "Omaha", "state": "Nebraska", "type": "Private"}, "acceptance_rate": 72.31, "soft_fit_category": "SAFETY", "market_position": "Elite Private", "us_news_rank": 117, "summary": "**Creighton University** is a private university located in Omaha, Nebraska, ranked #117 in US News National Universities with a 72.31% acceptance rate and a creighton university is test-optional for the 2024-2025 application cycle, meaning act/sat scores are not required for admission. however, official scores will be required at the time of enrollment, particularly for math placement. test scores are also required for some programs and scholarships, including certain endowed scholarships and pre-professional medical school programs. testing policy.\n\n**Admissions:** SAT middle 50%: 1450-1530. ACT middle 50%: 28-30. GPA middle 50%: 3.8-4.0. EA acceptance rate: None%.\n\n**Academics:** The university comprises 8 colleges/schools including College of Arts and Sciences, Heider College of Business, College of Nursing, College of Professional and Continuing Education. Elite Private.\n\n**Outcomes:** Graduates have median earnings of $73,911 ten years after graduation, 62.0% employment rate within 2 years, 33.0% pursue graduate studies, top employers include Deloitte, EY, Goldman Sachs.", "media": null, "indexed_at": "2026-01-01T00:07:41.976404+00:00", "last_updated": "2025-12-07"}, {"university_id": "university_of_missouri", "official_name": "University of Missouri", "location": {"city": "Columbia", "state": "MO", "type": "main_campus"}, "acceptance_rate": 78.5, "soft_fit_category": "SAFETY", "market_position": "Strong regional leader with national recognition in select disciplines (e.g., Journalism, Veterinary Medicine). Positioned as a comprehensive research institution within the competitive SEC conference, attracting a mix of in-state and out-of-state students.", "us_news_rank": 124, "summary": "**University of Missouri** is a main_campus university located in Columbia, MO, ranked #124 in US News National Universities with a 78.5% acceptance rate and a university of missouri-columbia requires standardized test scores for admission. the average sat score is 1230, and the average act score is 25. for act, the middle 50% range is 23-30. for sat, the middle 50% range is 1150-1330. while there is no absolute minimum requirement, scores below these ranges may make admission more challenging. testing policy.\n\n**Admissions:** SAT middle 50%: 1150-1330. ACT middle 50%: 23-30. GPA middle 50%: 3.2-3.7.\n\n**Academics:** The university comprises 10 colleges/schools including College of Agriculture, Food and Natural Resources, College of Arts and Science, College of Education & Human Development, College of Engineering. Strong regional leader with national recognition in select disciplines (e.g., Journalism, Veterinary Medicine). Positioned as a comprehensive research institution within the competitive SEC conference, attracting a mix of in-state and out-of-state students..\n\n**Outcomes:** Graduates have median earnings of $54,200 ten years after graduation, 95.0% employment rate within 2 years, 23.6% pursue graduate studies, top employers include Google, Goldman Sachs, McKinsey & Company.", "media": null, "indexed_at": "2026-01-01T00:07:42.977071+00:00", "last_updated": "2023-10-27"}, {"university_id": "university_of_california_san_diego", "official_name": "University of California, San Diego", "location": {"city": "La Jolla", "state": "CA", "type": "Public"}, "acceptance_rate": 26.8, "soft_fit_category": "TARGET", "market_position": "Public Ivy", "us_news_rank": 29, "summary": "**University of California, San Diego** is a public university located in La Jolla, CA, ranked #29 in US News National Universities with a 26.8% acceptance rate and a test blind testing policy.\n\n**Academics:** The university comprises 16 colleges/schools including Revelle College, John Muir College, Thurgood Marshall College, Earl Warren College. Public Ivy.\n\n**Outcomes:** Graduates have median earnings of $84,943 ten years after graduation, 86.1% employment rate within 2 years, 27.0% pursue graduate studies, top employers include Google, Apple, Amazon.", "media": null, "indexed_at": "2026-01-01T00:07:44.130959+00:00", "last_updated": "2025-12-17"}, {"university_id": "university-of-south-carolina", "official_name": "University of South Carolina", "location": {"city": "Columbia", "state": "SC", "type": "Public"}, "acceptance_rate": 60.2, "soft_fit_category": "SAFETY", "market_position": "Public Ivy", "us_news_rank": 127, "summary": "**University of South Carolina** is a public university located in Columbia, SC, ranked #127 in US News National Universities with a 60.2% acceptance rate and a test optional testing policy.\n\n**Admissions:** SAT middle 50%: 1180-1380. ACT middle 50%: 26-32. GPA middle 50%: 4.10-4.80.\n\n**Academics:** The university comprises 7 colleges/schools including Darla Moore School of Business, McCausland College of Arts and Sciences, Molinaroli College of Engineering and Computing, College of Nursing. Public Ivy.\n\n**Outcomes:** Graduates have median earnings of $62,177 ten years after graduation, 90.0% employment rate within 2 years, 25.0% pursue graduate studies, top employers include Amazon, Boeing, Deloitte.", "media": null, "indexed_at": "2026-01-01T00:07:45.270320+00:00", "last_updated": "2025-12-19"}, {"university_id": "university_of_texas_at_dallas", "official_name": "The University of Texas at Dallas", "location": {"city": "Richardson", "state": "Texas", "type": "Public"}, "acceptance_rate": 65.1, "soft_fit_category": "SAFETY", "market_position": "Prominent Public Research University", "us_news_rank": 110, "summary": "**The University of Texas at Dallas** is a public university located in Richardson, Texas, ranked #110 in US News National Universities with a 65.1% acceptance rate and a the university does not require test scores for admission or scholarship consideration. however, applicants are strongly encouraged to submit official scores to meet texas success initiative (tsi) requirements. submitted test scores will be used solely to enhance an applicant's admission or scholarship review and will never have a negative impact. testing policy.\n\n**Admissions:** SAT middle 50%: 1170-1410. ACT middle 50%: 24-32. GPA middle 50%: 3.60-3.80.\n\n**Academics:** The university comprises 7 colleges/schools including Harry W. Bass Jr. School of Arts, Humanities, and Technology, School of Behavioral and Brain Sciences, School of Economic, Political and Policy Sciences, Erik Jonsson School of Engineering and Computer Science. Prominent Public Research University.\n\n**Outcomes:** Graduates have median earnings of $68,227 ten years after graduation, 78.0% employment rate within 2 years, top employers include Google, Goldman Sachs, McKinsey & Company.", "media": null, "indexed_at": "2026-01-01T00:07:46.496041+00:00", "last_updated": "2024-05-15"}, {"university_id": "portland_state_university", "official_name": "Portland State University", "location": {"city": "Portland", "state": "Oregon", "type": "Public"}, "acceptance_rate": 90.9, "soft_fit_category": "SAFETY", "market_position": "Urban research university with a strong focus on community engagement, applied learning, and graduate studies, serving a diverse student body.", "us_news_rank": 340, "summary": "**Portland State University** is a public university located in Portland, Oregon, ranked #340 in US News National Universities with a 90.9% acceptance rate and a portland state university has a test-optional policy for undergraduate admission. applicants are not required to submit standardized test scores (sat or act) for an admission decision. if an applicant chooses to submit scores, they can self-report them. the university will consider other factors such as high school transcript, gpa, and personal statement if test scores are not submitted. psu accepts sat (school code: 4610) and act (school code: 3492) tests, which can be submitted via the testing agency. testing policy.\n\n**Admissions:** SAT middle 50%: 1100-1290. ACT middle 50%: 19-28. GPA middle 50%: 3.00-3.70.\n\n**Academics:** The university comprises 9 colleges/schools including College of Liberal Arts & Sciences, College of the Arts, College of Urban & Public Affairs, School of Business. Urban research university with a strong focus on community engagement, applied learning, and graduate studies, serving a diverse student body..\n\n**Outcomes:** Graduates have median earnings of $57,906 ten years after graduation, top employers include Deloitte, EY, PwC.", "media": null, "indexed_at": "2026-01-01T00:07:47.679343+00:00", "last_updated": "2025-12-30"}, {"university_id": "syracuse_university", "official_name": "Syracuse University", "location": {"city": "Syracuse", "state": "NY", "type": "Private"}, "acceptance_rate": 41.7, "soft_fit_category": "TARGET", "market_position": "Highly Ranked Private", "us_news_rank": 75, "summary": "**Syracuse University** is a private university located in Syracuse, NY, ranked #75 in US News National Universities with a 41.7% acceptance rate and a test optional testing policy.\n\n**Admissions:** SAT middle 50%: 1290-1420. ACT middle 50%: 29-32. ED acceptance rate: 60.0%.\n\n**Academics:** The university comprises 12 colleges/schools including School of Architecture, The College of Arts and Sciences, School of Education, College of Engineering and Computer Science. Highly Ranked Private.\n\n**Outcomes:** Graduates have median earnings of $79,164 ten years after graduation, 22.0% pursue graduate studies, top employers include Amazon, Deloitte, EY LLP.", "media": null, "indexed_at": "2026-01-01T00:07:48.833719+00:00", "last_updated": "2025-12-07"}, {"university_id": "oklahoma_state_university", "official_name": "Oklahoma State University", "location": {"city": "Stillwater", "state": "Oklahoma", "type": "Public"}, "acceptance_rate": 75.04, "soft_fit_category": "SAFETY", "market_position": "A strong regional public university with a national reputation in agricultural sciences, engineering, and veterinary medicine. Known for its vibrant campus life and strong alumni network, particularly within Oklahoma and surrounding states.", "us_news_rank": 187, "summary": "**Oklahoma State University** is a public university located in Stillwater, Oklahoma, ranked #187 in US News National Universities with a 75.04% acceptance rate and a test scores are optional for admission to oklahoma state university. applicants may indicate on their application if they do not wish to submit a test score. however, official act or sat scores are generally required for most university scholarships, and applicants are encouraged to provide them for maximum scholarship consideration. all official act and sat scores received will be added to the student's application, but only the highest score will be used for admission and scholarship purposes. test scores received for students who choose test-optional admission will still be added to their file for scholarship purposes. test-optional admission also applies to graduates of home school, private, parochial, or other non-public high schools not accredited by a recognized accrediting agency. testing policy.\n\n**Admissions:** SAT middle 50%: 1040-1240. ACT middle 50%: 20-27. GPA middle 50%: N/A.\n\n**Academics:** The university comprises 7 colleges/schools including College of Arts and Sciences, College of Education and Human Sciences, College of Engineering, Architecture and Technology, Ferguson College of Agriculture. A strong regional public university with a national reputation in agricultural sciences, engineering, and veterinary medicine. Known for its vibrant campus life and strong alumni network, particularly within Oklahoma and surrounding states..\n\n**Outcomes:** Graduates have median earnings of $57,410 ten years after graduation, 95.0% employment rate within 2 years, 22.9% pursue graduate studies, top employers include Amazon, Williams, Phillips 66.", "media": null, "indexed_at": "2026-01-01T00:07:49.996172+00:00", "last_updated": "2024-07-30"}, {"university_id": "depaul_university", "official_name": "DePaul University", "location": {"city": "Chicago", "state": "Illinois", "type": "Private"}, "acceptance_rate": 75.9, "soft_fit_category": "SAFETY", "market_position": "Urban Private University with Strong Professional Programs", "us_news_rank": 165, "summary": "**DePaul University** is a private university located in Chicago, Illinois, ranked #165 in US News National Universities with a 75.9% acceptance rate and a depaul university has adopted a test-optional policy for freshman admission, allowing students to choose whether to submit act or sat scores as part of their application. the university conducts a holistic review, emphasizing the applicant's high school record, particularly grades in challenging core subjects. test-optional applicants are reviewed separately from those who submit scores. self-reporting of scores is permitted. while not required for application review, test-optional applicants are encouraged to submit the optional personal essay through the common app. after enrollment, depaul asks students to submit their act or sat scores (if taken) for research purposes. testing policy.\n\n**Admissions:** SAT middle 50%: 1130-1340. ACT middle 50%: 25-31. GPA middle 50%: N/A. EA acceptance rate: 79.88%.\n\n**Academics:** The university comprises 10 colleges/schools including Driehaus College of Business, College of Communication, Jarvis College of Computing and Digital Media, College of Education. Urban Private University with Strong Professional Programs.\n\n**Outcomes:** Graduates have median earnings of $68,751 ten years after graduation, 94.0% employment rate within 2 years, 12.0% pursue graduate studies, top employers include Google, Amazon, Microsoft.", "media": null, "indexed_at": "2026-01-01T00:07:51.167446+00:00", "last_updated": "2024-07-29"}, {"university_id": "loyola_university_chicago", "official_name": "Loyola University Chicago", "location": {"city": "Chicago", "state": "Illinois", "type": "Private"}, "acceptance_rate": 81.5, "soft_fit_category": "SAFETY", "market_position": "Elite Private", "us_news_rank": 132, "summary": "**Loyola University Chicago** is a private university located in Chicago, Illinois, ranked #132 in US News National Universities with a 81.5% acceptance rate and a loyola university chicago is test-optional, meaning applicants can choose whether to submit sat or act scores. the university allows self-reporting of scores. loyola superscores results, reviewing the highest subscore from each section over multiple exams. if accepted, official scores must be sent by may 1. testing policy.\n\n**Admissions:** SAT middle 50%: 1210-1370. ACT middle 50%: 27-32. GPA middle 50%: 3.7-3.9.\n\n**Academics:** The university comprises 11 colleges/schools including Arrupe College, College of Arts and Sciences, Quinlan School of Business, Marcella Niehoff School of Nursing. Elite Private.\n\n**Outcomes:** Graduates have median earnings of $71,530 ten years after graduation, 17.0% pursue graduate studies, top employers include Deloitte, PwC, Morgan Stanley.", "media": null, "indexed_at": "2026-01-01T00:07:52.382830+00:00", "last_updated": "2024-07-30"}, {"university_id": "marquette_university", "official_name": "Marquette University", "location": {"city": "Milwaukee", "state": "WI", "type": "Private"}, "acceptance_rate": 81.3, "soft_fit_category": "SAFETY", "market_position": "Elite Private", "us_news_rank": 88, "summary": "**Marquette University** is a private university located in Milwaukee, WI, ranked #88 in US News National Universities with a 81.3% acceptance rate and a test optional testing policy.\n\n**Admissions:** SAT middle 50%: 1200-1340. ACT middle 50%: 26-31.\n\n**Academics:** The university comprises 7 colleges/schools including Klingler College of Arts and Sciences, College of Business Administration, Diederich College of Communication, College of Education. Elite Private.\n\n**Outcomes:** Graduates have median earnings of $78,257 ten years after graduation, 25.0% pursue graduate studies, top employers include Deloitte, KPMG, PricewaterhouseCoopers.", "media": null, "indexed_at": "2026-01-01T00:07:53.472024+00:00", "last_updated": "2025-12-07"}, {"university_id": "utah_state_university", "official_name": "Utah State University", "location": {"city": "Logan", "state": "Utah", "type": "Public"}, "acceptance_rate": 92.4, "soft_fit_category": "SAFETY", "market_position": "Public Land-Grant Research University", "us_news_rank": 259, "summary": "**Utah State University** is a public university located in Logan, Utah, ranked #259 in US News National Universities with a 92.4% acceptance rate and a utah state university is test-optional for admission to its logan and statewide campuses, meaning act/sat scores are not mandatory. however, test scores are still considered if submitted and are recommended for guaranteed academic merit scholarships. students who do not submit scores can request a personal comprehensive scholarship review. test scores are also required for admission into select majors and programs. students with a high school gpa below 2.8 may still be admitted in good standing based on a combination of their gpa and act/sat scores. testing policy.\n\n**Admissions:** SAT middle 50%: 1070-1300. ACT middle 50%: 20-28. GPA middle 50%: 2.80-4.00.\n\n**Academics:** The university comprises 6 colleges/schools including S.J. and Jessie E. Quinney College of Agriculture and Natural Resources, College of Arts and Sciences, Jon M. Huntsman School of Business, Emma Eccles Jones College of Education and Human Services. Public Land-Grant Research University.\n\n**Outcomes:** Graduates have median earnings of $54,022 ten years after graduation, 80.0% employment rate within 2 years, 16.4% pursue graduate studies, top employers include Goldman Sachs, Amazon, Deloitte.", "media": null, "indexed_at": "2026-01-01T00:07:54.486158+00:00", "last_updated": "2025-12-30"}, {"university_id": "chapman_university", "official_name": "Chapman University", "location": {"city": "Orange", "state": "CA", "type": "Private"}, "acceptance_rate": 65.4, "soft_fit_category": "SAFETY", "market_position": "Top-tier Private", "us_news_rank": 110, "summary": "**Chapman University** is a private university located in Orange, CA, ranked #110 in US News National Universities with a 65.4% acceptance rate and a test optional testing policy.\n\n**Admissions:** SAT middle 50%: 1290-1440. ACT middle 50%: 28-32. EA acceptance rate: 51.4%.\n\n**Academics:** The university comprises 11 colleges/schools including Argyros College of Business and Economics, Attallah College of Educational Studies, College of Performing Arts, Crean College of Health and Behavioral Sciences. Top-tier Private.\n\n**Outcomes:** Graduates have median earnings of $70,070 ten years after graduation, top employers include Apple Inc., Blizzard Entertainment, Inc., CBRE Group, Inc..", "media": null, "indexed_at": "2026-01-01T00:07:55.583796+00:00", "last_updated": "2025-12-07"}, {"university_id": "princeton_university", "official_name": "Princeton University", "location": {"city": "Princeton", "state": "New Jersey", "type": "Private"}, "acceptance_rate": 4.4, "soft_fit_category": "SUPER_REACH", "market_position": "Elite Private", "us_news_rank": 1, "summary": "**Princeton University** is a private university located in Princeton, New Jersey, ranked #1 in US News National Universities with a 4.4% acceptance rate and a test optional testing policy.\n\n**Admissions:** SAT middle 50%: 1510-1560. ACT middle 50%: 34-35. SCEA acceptance rate: 15.8%.\n\n**Academics:** The university comprises 2 colleges/schools including Undergraduate College (A.B. Programs), School of Engineering and Applied Science (B.S.E. Programs). Elite Private.\n\n**Outcomes:** Graduates have median earnings of $110,066 ten years after graduation, 92.8% employment rate within 2 years, 18.4% pursue graduate studies, top employers include JPMorgan Chase & Co., Goldman Sachs, Bank of America.", "media": null, "indexed_at": "2026-01-01T00:07:56.686382+00:00", "last_updated": "2025-12-24"}, {"university_id": "pace_university", "official_name": "Pace University", "location": {"city": "New York City", "state": "New York", "type": "Private"}, "acceptance_rate": 75.92, "soft_fit_category": "SAFETY", "market_position": "Urban-centric institution focused on career readiness, especially in business, health, and arts.", "us_news_rank": 200, "summary": "**Pace University** is a private university located in New York City, New York, ranked #200 in US News National Universities with a 75.92% acceptance rate and a pace university is test-optional, meaning applicants are not required to submit standardized test scores for admission. however, students applying to the combined accounting and nursing program are required to submit either sat or act scores, as are applicants who want to be considered for certain scholarships, home-schooled applicants, and those who attend a high school that does not provide letter or numerical grades. all admitted students, with the exception of international first-year students, are considered for a merit scholarship and do not need to submit the sat or act. testing policy.\n\n**Admissions:** SAT middle 50%: 1190-1340. ACT middle 50%: 25-30. GPA middle 50%: 3.2-3.4. EA acceptance rate: 86.5%.\n\n**Academics:** The university comprises 6 colleges/schools including Dyson College of Arts and Sciences, Lubin School of Business, Sands College of Performing Arts, Seidenberg School of Computer Science and Information Systems. Urban-centric institution focused on career readiness, especially in business, health, and arts..\n\n**Outcomes:** Graduates have median earnings of $70,378 ten years after graduation, 93% employment rate within 2 years, 19% pursue graduate studies, top employers include Google, Goldman Sachs, Amazon.", "media": null, "indexed_at": "2026-01-01T00:07:57.733003+00:00", "last_updated": "2024-07-30"}, {"university_id": "university_of_north_carolina_at_charlotte", "official_name": "University of North Carolina at Charlotte", "location": {"city": "Charlotte", "state": "North Carolina", "type": "Public"}, "acceptance_rate": 79.6, "soft_fit_category": "SAFETY", "market_position": "Rising Public Research University", "us_news_rank": 143, "summary": "**University of North Carolina at Charlotte** is a public university located in Charlotte, North Carolina, ranked #143 in US News National Universities with a 79.6% acceptance rate and a the university of north carolina at charlotte is test-optional, allowing applicants to choose whether to submit standardized test scores. this policy is in place through 2025. for fall 2026 applicants, test scores are optional for students with a weighted gpa of 2.8 or higher at the end of their junior year. students who choose to submit scores can self-report them on the application. strong scores can enhance an applicant's profile, particularly for merit scholarships. testing policy.\n\n**Admissions:** SAT middle 50%: 1120-1340. ACT middle 50%: 21-28. GPA middle 50%: 3.8-4.4.\n\n**Academics:** The university comprises 15 colleges/schools including Belk College of Business, William States Lee College of Engineering, College of Arts + Architecture (Architecture), College of Arts + Architecture (Art and Graphic Design). Rising Public Research University.\n\n**Outcomes:** Graduates have median earnings of $48,600 ten years after graduation, 87.0% employment rate within 2 years, top employers include Amazon, Deloitte, Bank of America.", "media": null, "indexed_at": "2026-01-01T00:07:58.834533+00:00", "last_updated": "2024-07-29"}, {"university_id": "illinois_institute_of_technology", "official_name": "Illinois Institute of Technology", "location": {"city": "Chicago", "state": "IL", "type": "Private"}, "acceptance_rate": 55.0, "soft_fit_category": "SAFETY", "market_position": "Elite Private", "us_news_rank": 105, "summary": "**Illinois Institute of Technology** is a private university located in Chicago, IL, ranked #105 in US News National Universities with a 55.0% acceptance rate and a test optional testing policy.\n\n**Admissions:** SAT middle 50%: 1190-1390. ACT middle 50%: 26-32. EA acceptance rate: 74.8%.\n\n**Academics:** The university comprises 7 colleges/schools including Armour College of Engineering, Chicago-Kent College of Law, College of Architecture, College of Computing. Elite Private.\n\n**Outcomes:** Graduates have median earnings of $82,592 ten years after graduation, 85.0% employment rate within 2 years, 3.2% pursue graduate studies, top employers include Amazon, Apple, Intel Corporation.", "media": null, "indexed_at": "2026-01-01T00:07:59.982534+00:00", "last_updated": "2025-12-07"}, {"university_id": "university_of_california_davis", "official_name": "University of California, Davis", "location": {"city": "Davis", "state": "California", "type": "Public"}, "acceptance_rate": 41.84, "soft_fit_category": "TARGET", "market_position": "Public Ivy", "us_news_rank": 33, "summary": "**University of California, Davis** is a public university located in Davis, California, ranked #33 in US News National Universities with a 41.84% acceptance rate and a test blind testing policy.\n\n**Academics:** The university comprises 4 colleges/schools including College of Agricultural and Environmental Sciences, College of Biological Sciences, College of Engineering, College of Letters and Science. Public Ivy.\n\n**Outcomes:** Graduates have median earnings of $80,838 ten years after graduation, top employers include Google, Microsoft, Apple.", "media": null, "indexed_at": "2026-01-01T00:08:00.977647+00:00", "last_updated": "2025-12-06"}, {"university_id": "university_of_colorado_boulder", "official_name": "University of Colorado Boulder", "location": {"city": "Boulder", "state": "Colorado", "type": "Public"}, "acceptance_rate": 76.2, "soft_fit_category": "SAFETY", "market_position": "Public Ivy", "us_news_rank": 97, "summary": "**University of Colorado Boulder** is a public university located in Boulder, Colorado, ranked #97 in US News National Universities with a 76.2% acceptance rate and a test optional testing policy.\n\n**Admissions:** SAT middle 50%: 1230-1420. ACT middle 50%: 28-33. EA acceptance rate: 89.3%.\n\n**Academics:** The university comprises 9 colleges/schools including College of Arts and Sciences, College of Engineering and Applied Science, Leeds School of Business, College of Media, Communication and Information. Public Ivy.\n\n**Outcomes:** Graduates have median earnings of $69,738 ten years after graduation, top employers include Lockheed Martin, Microsoft, NASA Jet Propulsion Laboratory.", "media": null, "indexed_at": "2026-01-01T00:08:02.073590+00:00", "last_updated": "2025-12-07"}, {"university_id": "rice_university", "official_name": "William Marsh Rice University", "location": {"city": "Houston", "state": "TX", "type": "Private"}, "acceptance_rate": 7.8, "soft_fit_category": "SUPER_REACH", "market_position": "Elite Private", "us_news_rank": 17, "summary": "**William Marsh Rice University** is a private university located in Houston, TX, ranked #17 in US News National Universities with a 7.8% acceptance rate and a test optional testing policy.\n\n**Admissions:** SAT middle 50%: 1510-1560. ACT middle 50%: 34-35. GPA middle 50%: 3.80-4.20. ED acceptance rate: 13.2%.\n\n**Academics:** The university comprises 7 colleges/schools including School of Architecture, George R. Brown School of Engineering and Computing, School of Humanities, Shepherd School of Music. Elite Private.\n\n**Outcomes:** Graduates have median earnings of $89,718 ten years after graduation, 34.0% pursue graduate studies, top employers include Amazon, Deloitte, Goldman Sachs.", "media": null, "indexed_at": "2026-01-01T00:08:03.183016+00:00", "last_updated": "2025-12-07"}, {"university_id": "ohio_university", "official_name": "Ohio University", "location": {"city": "Athens", "state": "Ohio", "type": "Public"}, "acceptance_rate": 84.96, "soft_fit_category": "SAFETY", "market_position": "Regional public university with strong programs in journalism, business, and healthcare, known for vibrant campus life and historical significance.", "us_news_rank": 185, "summary": "**Ohio University** is a public university located in Athens, Ohio, ranked #185 in US News National Universities with a 84.96% acceptance rate and a ohio university has a test-optional pathway for freshman applicants to its athens campus, meaning standardized test scores (act or sat) are not required for admission. applicants can choose to submit scores if they wish to have them considered. if multiple scores are submitted, ohio university will use the highest composite act or the highest combined math and critical reading sat scores, as the university superscores. applying test-optional will not negatively impact consideration for admission, merit-based scholarships, or honors and scholars programs. undergraduate admissions considers class rank, strength of curriculum, optional act and/or sat scores, and gpa. self-reporting of scores is permitted initially. testing policy.\n\n**Admissions:** SAT middle 50%: 1100-1280. ACT middle 50%: 22-28. GPA middle 50%: 3.59-4.20.\n\n**Academics:** The university comprises 10 colleges/schools including College of Arts and Sciences, College of Business, College of Fine Arts, College of Health Sciences and Professions. Regional public university with strong programs in journalism, business, and healthcare, known for vibrant campus life and historical significance..", "media": null, "indexed_at": "2026-01-01T00:08:04.277776+00:00", "last_updated": "2024-05-22"}, {"university_id": "wayne_state_university", "official_name": "Wayne State University", "location": {"city": "Detroit", "state": "Michigan", "type": "main_campus"}, "acceptance_rate": 81.16, "soft_fit_category": "SAFETY", "market_position": "As Detroit's flagship public research university, Wayne State holds a unique market position, serving as a critical anchor institution for the city and surrounding region. It competes for talent with other public universities in Michigan and the Midwest, often attracting students seeking an urban experience, strong professional programs (e.g., medical, law, engineering), and a commitment to social impact.", "us_news_rank": 179, "summary": "**Wayne State University** is a main_campus university located in Detroit, Michigan, ranked #179 in US News National Universities with a 81.16% acceptance rate and a wayne state university is test-optional, meaning applicants are not required to submit standardized test scores (sat or act) for consideration in the admissions process. the university allows self-reporting of scores. while not strictly required, submitting scores is recommended to potentially improve application chances. specific departments may have different requirements. for first-year students choosing the test-optional pathway for fall 2026, applicants must complete short essay questions and submit a list of leadership activities, extracurricular activities, community involvement, and work experience. a recommendation form from an academic reference is optional for these applicants. admitted students may need to complete placement testing. international applicants who are non-native english speakers must submit an acceptable score on the ielts, toefl, met, or duolingo test. wayne state university also employs a \"highest section\" sat score choice policy, also known as superscoring, and considers the sat essay/act writing section optional. testing policy.\n\n**Admissions:** SAT middle 50%: 1060-1260. ACT middle 50%: 23-29. GPA middle 50%: 3.40-3.40. ED acceptance rate: 8.33%.\n\n**Academics:** The university comprises 9 colleges/schools including Mike Ilitch School of Business, College of Education, James and Patricia Anderson College of Engineering, College of Fine, Performing and Communication Arts. As Detroit's flagship public research university, Wayne State holds a unique market position, serving as a critical anchor institution for the city and surrounding region. It competes for talent with other public universities in Michigan and the Midwest, often attracting students seeking an urban experience, strong professional programs (e.g., medical, law, engineering), and a commitment to social impact..\n\n**Outcomes:** Graduates have median earnings of $51,000 ten years after graduation, top employers include Google, JPMorgan Chase, Deloitte.", "media": null, "indexed_at": "2026-01-01T00:08:05.373855+00:00", "last_updated": "2024-05-13"}, {"university_id": "george_mason_university", "official_name": "George Mason University", "location": {"city": "Fairfax", "state": "Virginia", "type": "Public"}, "acceptance_rate": 87.48, "soft_fit_category": "SAFETY", "market_position": "Leading Public University for Value, Upward Mobility, and Career Outcomes", "us_news_rank": null, "summary": "**George Mason University** is a public university located in Fairfax, Virginia with a 87.48% acceptance rate and a george mason university has a score optional program for freshman applicants, allowing them to apply without submitting sat or act scores. applicants who choose to submit scores can self-report them initially, but official scores are required before the first day of classes if admission is granted. applying test-optional does not negatively impact consideration for admission, merit scholarships, or the honors college, and it is recommended for score-optional applicants to maintain a competitive cumulative high school gpa. testing policy.\n\n**Admissions:** SAT middle 50%: 1140-1340. ACT middle 50%: 25-30. GPA middle 50%: 3.50-3.85. EA acceptance rate: 89.1%.\n\n**Academics:** The university comprises 10 colleges/schools including College of Education and Human Development, College of Engineering and Computing, College of Humanities and Social Sciences, College of Public Health (excluding School of Nursing). Leading Public University for Value, Upward Mobility, and Career Outcomes.\n\n**Outcomes:** Graduates have median earnings of $76,343 ten years after graduation, 85.0% employment rate within 2 years.", "media": null, "indexed_at": "2026-01-01T00:08:06.477223+00:00", "last_updated": "2024-07-30"}, {"university_id": "university_of_cincinnati", "official_name": "University of Cincinnati", "location": {"city": "Cincinnati", "state": "Ohio", "type": "Public"}, "acceptance_rate": 87.7, "soft_fit_category": "SAFETY", "market_position": "Public Ivy", "us_news_rank": 152, "summary": "**University of Cincinnati** is a public university located in Cincinnati, Ohio, ranked #152 in US News National Universities with a 87.7% acceptance rate and a the university of cincinnati is test-optional for undergraduate applicants. students can choose whether or not to submit their sat or act scores, and choosing not to submit scores will not disadvantage an applicant. all academic programs consider students for admission with or without a standardized test score. applicants who apply test-optional by the early action admission deadline (november 1) will still receive full consideration for scholarships. international students are required to provide proof of english ability. if students choose to submit test scores, they must be sent on an official score report from the act or college board; self-reported scores are not considered for admission if the student indicates they do not want their scores considered. testing policy.\n\n**Admissions:** SAT middle 50%: 1160-1350. ACT middle 50%: 24-29.\n\n**Academics:** The university comprises 9 colleges/schools including College of Allied Health Sciences, College of Arts and Sciences, Carl H. Lindner College of Business, College-Conservatory of Music. Public Ivy.\n\n**Outcomes:** Graduates have median earnings of $54,810 ten years after graduation, 95.0% employment rate within 2 years, 48.0% pursue graduate studies, top employers include Google, Amazon, Microsoft.", "media": null, "indexed_at": "2026-01-01T00:08:07.567537+00:00", "last_updated": "2024-07-29"}, {"university_id": "university_of_la_verne", "official_name": "University of La Verne", "location": {"city": "La Verne", "state": "California", "type": "Private"}, "acceptance_rate": 48.5, "soft_fit_category": "TARGET", "market_position": "Inclusive Private University with a Strong Social Mobility Mission", "us_news_rank": 196, "summary": "**University of La Verne** is a private university located in La Verne, California, ranked #196 in US News National Universities with a 48.5% acceptance rate and a the university of la verne has been a test-optional institution since 2020 for first-time freshmen, meaning sat or act scores are not required for admission. applicants may choose to submit sat or act scores if they believe it strengthens their application or for scholarship consideration; submitting scores can only help and will not harm an applicant's chances. test scores can be sent directly from the testing agency or as part of the official high school transcript. superscoring is allowed. transfer students are admitted based on their college-level work and are not impacted by the test-optional policy. testing policy.\n\n**Admissions:** SAT middle 50%: 1003-1325. ACT middle 50%: 18-25. GPA middle 50%: 3.30-3.65.\n\n**Academics:** The university comprises 5 colleges/schools including College of Arts and Sciences, College of Business and Public Management, LaFetra College of Education, College of Health and Community Well-Being. Inclusive Private University with a Strong Social Mobility Mission.\n\n**Outcomes:** Graduates have median earnings of $52,000 ten years after graduation, top employers include Google, Goldman Sachs, McKinsey & Company.", "media": null, "indexed_at": "2026-01-01T00:08:08.594821+00:00", "last_updated": "2024-07-30"}, {"university_id": "stevens_institute_of_technology", "official_name": "Stevens Institute of Technology", "location": {"city": "Hoboken", "state": "NJ", "type": "Private"}, "acceptance_rate": 48.0, "soft_fit_category": "TARGET", "market_position": "Elite Private", "us_news_rank": 80, "summary": "**Stevens Institute of Technology** is a private university located in Hoboken, NJ, ranked #80 in US News National Universities with a 48.0% acceptance rate and a test optional testing policy.\n\n**Admissions:** SAT middle 50%: 1380-1505. ACT middle 50%: 31-34. ED acceptance rate: 72.0%.\n\n**Academics:** The university comprises 4 colleges/schools including Charles V. Schaefer Jr. School of Engineering and Science, School of Business, School of Humanities, Arts and Social Sciences, School of Systems and Enterprises. Elite Private.\n\n**Outcomes:** Graduates have median earnings of $108,772 ten years after graduation, 37.8% pursue graduate studies, top employers include Goldman Sachs, JPMorgan Chase, Deloitte.", "media": null, "indexed_at": "2026-01-01T00:08:09.592287+00:00", "last_updated": "2025-12-07"}, {"university_id": "University_of_Chicago", "official_name": "The University of Chicago", "location": {"city": "Chicago", "state": "IL", "type": "Private"}, "acceptance_rate": 4.5, "soft_fit_category": "SUPER_REACH", "market_position": "Elite Private", "us_news_rank": 6, "summary": "**The University of Chicago** is a private university located in Chicago, IL, ranked #6 in US News National Universities with a 4.5% acceptance rate and a test optional testing policy.\n\n**Admissions:** SAT middle 50%: 1510-1560. ACT middle 50%: 34-35. GPA middle 50%: 4.10-4.50. EA acceptance rate: None%.\n\n**Academics:** The university comprises 1 colleges/schools including The College of the University of Chicago. Elite Private.\n\n**Outcomes:** Graduates have median earnings of $91,885 ten years after graduation, 29.0% pursue graduate studies, top employers include McKinsey & Company, Bain Capital, Nike.", "media": null, "indexed_at": "2026-01-01T00:08:10.582710+00:00", "last_updated": "2025-12-07"}, {"university_id": "western_michigan_university", "official_name": "Western Michigan University", "location": {"city": "Kalamazoo", "state": "Michigan", "region": "", "type": "main_campus"}, "acceptance_rate": 84.6, "soft_fit_category": "SAFETY", "market_position": "A regional public research university known for strong engineering and aviation programs, with a growing emphasis on health sciences. Competes with other Michigan publics like Central Michigan and Eastern Michigan, but holds a distinct position with its research profile and specific program strengths.", "us_news_rank": 269, "summary": "**Western Michigan University** is a main_campus university located in Kalamazoo, Michigan, ranked #269 in US News National Universities with a 84.6% acceptance rate and a western michigan university has a test-optional policy, meaning students are not required to submit act or sat scores for admission or scholarship consideration. applicants may submit scores if they believe it will strengthen their application, and doing so will not disadvantage them. wmu superscores both act and sat, using the highest subscores from any test date. enrolling students who had test scores used in their admission decision will need to provide official scores for course placement prior to new student orientation. testing policy.\n\n**Admissions:** SAT middle 50%: 990-1220. ACT middle 50%: 20-27. GPA middle 50%: 3.00-3.85. EA acceptance rate: 88.48%.\n\n**Academics:** The university comprises 10 colleges/schools including College of Arts and Sciences, College of Aviation, College of Education and Human Development, College of Engineering and Applied Sciences. A regional public research university known for strong engineering and aviation programs, with a growing emphasis on health sciences. Competes with other Michigan publics like Central Michigan and Eastern Michigan, but holds a distinct position with its research profile and specific program strengths..\n\n**Outcomes:** Graduates have median earnings of $48,900 ten years after graduation, 94.0% employment rate within 2 years, 19.0% pursue graduate studies, top employers include Google, Goldman Sachs, McKinsey & Company.", "media": null, "indexed_at": "2026-01-01T00:08:11.572221+00:00", "last_updated": "2023-10-27"}, {"university_id": "george_washington_university", "official_name": "George Washington University", "location": {"city": "Washington", "state": "DC", "type": "Private"}, "acceptance_rate": 47.1, "soft_fit_category": "TARGET", "market_position": "Elite Private", "us_news_rank": 60, "summary": "**George Washington University** is a private university located in Washington, DC, ranked #60 in US News National Universities with a 47.1% acceptance rate and a test optional testing policy.\n\n**Admissions:** SAT middle 50%: 1360-1490. ACT middle 50%: 30-33. ED acceptance rate: 66.3%.\n\n**Academics:** The university comprises 8 colleges/schools including Columbian College of Arts & Sciences, Corcoran School of the Arts & Design, School of Business, School of Engineering & Applied Science. Elite Private.\n\n**Outcomes:** Graduates have median earnings of $90,873 ten years after graduation, top employers include Google, Amazon, Deloitte.", "media": null, "indexed_at": "2026-01-01T00:08:12.573397+00:00", "last_updated": "2025-12-07"}, {"university_id": "university_of_massachusetts_lowell", "official_name": "University of Massachusetts Lowell", "location": {"city": "Lowell", "state": "Massachusetts", "type": "Public"}, "acceptance_rate": 83.04, "soft_fit_category": "SAFETY", "market_position": "Public Research University with High ROI", "us_news_rank": 92, "summary": "**University of Massachusetts Lowell** is a public university located in Lowell, Massachusetts, ranked #92 in US News National Universities with a 83.04% acceptance rate and a umass lowell offers a 'no test option' for most applicants. standardized test scores (sat/act) are optional for the majority of first-year applicants for spring and fall 2026. however, test scores may be required for some home-schooled and international applicants. international first-year applicants can waive sat/act and english proficiency exams if their secondary institution provides written verification that the means of instruction is in english, they are enrolled in an ib curriculum, attend an american school, or are enrolled in a curriculum that leads to cambridge international examinations. applicants with a strong gpa (3.000 or higher) and evidence of outstanding academic success throughout high school are encouraged to use the no test option, especially if their test scores are below the suggested minimums (sat 1120, act 23). applicants who scored 1120 or higher on the sat or 23 or higher on the act are considered good candidates to submit test scores. testing policy.\n\n**Admissions:** SAT middle 50%: 1180-1350. ACT middle 50%: 25-32. GPA middle 50%: 3.60-3.85. EA acceptance rate: None%.\n\n**Academics:** The university comprises 5 colleges/schools including College of Fine Arts, Humanities and Social Sciences, Francis College of Engineering, Kennedy College of Sciences, Manning School of Business. Public Research University with High ROI.\n\n**Outcomes:** Graduates have median earnings of $64,874 ten years after graduation, 94.0% employment rate within 2 years, 25.5% pursue graduate studies, top employers include McKinsey & Company, Deloitte, Goldman Sachs.", "media": null, "indexed_at": "2026-01-01T00:08:13.582838+00:00", "last_updated": "2024-07-30"}, {"university_id": "old_dominion_university", "official_name": "Old Dominion University", "location": {"city": "Norfolk", "state": "Virginia", "region": "", "type": "main_campus"}, "acceptance_rate": 90.5, "soft_fit_category": "SAFETY", "market_position": "Regional public university known for strong STEM programs and online education, particularly in engineering and health sciences.", "us_news_rank": 200, "summary": "**Old Dominion University** is a main_campus university located in Norfolk, Virginia, ranked #200 in US News National Universities with a 90.5% acceptance rate and a old dominion university does not consider sat or act test scores for undergraduate admission or standard scholarship consideration. submitting test scores is not required and will not impact your application review. however, students may choose to submit test scores for class placement purposes or to be considered for certain additional funding opportunities, such as endowed scholarships. while test scores are optional, submitting strong scores can help strengthen an application, especially for competitive programs or specific departments that may still consider them. testing policy.\n\n**Admissions:** SAT middle 50%: 1120-1270. ACT middle 50%: 24-29. GPA middle 50%: 3.80-4.20. EA acceptance rate: 86.61%.\n\n**Academics:** The university comprises 12 colleges/schools including College of Arts and Letters, Strome College of Business, Darden College of Education and Professional Studies, Frank Batten College of Engineering and Technology. Regional public university known for strong STEM programs and online education, particularly in engineering and health sciences..\n\n**Outcomes:** Graduates have median earnings of $47,600 ten years after graduation, 94.0% employment rate within 2 years.", "media": null, "indexed_at": "2026-01-01T00:08:14.667423+00:00", "last_updated": "2024-07-30"}, {"university_id": "seton_hall_university", "official_name": "Seton Hall University", "location": {"city": "South Orange", "state": "New Jersey", "type": "main_campus"}, "acceptance_rate": 69.0, "soft_fit_category": "SAFETY", "market_position": "Regional leader in Catholic higher education, strong in business and law programs, with a growing health sciences footprint.", "us_news_rank": 137, "summary": "**Seton Hall University** is a main_campus university located in South Orange, New Jersey, ranked #137 in US News National Universities with a 69.0% acceptance rate and a seton hall university will not require standardized test scores (sat or act) for undergraduate admission through the fall 2029 admissions cycle. students have the option to submit scores or not. applications are reviewed holistically, with the high school record being of primary importance. while not mandatory, submitting scores (sat 1200 / act 25 or higher) is encouraged as they can provide additional information and may be required for specific academic programs, selected scholarship opportunities, and waiving placement tests. students who do not submit scores will not be penalized. seton hall super-scores the act and sat. students with 24 or more college credits or who graduated high school at least five years ago are not required to submit test scores. testing policy.\n\n**Admissions:** SAT middle 50%: 1220-1400. ACT middle 50%: 27-32. GPA middle 50%: 3.50-3.85.\n\n**Academics:** The university comprises 7 colleges/schools including College of Arts and Sciences, Stillman School of Business, School of Health and Medical Sciences, College of Human Development, Culture, and Media. Regional leader in Catholic higher education, strong in business and law programs, with a growing health sciences footprint..\n\n**Outcomes:** Graduates have median earnings of $62,700 ten years after graduation, 97.2% employment rate within 2 years, 22.5% pursue graduate studies, top employers include Amazon, Deloitte, Goldman Sachs.", "media": null, "indexed_at": "2026-01-01T00:08:15.680813+00:00", "last_updated": "2023-10-27"}, {"university_id": "brown_university", "official_name": "Brown University", "location": {"city": "Providence", "state": "RI", "type": "Private"}, "acceptance_rate": 5.65, "soft_fit_category": "SUPER_REACH", "market_position": "Elite Private", "us_news_rank": 13, "summary": "**Brown University** is a private university located in Providence, RI, ranked #13 in US News National Universities with a 5.65% acceptance rate and a test required testing policy.\n\n**Admissions:** SAT middle 50%: 1510-1560. ACT middle 50%: 34-35. ED acceptance rate: 17.95%.\n\n**Academics:** The university comprises 7 colleges/schools including The College, School of Engineering, Warren Alpert Medical School, School of Public Health. Elite Private.\n\n**Outcomes:** Graduates have median earnings of $87,600 ten years after graduation, 25.0% pursue graduate studies, top employers include Google, Microsoft, Amazon.", "media": null, "indexed_at": "2026-01-01T00:08:16.771840+00:00", "last_updated": "2025-12-24"}, {"university_id": "rutgers_university_new_brunswick", "official_name": "Rutgers University-New Brunswick", "location": {"city": "New Brunswick", "state": "NJ", "type": "Public"}, "acceptance_rate": 58.1, "soft_fit_category": "SAFETY", "market_position": "Public Ivy", "us_news_rank": 42, "summary": "**Rutgers University-New Brunswick** is a public university located in New Brunswick, NJ, ranked #42 in US News National Universities with a 58.1% acceptance rate and a test optional testing policy.\n\n**Admissions:** SAT middle 50%: 1270-1480. ACT middle 50%: 28-33. GPA middle 50%: 3.80-4.30.\n\n**Academics:** The university comprises 12 colleges/schools including School of Arts and Sciences, School of Engineering, Rutgers Business School\u2013Newark and New Brunswick, Mason Gross School of the Arts. Public Ivy.\n\n**Outcomes:** Graduates have median earnings of $74,479 ten years after graduation, top employers include RWJBarnabas Health, Amazon, Lockheed Martin.", "media": null, "indexed_at": "2026-01-01T00:08:17.782845+00:00", "last_updated": "2025-12-07"}, {"university_id": "clarkson_university", "official_name": "Clarkson University", "location": {"city": "Potsdam", "state": "New York", "type": "Private"}, "acceptance_rate": 77.38, "soft_fit_category": "SAFETY", "market_position": "Hidden Gem (STEM-focused with high ROI)", "us_news_rank": 143, "summary": "**Clarkson University** is a private university located in Potsdam, New York, ranked #143 in US News National Universities with a 77.38% acceptance rate and a clarkson university is test-optional. for u.s. high school students, unofficial sat and act scores are accepted for application, but official scores are required upon enrollment. international students attending high school outside the u.s. are required to submit official standardized testing, and toefl or ielts scores must be official. the admissions team evaluates applications holistically, considering factors such as course load, course type, letters of recommendation, and all four years of high school. testing policy.\n\n**Admissions:** SAT middle 50%: 1215-1380. ACT middle 50%: 26-31. GPA middle 50%: 3.50-4.00. ED acceptance rate: None%.\n\n**Academics:** The university comprises 5 colleges/schools including Wallace H. Coulter School of Engineering and Applied Sciences, David D. Reh School of Business, Earl R. and Barbara D. Lewis School of Health and Life Sciences, School of Arts & Sciences. Hidden Gem (STEM-focused with high ROI).\n\n**Outcomes:** Graduates have median earnings of $70,800 ten years after graduation, 35.0% pursue graduate studies, top employers include Amazon, Microsoft, Lockheed Martin.", "media": null, "indexed_at": "2026-01-01T00:08:19.879397+00:00", "last_updated": "2024-05-15"}, {"university_id": "massachusetts_institute_of_technology", "official_name": "Massachusetts Institute of Technology", "location": {"city": "Cambridge", "state": "MA", "type": "Private"}, "acceptance_rate": 4.6, "soft_fit_category": "SUPER_REACH", "market_position": "Elite Private", "us_news_rank": 2, "summary": "**Massachusetts Institute of Technology** is a private university located in Cambridge, MA, ranked #2 in US News National Universities with a 4.6% acceptance rate and a test required testing policy.\n\n**Admissions:** SAT middle 50%: 1520-1580. ACT middle 50%: 34-36. EA acceptance rate: 5.98%.\n\n**Academics:** The university comprises 6 colleges/schools including School of Architecture and Planning, School of Engineering, School of Humanities, Arts, and Social Sciences, MIT Sloan School of Management. Elite Private.\n\n**Outcomes:** Graduates have median earnings of $143,372 ten years after graduation, 49% pursue graduate studies, top employers include McKinsey & Company, Bain & Company, Boston Consulting Group.", "media": null, "indexed_at": "2026-01-01T00:08:20.879051+00:00", "last_updated": "2025-12-24"}, {"university_id": "university_of_iowa", "official_name": "The University of Iowa", "location": {"city": "Iowa City", "state": "IA", "type": "Public"}, "acceptance_rate": 83.6, "soft_fit_category": "SAFETY", "market_position": "Public Flagship", "us_news_rank": 98, "summary": "**The University of Iowa** is a public university located in Iowa City, IA, ranked #98 in US News National Universities with a 83.6% acceptance rate and a test optional (scores only used if they benefit the applicant for admission and scholarships) testing policy.\n\n**Admissions:** SAT middle 50%: 1130-1320. ACT middle 50%: 22-28.\n\n**Academics:** The university comprises 10 colleges/schools including College of Liberal Arts and Sciences, Tippie College of Business, College of Engineering, College of Nursing. Public Flagship.\n\n**Outcomes:** Graduates have median earnings of $64,762 ten years after graduation, 21.0% pursue graduate studies, top employers include UIHC - University of Iowa Health Care, RSM US LLP, PricewaterhouseCoopers, Inc..", "media": null, "indexed_at": "2026-01-01T00:08:21.984794+00:00", "last_updated": "2025-12-07"}, {"university_id": "university_of_dayton", "official_name": "University of Dayton", "location": {"city": "Dayton", "state": "Ohio", "type": "Private"}, "acceptance_rate": 61.65, "soft_fit_category": "SAFETY", "market_position": "Strong regional player with growing national recognition for experiential learning.", "us_news_rank": 100, "summary": "**University of Dayton** is a private university located in Dayton, Ohio, ranked #100 in US News National Universities with a 61.65% acceptance rate and a the university of dayton is test-optional, allowing applicants the choice to submit standardized test scores if they wish. test scores are considered in the admission process if submitted. the university permits self-reporting of test scores and utilizes superscoring for the sat, considering the highest section scores across all submitted test dates. testing policy.\n\n**Admissions:** SAT middle 50%: 1200-1360. ACT middle 50%: 24-31. GPA middle 50%: 3.30-3.70.\n\n**Academics:** The university comprises 4 colleges/schools including College of Arts and Sciences, School of Business Administration, School of Education and Health Sciences, School of Engineering. Strong regional player with growing national recognition for experiential learning..\n\n**Outcomes:** Graduates have median earnings of $87,600 ten years after graduation, 97.0% employment rate within 2 years, top employers include Google, Apple, Microsoft.", "media": null, "indexed_at": "2026-01-01T00:08:22.975129+00:00", "last_updated": "2023-10-27"}, {"university_id": "university_of_new_mexico", "official_name": "University of New Mexico", "location": {"city": "Albuquerque", "state": "New Mexico", "type": "Public"}, "acceptance_rate": 95.18, "soft_fit_category": "SAFETY", "market_position": "Public Flagship Research University", "us_news_rank": 242, "summary": "**University of New Mexico** is a public university located in Albuquerque, New Mexico, ranked #242 in US News National Universities with a 95.18% acceptance rate and a the university of new mexico is a test-optional institution that allows self-reporting of standardized test scores (act, sat, or clt). applicants are not required to submit scores for admission, but they may be helpful in some cases and are considered if provided. if scores are submitted, they should be sent from the testing service, but scores reported on the high school transcript will also be accepted. no preference is given to either score type, and the writing sub-section of the sat is not needed or considered. the highest available act composite scores or the highest sat total scores (critical reading and mathematics sub-scores) are\ub97c used when necessary. testing policy.\n\n**Admissions:** SAT middle 50%: 900-1160. ACT middle 50%: 19-26. GPA middle 50%: 3.40-4.20.\n\n**Academics:** The university comprises 11 colleges/schools including College of Arts & Sciences, School of Engineering, Anderson School of Management, College of Education & Human Sciences. Public Flagship Research University.\n\n**Outcomes:** Graduates have median earnings of $42,700 ten years after graduation, top employers include Amazon, Microsoft, Deloitte.", "media": null, "indexed_at": "2026-01-01T00:08:23.979756+00:00", "last_updated": "2024-07-30"}, {"university_id": "duke_university", "official_name": "Duke University", "location": {"city": "Durham", "state": "North Carolina", "type": "Private"}, "acceptance_rate": 4.8, "soft_fit_category": "SUPER_REACH", "market_position": "Elite Private", "us_news_rank": 7, "summary": "**Duke University** is a private university located in Durham, North Carolina, ranked #7 in US News National Universities with a 4.8% acceptance rate and a test optional testing policy.\n\n**Admissions:** SAT middle 50%: 1510-1560. ACT middle 50%: 34-35. ED acceptance rate: 12.8%.\n\n**Academics:** The university comprises 2 colleges/schools including Trinity College of Arts & Sciences, Pratt School of Engineering. Elite Private.\n\n**Outcomes:** Graduates have median earnings of $108,900 ten years after graduation, 20.0% pursue graduate studies, top employers include Google, Apple, Microsoft.", "media": null, "indexed_at": "2026-01-01T00:08:24.985656+00:00", "last_updated": "2025-12-24"}, {"university_id": "columbia_university", "official_name": "Columbia University in the City of New York", "location": {"city": "New York City", "state": "New York", "type": "Private"}, "acceptance_rate": 4.9, "soft_fit_category": "SUPER_REACH", "market_position": "Elite Private", "us_news_rank": 15, "summary": "**Columbia University in the City of New York** is a private university located in New York City, New York, ranked #15 in US News National Universities with a 4.9% acceptance rate and a test optional testing policy.\n\n**Admissions:** SAT middle 50%: 1510-1560. ACT middle 50%: 34-36. GPA middle 50%: 4.10-4.30. ED acceptance rate: 11.9%.\n\n**Academics:** The university comprises 4 colleges/schools including Columbia College, The Fu Foundation School of Engineering and Applied Science (Columbia Engineering), School of General Studies, Barnard College. Elite Private.\n\n**Outcomes:** Graduates have median earnings of $102,491 ten years after graduation, top employers include Deloitte, Amazon, Ernst & Young (EY).", "media": null, "indexed_at": "2026-01-01T00:08:25.996083+00:00", "last_updated": "2025-12-07"}, {"university_id": "brandeis_university", "official_name": "Brandeis University", "location": {"city": "Waltham", "state": "MA", "type": "Private"}, "acceptance_rate": 40.5, "soft_fit_category": "TARGET", "market_position": "Elite Private", "us_news_rank": 63, "summary": "**Brandeis University** is a private university located in Waltham, MA, ranked #63 in US News National Universities with a 40.5% acceptance rate and a test optional for domestic students; international undergraduate applicants are required to submit sat or act scores. testing policy.\n\n**Admissions:** SAT middle 50%: 1410-1510. ACT middle 50%: 31-34. ED acceptance rate: 42.2%.\n\n**Academics:** The university comprises 4 colleges/schools including School of Arts, Humanities and Culture, School of Business and Economics, School of Science, Engineering and Technology, School of Social Sciences and Social Policy. Elite Private.\n\n**Outcomes:** Graduates have median earnings of $66,700 ten years after graduation, 93.0% employment rate within 2 years, 43.0% pursue graduate studies, top employers include Google, Deloitte, Amazon.", "media": null, "indexed_at": "2026-01-01T00:08:26.986688+00:00", "last_updated": "2025-12-07"}, {"university_id": "baylor_university", "official_name": "Baylor University", "location": {"city": "Waco", "state": "TX", "type": "Private"}, "acceptance_rate": 51.2, "soft_fit_category": "SAFETY", "market_position": "Elite Private", "us_news_rank": 88, "summary": "**Baylor University** is a private university located in Waco, TX, ranked #88 in US News National Universities with a 51.2% acceptance rate and a baylor university will be test optional through the entering class of fall 2026. applicants may choose whether or not to submit sat or act results; if submitted, they will be considered, but if a student indicates they wish to be test optional, scores will not be considered. some applicants, such as those who are homeschooled, attend high schools with narrative evaluations only, or are graduating high school early, are required to submit test scores. testing policy.\n\n**Admissions:** SAT middle 50%: 1230-1430. ACT middle 50%: 27-33. ED acceptance rate: 30.0%.\n\n**Academics:** The university comprises 12 colleges/schools including College of Arts & Sciences, Diana R. Garland School of Social Work, Hankamer School of Business, Honors College. Elite Private.\n\n**Outcomes:** Graduates have median earnings of $65,793 ten years after graduation, 90.0% employment rate within 2 years, top employers include Deloitte, KPMG, JPMorgan Chase & Co..", "media": null, "indexed_at": "2026-01-01T00:08:28.076800+00:00", "last_updated": "2025-12-07"}, {"university_id": "loyola_marymount_university", "official_name": "Loyola Marymount University", "location": {"city": "Los Angeles", "state": "CA", "type": "Private"}, "acceptance_rate": 45.1, "soft_fit_category": "TARGET", "market_position": "Elite Private", "us_news_rank": 102, "summary": "**Loyola Marymount University** is a private university located in Los Angeles, CA, ranked #102 in US News National Universities with a 45.1% acceptance rate and a test optional testing policy.\n\n**Admissions:** SAT middle 50%: 1280-1400. ACT middle 50%: 28-32. EA acceptance rate: 58.5%.\n\n**Academics:** The university comprises 7 colleges/schools including Bellarmine College of Liberal Arts, College of Business Administration, College of Communication and Fine Arts, Frank R. Seaver College of Science and Engineering. Elite Private.\n\n**Outcomes:** Graduates have median earnings of $78,349 ten years after graduation, 92.0% employment rate within 2 years, 27.0% pursue graduate studies, top employers include Apple, Google, Microsoft.", "media": null, "indexed_at": "2026-01-01T00:08:29.177637+00:00", "last_updated": "2025-12-07"}, {"university_id": "north_carolina_state_university", "official_name": "North Carolina State University", "location": {"city": "Raleigh", "state": "NC", "type": "Public"}, "acceptance_rate": 39.46, "soft_fit_category": "TARGET", "market_position": "Public Ivy", "us_news_rank": 60, "summary": "**North Carolina State University** is a public university located in Raleigh, NC, ranked #60 in US News National Universities with a 39.46% acceptance rate and a test-optional for first-year applicants with a weighted gpa of 2.8 or above; applicants with a weighted gpa below 2.8 are required to submit test scores. testing policy.\n\n**Admissions:** SAT middle 50%: 1290-1440. ACT middle 50%: 25-32. GPA middle 50%: 4.2-4.5.\n\n**Academics:** The university comprises 11 colleges/schools including College of Agriculture and Life Sciences, College of Design, College of Education, College of Engineering. Public Ivy.\n\n**Outcomes:** Graduates have median earnings of $57,200 ten years after graduation, top employers include Bank of America, Deloitte, EY.", "media": null, "indexed_at": "2026-01-01T00:08:30.183051+00:00", "last_updated": "2025-12-07"}, {"university_id": "elon_university", "official_name": "Elon University", "location": {"city": "Elon", "state": "North Carolina", "type": "main_campus"}, "acceptance_rate": 66.35, "soft_fit_category": "SAFETY", "market_position": "Nationally recognized for experiential learning and student success, particularly in liberal arts and professional programs.", "us_news_rank": 9, "summary": "**Elon University** is a main_campus university located in Elon, North Carolina, ranked #9 in US News National Universities with a 66.35% acceptance rate and a elon university has a test-optional admissions policy for most applicants for the 2024-2025 application cycle and beyond. this means students have the choice to submit sat or act scores. standardized test scores are required for homeschooled students and those applying to the bachelor of science in nursing (bsn) program. international applicants attending a school where english is not the primary language of instruction must demonstrate english proficiency by submitting toefl, ielts, or duolingo english test scores. elon accepts self-reported sat or act scores on the application, but official scores will be required upon admission and before enrollment. the university practices 'superscoring' for the sat, considering the highest section scores across all submitted test dates. testing policy.\n\n**Admissions:** SAT middle 50%: 1130-1320. ACT middle 50%: 24-30. GPA middle 50%: N/A. ED acceptance rate: 56.0%.\n\n**Academics:** The university comprises 7 colleges/schools including Elon College, the College of Arts and Sciences, Martha and Spencer Love School of Business, School of Communications, Dr. Jo Watts Williams School of Education. Nationally recognized for experiential learning and student success, particularly in liberal arts and professional programs..\n\n**Outcomes:** Graduates have median earnings of $74,545 ten years after graduation, 96.0% employment rate within 2 years, 17.0% pursue graduate studies, top employers include JPMorgan Chase & Co., Goldman Sachs, Morgan Stanley.", "media": null, "indexed_at": "2026-01-01T00:08:31.174827+00:00", "last_updated": "2024-07-30"}, {"university_id": "northeastern_university", "official_name": "Northeastern University", "location": {"city": "Boston", "state": "Massachusetts", "type": "Private"}, "acceptance_rate": 5.2, "soft_fit_category": "SUPER_REACH", "market_position": "Elite Private", "us_news_rank": 46, "summary": "**Northeastern University** is a private university located in Boston, Massachusetts, ranked #46 in US News National Universities with a 5.2% acceptance rate and a test optional testing policy.\n\n**Admissions:** SAT middle 50%: 1460-1550. ACT middle 50%: 33-35. GPA middle 50%: 4.2-4.5. ED acceptance rate: 39.0%.\n\n**Academics:** The university comprises 10 colleges/schools including Bouv\u00e9 College of Health Sciences, College of Arts, Media and Design, College of Engineering, College of Professional Studies. Elite Private.\n\n**Outcomes:** Graduates have median earnings of $92,538 ten years after graduation, 13.3% pursue graduate studies, top employers include Goldman Sachs, Deloitte, Amazon Inc..", "media": null, "indexed_at": "2026-01-01T00:08:32.273550+00:00", "last_updated": "2025-12-07"}, {"university_id": "gonzaga_university", "official_name": "Gonzaga University", "location": {"city": "Spokane", "state": "Washington", "type": "Private"}, "acceptance_rate": 81.7, "soft_fit_category": "SAFETY", "market_position": "Elite Private", "us_news_rank": 102, "summary": "**Gonzaga University** is a private university located in Spokane, Washington, ranked #102 in US News National Universities with a 81.7% acceptance rate and a test optional testing policy.\n\n**Admissions:** SAT middle 50%: 1220-1410. ACT middle 50%: 27-31. EA acceptance rate: None%.\n\n**Academics:** The university comprises 6 colleges/schools including College of Arts and Sciences, School of Business Administration, School of Education, School of Engineering and Applied Science. Elite Private.\n\n**Outcomes:** Graduates have median earnings of $78,892 ten years after graduation, 15.1% pursue graduate studies, top employers include Providence Health & Services / Swedish, Gonzaga University, Deloitte.", "media": null, "indexed_at": "2026-01-01T00:08:33.371118+00:00", "last_updated": "2025-12-07"}, {"university_id": "california_state_university_long_beach", "official_name": "California State University, Long Beach", "location": {"city": "Long Beach", "state": "California", "type": "Public"}, "acceptance_rate": 46.27, "soft_fit_category": "TARGET", "market_position": "A large, diverse public university recognized for its exceptional value, strong academic programs (especially in engineering and arts), and significant regional employment outcomes, particularly within the Southern California market.", "us_news_rank": 13, "summary": "**California State University, Long Beach** is a public university located in Long Beach, California, ranked #13 in US News National Universities with a 46.27% acceptance rate and a for the 2024-2025 application cycle, california state university, long beach is test-blind, meaning sat or act scores are not considered for admission. however, scores may be used to meet english language requirements or for placement tests. testing policy.\n\n**Admissions:** SAT middle 50%: 1040-1250. ACT middle 50%: 20-26. GPA middle 50%: Data not explicitly available in provided sources, but average weighted GPA is 3.7. Weighted GPAs can exceed 4.0 due to honors/AP/IB courses..\n\n**Academics:** The university comprises 8 colleges/schools including College of the Arts, College of Business, College of Education, College of Engineering. A large, diverse public university recognized for its exceptional value, strong academic programs (especially in engineering and arts), and significant regional employment outcomes, particularly within the Southern California market..\n\n**Outcomes:** Graduates have median earnings of $64,403 ten years after graduation, top employers include Deloitte, Morgan Stanley, Goldman Sachs.", "media": null, "indexed_at": "2026-01-01T00:07:33.196098+00:00", "last_updated": "2024-05-15"}, {"university_id": "rowan_university", "official_name": "Rowan University", "location": {"city": "Glassboro", "state": "New Jersey", "type": "Public"}, "acceptance_rate": 77.66, "soft_fit_category": "SAFETY", "market_position": "A rapidly growing public research university with strong engineering, medical, and performing arts programs, increasingly recognized for innovation and affordability in the New Jersey higher education landscape.", "us_news_rank": 170, "summary": "**Rowan University** is a public university located in Glassboro, New Jersey, ranked #170 in US News National Universities with a 77.66% acceptance rate and a rowan university offers a test-optional admissions policy, allowing prospective students to apply without submitting sat or act scores. this approach is designed to provide a more holistic review of applicants, focusing on their high school performance, extracurricular activities, leadership experiences, and personal essays. students applying for the 3+4 bs/md or bs/do program or the 3+2 physicians assistant program are required to submit test scores. if choosing to submit scores, official sat scores can be sent using ceeb code 2515 and official act scores using college code 2560. rowan uses superscoring for the sat, taking the best section scores across all test dates. while test-optional for admission, accepted students may be required to take placement tests. testing policy.\n\n**Admissions:** SAT middle 50%: 1110-1300. ACT middle 50%: 23-29. GPA middle 50%: 3.30-3.50.\n\n**Academics:** The university comprises 11 colleges/schools including William G. Rohrer College of Business, College of Education, Henry M. Rowan College of Engineering, College of Education. A rapidly growing public research university with strong engineering, medical, and performing arts programs, increasingly recognized for innovation and affordability in the New Jersey higher education landscape..\n\n**Outcomes:** Graduates have median earnings of $53,300 ten years after graduation, 35.0% pursue graduate studies, top employers include Amazon, Deloitte, Goldman Sachs.", "media": null, "indexed_at": "2026-01-01T00:08:34.375834+00:00", "last_updated": "2024-07-30"}, {"university_id": "university_of_minnesota_twin_cities", "official_name": "University of Minnesota Twin Cities", "location": {"city": "Minneapolis and Saint Paul", "state": "MN", "type": "Public"}, "acceptance_rate": 79.75, "soft_fit_category": "SAFETY", "market_position": "Public Ivy", "us_news_rank": 59, "summary": "**University of Minnesota Twin Cities** is a public university located in Minneapolis and Saint Paul, MN, ranked #59 in US News National Universities with a 79.75% acceptance rate and a test optional testing policy.\n\n**Admissions:** SAT middle 50%: 1350-1490. ACT middle 50%: 27-33. EA acceptance rate: None%.\n\n**Academics:** The university comprises 8 colleges/schools including College of Liberal Arts, College of Science and Engineering, Carlson School of Management, College of Biological Sciences. Public Ivy.\n\n**Outcomes:** Graduates have median earnings of $69,020 ten years after graduation, top employers include Seagate, Ulteig, Xcel Energy.", "media": null, "indexed_at": "2026-01-01T00:08:35.569095+00:00", "last_updated": "2025-12-07"}, {"university_id": "florida_state_university", "official_name": "Florida State University", "location": {"city": "Tallahassee", "state": "FL", "type": "Public"}, "acceptance_rate": 24.2, "soft_fit_category": "REACH", "market_position": "Public Ivy", "us_news_rank": 56, "summary": "**Florida State University** is a public university located in Tallahassee, FL, ranked #56 in US News National Universities with a 24.2% acceptance rate and a test required testing policy.\n\n**Admissions:** SAT middle 50%: 1330-1410. ACT middle 50%: 29-32. GPA middle 50%: 4.2-4.5. EA acceptance rate: 39.0%.\n\n**Academics:** The university comprises 17 colleges/schools including College of Applied Studies, College of Arts and Sciences, College of Business, College of Communication and Information. Public Ivy.\n\n**Outcomes:** Graduates have median earnings of $61,675 ten years after graduation, top employers include Microsoft, Deloitte, Amazon.", "media": null, "indexed_at": "2026-01-01T00:08:36.673409+00:00", "last_updated": "2025-12-12"}, {"university_id": "suny_college_of_environmental_science_and_forestry", "official_name": "SUNY College of Environmental Science and Forestry", "location": {"city": "Syracuse", "state": "NY", "type": "Public"}, "acceptance_rate": 63.3, "soft_fit_category": "SAFETY", "market_position": "Specialized Public Leader", "us_news_rank": 158, "summary": "**SUNY College of Environmental Science and Forestry** is a public university located in Syracuse, NY, ranked #158 in US News National Universities with a 63.3% acceptance rate and a test optional testing policy.\n\n**Admissions:** SAT middle 50%: 1130-1300. ACT middle 50%: 24-30. EA acceptance rate: None%.\n\n**Academics:** The university comprises 7 colleges/schools including Division of Environmental Science, Department of Landscape Architecture, Department of Environmental Resources Engineering, Department of Environmental Biology. Specialized Public Leader.\n\n**Outcomes:** Graduates have median earnings of $55,763 ten years after graduation, 92.0% employment rate within 2 years, 23.0% pursue graduate studies, top employers include Arcadis, Barton & Loguidice, Davey Tree Expert Company.", "media": null, "indexed_at": "2026-01-01T00:08:37.671956+00:00", "last_updated": "2025-12-19"}, {"university_id": "adelphi_university", "official_name": "Adelphi University", "location": {"city": "Garden City", "state": "New York", "type": "Private"}, "acceptance_rate": 65.91, "soft_fit_category": "SAFETY", "market_position": "Adelphi positions itself as a private, medium-sized university offering a comprehensive liberal arts education with strong professional programs. It targets students seeking a suburban campus experience with easy access to the opportunities of a major metropolitan area, emphasizing career preparedness and community engagement.", "us_news_rank": 166, "summary": "**Adelphi University** is a private university located in Garden City, New York, ranked #166 in US News National Universities with a 65.91% acceptance rate and a adelphi university has adopted a test-optional policy, allowing applicants the option, but not the requirement, to submit sat or act scores. this policy has been extended through fall 2028/spring 2029. merit scholarships are not contingent on submitting test scores. however, some joint degree programs with partner institutions still require the submission of test scores. international students who are non-native english speakers are required to submit english language exam scores, with options including sat, act, toefl, ielts, or duolingo. duolingo has been permanently adopted as an acceptable english language proficiency exam. testing policy.\n\n**Admissions:** SAT middle 50%: 1120-1310. ACT middle 50%: 24-30. GPA middle 50%: N/A. EA acceptance rate: 87.9%.\n\n**Academics:** The university comprises 8 colleges/schools including College of Arts and Sciences, Robert B. Willumstad School of Business, Ruth S. Ammon College of Education and Health Sciences, Honors College. Adelphi positions itself as a private, medium-sized university offering a comprehensive liberal arts education with strong professional programs. It targets students seeking a suburban campus experience with easy access to the opportunities of a major metropolitan area, emphasizing career preparedness and community engagement..\n\n**Outcomes:** Graduates have median earnings of $75,482 ten years after graduation, 95.5% employment rate within 2 years, 18.1% pursue graduate studies, top employers include Deloitte, JPMorgan Chase, Morgan Stanley.", "media": null, "indexed_at": "2026-01-01T00:08:38.674337+00:00", "last_updated": "2024-05-15"}, {"university_id": "university_of_alabama", "official_name": "The University of Alabama", "location": {"city": "Tuscaloosa", "state": "Alabama", "type": "Public"}, "acceptance_rate": 76.65, "soft_fit_category": "SAFETY", "market_position": "Strong regional player with growing national recognition, particularly in business and engineering.", "us_news_rank": 44, "summary": "**The University of Alabama** is a public university located in Tuscaloosa, Alabama, ranked #44 in US News National Universities with a 76.65% acceptance rate and a the university of alabama is test-optional for admissions through the fall 2026 semester. standardized act or sat scores are not required for the admission review, but can be submitted for merit scholarship consideration. the university of alabama system announced on december 18, 2025, that it will reinstate the requirement for standardized test scores for applicants beginning in august 2026 (for fall 2027 entry and beyond). testing policy.\n\n**Admissions:** SAT middle 50%: 1170-1400. ACT middle 50%: 22-30. GPA middle 50%: 3.48-4.21.\n\n**Academics:** The university comprises 8 colleges/schools including J. Frank Barefield Jr. College of Arts and Sciences, Capstone College of Nursing, College of Communication and Information Sciences, College of Education. Strong regional player with growing national recognition, particularly in business and engineering..\n\n**Outcomes:** Graduates have median earnings of $49,900 ten years after graduation, 44.2% pursue graduate studies, top employers include Goldman Sachs, JPMorgan Chase & Co., Morgan Stanley.", "media": null, "indexed_at": "2026-01-01T00:08:39.696109+00:00", "last_updated": "2024-05-15"}, {"university_id": "california_institute_of_technology", "official_name": "California Institute of Technology", "location": {"city": "Pasadena", "state": "CA", "type": "Private"}, "acceptance_rate": 2.3, "soft_fit_category": "SUPER_REACH", "market_position": "Elite Private", "us_news_rank": 11, "summary": "**California Institute of Technology** is a private university located in Pasadena, CA, ranked #11 in US News National Universities with a 2.3% acceptance rate and a test required testing policy.\n\n**Admissions:** SAT middle 50%: 1530-1580. ACT middle 50%: 34-36. GPA middle 50%: 3.9-4.2. REA acceptance rate: 5.0%.\n\n**Academics:** The university comprises 6 colleges/schools including Division of Biology and Biological Engineering, Division of Chemistry and Chemical Engineering, Division of Engineering and Applied Science, Division of Geological and Planetary Sciences. Elite Private.\n\n**Outcomes:** Graduates have median earnings of $128,566 ten years after graduation, 43.0% pursue graduate studies, top employers include Google, NASA, Apple.", "media": null, "indexed_at": "2026-01-01T00:08:40.767527+00:00", "last_updated": "2025-12-07"}, {"university_id": "university_of_delaware", "official_name": "University of Delaware", "location": {"city": "Newark", "state": "DE", "type": "Public"}, "acceptance_rate": 69.23, "soft_fit_category": "SAFETY", "market_position": "Public University with Very High Research Activity", "us_news_rank": 88, "summary": "**University of Delaware** is a public university located in Newark, DE, ranked #88 in US News National Universities with a 69.23% acceptance rate and a test optional testing policy.\n\n**Admissions:** SAT middle 50%: 1200-1360. ACT middle 50%: 27-31. EA acceptance rate: None%.\n\n**Academics:** The university comprises 8 colleges/schools including College of Agriculture and Natural Resources, College of Arts and Sciences, Alfred Lerner College of Business and Economics, College of Earth, Ocean and Environment. Public University with Very High Research Activity.\n\n**Outcomes:** Graduates have median earnings of $72,950 ten years after graduation, top employers include JPMorgan Chase & Co., University of Delaware, EY.", "media": null, "indexed_at": "2026-01-01T00:08:41.767415+00:00", "last_updated": "2025-12-07"}, {"university_id": "university_of_central_florida", "official_name": "University of Central Florida", "location": {"city": "Orlando", "state": "Florida", "type": "Public"}, "acceptance_rate": 44.72, "soft_fit_category": "TARGET", "market_position": "Growing public research university, known for large enrollment, strong STEM programs, and industry partnerships in simulation, aerospace, and optics.", "us_news_rank": 64, "summary": "**University of Central Florida** is a public university located in Orlando, Florida, ranked #64 in US News National Universities with a 44.72% acceptance rate and a all freshmen must submit official sat, act, or clt scores. scores must be reported directly to the university electronically or via u.s. mail. sat and act exam scores are valid if taken within the last five years; clt exam scores are valid if taken july 1, 2023, or later. effective april 2025, the act science section is optional, and ucf no longer requires a science score for admission. if act exams were all taken prior to april 2025, ucf will use all four sections to calculate a superscore. testing policy.\n\n**Admissions:** SAT middle 50%: 1210-1340. ACT middle 50%: 26-30. GPA middle 50%: 3.84-4.51. Early Decision acceptance rate: None%.\n\n**Academics:** The university comprises 10 colleges/schools including Rosen College of Hospitality Management, College of Nursing, College of Engineering and Computer Science, College of Optics and Photonics. Growing public research university, known for large enrollment, strong STEM programs, and industry partnerships in simulation, aerospace, and optics..\n\n**Outcomes:** Graduates have median earnings of $58,308 ten years after graduation, 94.0% employment rate within 2 years, 35.0% pursue graduate studies, top employers include Google, Amazon, Apple.", "media": null, "indexed_at": "2026-01-01T00:08:42.770568+00:00", "last_updated": "2024-07-29"}, {"university_id": "university_of_kentucky", "official_name": "University of Kentucky", "location": {"city": "Lexington", "state": "KY", "type": "main_campus"}, "acceptance_rate": 92.96, "soft_fit_category": "SAFETY", "market_position": "Strong regional presence with growing national recognition in health sciences and engineering.", "us_news_rank": 65, "summary": "**University of Kentucky** is a main_campus university located in Lexington, KY, ranked #65 in US News National Universities with a 92.96% acceptance rate and a the university of kentucky is test-optional for admission through the 2028-29 academic year for most freshman applicants and transfer applicants with fewer than 24 credit hours. students are not required to submit act or sat scores. however, submitting scores is optional and can strengthen an application, especially if the gpa is lower. submitted test scores must be official and are considered as part of a holistic review process. the university evaluates applicants without test scores by reviewing the rigor of high school coursework, extracurricular activities, and a written essay. testing policy.\n\n**Admissions:** GPA middle 50%: 3.20-4.00.\n\n**Academics:** The university comprises 18 colleges/schools including Martin-Gatton College of Agriculture, Food and Environment, College of Arts and Sciences, Gatton College of Business and Economics, College of Communication & Information. Strong regional presence with growing national recognition in health sciences and engineering..\n\n**Outcomes:** Graduates have median earnings of $51,000 ten years after graduation, top employers include Google, Goldman Sachs, McKinsey & Company.", "media": null, "indexed_at": "2026-01-01T00:08:43.783353+00:00", "last_updated": "2024-06-03"}, {"university_id": "vanderbilt_university", "official_name": "Vanderbilt University", "location": {"city": "Nashville", "state": "TN", "type": "Private"}, "acceptance_rate": 4.7, "soft_fit_category": "SUPER_REACH", "market_position": "Elite Private", "us_news_rank": 17, "summary": "**Vanderbilt University** is a private university located in Nashville, TN, ranked #17 in US News National Universities with a 4.7% acceptance rate and a test optional testing policy.\n\n**Admissions:** SAT middle 50%: 1510-1560. ACT middle 50%: 34-35. GPA middle 50%: 4.10-4.30. ED acceptance rate: 13.2%.\n\n**Academics:** The university comprises 4 colleges/schools including College of Arts and Science, School of Engineering, Peabody College of Education and Human Development, Blair School of Music. Elite Private.\n\n**Outcomes:** Graduates have median earnings of $91,565 ten years after graduation, 25.0% pursue graduate studies, top employers include Google, Capital One, Vanderbilt University Medical Center (VUMC).", "media": null, "indexed_at": "2026-01-01T00:08:44.867745+00:00", "last_updated": "2025-12-07"}, {"university_id": "east_carolina_university", "official_name": "East Carolina University", "location": {"city": "Greenville", "state": "North Carolina", "type": "Public"}, "acceptance_rate": 89.21, "soft_fit_category": "SAFETY", "market_position": "Positioned as a key regional anchor institution in Eastern North Carolina, ECU serves a diverse student body, offering a broad range of undergraduate and graduate programs. Its market strength lies in healthcare education, business, and arts, often attracting students seeking career-oriented degrees with a strong experiential learning component.", "us_news_rank": 216, "summary": "**East Carolina University** is a public university located in Greenville, North Carolina, ranked #216 in US News National Universities with a 89.21% acceptance rate and a for fall 2025 and spring 2026 terms, students with a weighted high school gpa less than 2.8 are required to submit a standardized test score (act or sat). students with a weighted high school gpa of 2.8 or higher are not required to submit a test score. for fall 2026 semester and beyond, students with a weighted high school gpa greater than or equal to 2.50 and less than 2.80 are required to submit a standardized test score of a 17 or higher on the act or a 930 or higher on the sat. all first-year students may choose to send sat or act scores if they want them considered as part of the admissions review. testing policy.\n\n**Admissions:** SAT middle 50%: 1050-1200. ACT middle 50%: 20-26. GPA middle 50%: 3.3-4.0.\n\n**Academics:** The university comprises 8 colleges/schools including Thomas Harriot College of Arts and Sciences, College of Business, College of Education, College of Engineering and Technology. Positioned as a key regional anchor institution in Eastern North Carolina, ECU serves a diverse student body, offering a broad range of undergraduate and graduate programs. Its market strength lies in healthcare education, business, and arts, often attracting students seeking career-oriented degrees with a strong experiential learning component..\n\n**Outcomes:** Graduates have median earnings of $55,146 ten years after graduation, 95.0% employment rate within 2 years, 26% pursue graduate studies, top employers include Morgan Stanley, Cisco Systems Inc., Apple.", "media": null, "indexed_at": "2026-01-01T00:08:45.985322+00:00", "last_updated": "2024-07-28"}, {"university_id": "georgia_institute_of_technology", "official_name": "Georgia Institute of Technology", "location": {"city": "Atlanta", "state": "GA", "type": "Public"}, "acceptance_rate": 12.74, "soft_fit_category": "REACH", "market_position": "Public Ivy", "us_news_rank": 32, "summary": "**Georgia Institute of Technology** is a public university located in Atlanta, GA, ranked #32 in US News National Universities with a 12.74% acceptance rate and a test required testing policy.\n\n**Admissions:** SAT middle 50%: 1370-1530. ACT middle 50%: 30-34. EA acceptance rate: 33.0%.\n\n**Academics:** The university comprises 6 colleges/schools including College of Computing, College of Design, College of Engineering, College of Sciences. Public Ivy.\n\n**Outcomes:** Graduates have median earnings of $102,772 ten years after graduation, top employers include Google, Microsoft, Apple.", "media": null, "indexed_at": "2026-01-01T00:08:47.077478+00:00", "last_updated": "2025-12-07"}, {"university_id": "university_of_arizona", "official_name": "University of Arizona", "location": {"city": "Tucson", "state": "Arizona", "type": "Public"}, "acceptance_rate": 86.1, "soft_fit_category": "SAFETY", "market_position": "Public Research University", "us_news_rank": 115, "summary": "**University of Arizona** is a public university located in Tucson, Arizona, ranked #115 in US News National Universities with a 86.1% acceptance rate and a test optional testing policy.\n\n**Admissions:** SAT middle 50%: 1130-1340. ACT middle 50%: 21-28.\n\n**Academics:** The university comprises 12 colleges/schools including College of Agriculture, Life & Environmental Sciences, College of Architecture, Planning & Landscape Architecture, College of Education, College of Engineering. Public Research University.\n\n**Outcomes:** Graduates have median earnings of $59,979 ten years after graduation, 19.0% pursue graduate studies, top employers include Amazon, Apple, Deloitte.", "media": null, "indexed_at": "2026-01-01T00:08:48.131446+00:00", "last_updated": "2025-12-07"}, {"university_id": "university_of_california_irvine", "official_name": "University of California, Irvine", "location": {"city": "Irvine", "state": "CA", "type": "Public"}, "acceptance_rate": 28.94, "soft_fit_category": "TARGET", "market_position": "Public Ivy, Research Powerhouse, Best Value", "us_news_rank": 33, "summary": "**University of California, Irvine** is a public university located in Irvine, CA, ranked #33 in US News National Universities with a 28.94% acceptance rate and a test free testing policy.\n\n**Admissions:** GPA middle 50%: 4.04-4.27.\n\n**Academics:** The university comprises 13 colleges/schools including Claire Trevor School of the Arts, Charlie Dunlop School of Biological Sciences, The Paul Merage School of Business, School of Education. Public Ivy, Research Powerhouse, Best Value.\n\n**Outcomes:** Graduates have median earnings of $80,735 ten years after graduation, 20.0% pursue graduate studies, top employers include Amazon, Aetna, a CVS Health Company, University of California Irvine.", "media": null, "indexed_at": "2026-01-01T00:08:49.331491+00:00", "last_updated": "2025-12-06"}, {"university_id": "university_of_california_santa_barbara", "official_name": "University of California, Santa Barbara", "location": {"city": "Santa Barbara", "state": "CA", "type": "Public"}, "acceptance_rate": 38.3, "soft_fit_category": "TARGET", "market_position": "Public Ivy", "us_news_rank": 41, "summary": "**University of California, Santa Barbara** is a public university located in Santa Barbara, CA, ranked #41 in US News National Universities with a 38.3% acceptance rate and a test free testing policy.\n\n**Admissions:** GPA middle 50%: 4.12-4.29.\n\n**Academics:** The university comprises 3 colleges/schools including College of Letters and Science, College of Engineering, College of Creative Studies. Public Ivy.\n\n**Outcomes:** Graduates have median earnings of $74,915 ten years after graduation, 90.0% employment rate within 2 years, top employers include Amazon, Apple, Google.", "media": null, "indexed_at": "2026-01-01T00:08:50.376700+00:00", "last_updated": "2025-12-06"}, {"university_id": "bowling_green_state_university", "official_name": "Bowling Green State University", "location": {"city": "Bowling Green", "state": "Ohio", "type": "Public"}, "acceptance_rate": 81.0, "soft_fit_category": "SAFETY", "market_position": "Nationally Recognized Public University", "us_news_rank": 273, "summary": "**Bowling Green State University** is a public university located in Bowling Green, Ohio, ranked #273 in US News National Universities with a 81.0% acceptance rate and a bowling green state university is test-optional for all application terms for 2023-2024 and 2024-2025. applicants have the opportunity to have their applications reviewed without consideration of test scores. however, if a test score (act or sat) is sent or included on a transcript, it will be used in the admission decision. while not required for admission, test scores can be beneficial for scholarship consideration (especially for full-tuition scholarships through the honors college) and mathematics placement. the university superscores both act and sat. the minimum suggested requirement for students submitting scores is a 20 act or 1040 sat, combined with a 2.5 cumulative high school gpa for admittance. new scores are accepted until february 20, 2025. testing policy.\n\n**Admissions:** SAT middle 50%: 1020-1230. ACT middle 50%: 19-26. GPA middle 50%: 3.50-3.90. Early Decision acceptance rate: None%.\n\n**Academics:** The university comprises 8 colleges/schools including College of Arts & Sciences, Allen W. and Carol M. Schmidthorst College of Business, College of Education and Human Development, BGSU Firelands. Nationally Recognized Public University.\n\n**Outcomes:** Graduates have median earnings of $47,896 ten years after graduation, 35.0% pursue graduate studies, top employers include Capital One, Citigroup, Ernst & Young.", "media": null, "indexed_at": "2026-01-01T00:08:51.390593+00:00", "last_updated": "2024-07-29"}, {"university_id": "university_of_virginia", "official_name": "University of Virginia", "location": {"city": "Charlottesville", "state": "VA", "type": "Public"}, "acceptance_rate": 16.8, "soft_fit_category": "REACH", "market_position": "Public Ivy", "us_news_rank": 26, "summary": "**University of Virginia** is a public university located in Charlottesville, VA, ranked #26 in US News National Universities with a 16.8% acceptance rate and a test optional testing policy.\n\n**Admissions:** SAT middle 50%: 1410-1520. ACT middle 50%: 32-35. GPA middle 50%: 4.10-4.30. ED acceptance rate: 27.9%.\n\n**Academics:** The university comprises 8 colleges/schools including College of Arts & Sciences, School of Engineering and Applied Science, School of Architecture, McIntire School of Commerce. Public Ivy.\n\n**Outcomes:** Graduates have median earnings of $86,863 ten years after graduation, 94.0% employment rate within 2 years, 19.0% pursue graduate studies, top employers include Amazon, Boston Consulting Group, McKinsey & Company.", "media": null, "indexed_at": "2026-01-01T00:08:52.433056+00:00", "last_updated": "2025-12-07"}, {"university_id": "university_of_georgia", "official_name": "University of Georgia", "location": {"city": "Athens", "state": "GA", "type": "Public"}, "acceptance_rate": 33.0, "soft_fit_category": "TARGET", "market_position": "Public Ivy", "us_news_rank": 48, "summary": "**University of Georgia** is a public university located in Athens, GA, ranked #48 in US News National Universities with a 33.0% acceptance rate and a test required testing policy.\n\n**Admissions:** SAT middle 50%: 1300-1470. ACT middle 50%: 30-34. GPA middle 50%: 4.07-4.35. EA acceptance rate: 31.6%.\n\n**Academics:** The university comprises 16 colleges/schools including Franklin College of Arts and Sciences, College of Agricultural and Environmental Sciences, School of Law, College of Pharmacy. Public Ivy.\n\n**Outcomes:** Graduates have median earnings of $68,726 ten years after graduation, 61.0% employment rate within 2 years, 25.0% pursue graduate studies, top employers include Deloitte, EY, KPMG.", "media": null, "indexed_at": "2026-01-01T00:08:53.482844+00:00", "last_updated": "2025-12-07"}, {"university_id": "university_of_massachusetts_amherst", "official_name": "University of Massachusetts Amherst", "location": {"city": "Amherst", "state": "MA", "type": "Public"}, "acceptance_rate": 59.72, "soft_fit_category": "SAFETY", "market_position": "Public Ivy", "us_news_rank": 66, "summary": "**University of Massachusetts Amherst** is a public university located in Amherst, MA, ranked #66 in US News National Universities with a 59.72% acceptance rate and a test optional testing policy.\n\n**Admissions:** SAT middle 50%: 1300-1480. ACT middle 50%: 29-33. EA acceptance rate: 61.2%.\n\n**Academics:** The university comprises 11 colleges/schools including College of Education, Daniel J. Riccio Jr. College of Engineering, College of Humanities and Fine Arts, Robert and Donna Manning College of Information & Computer Sciences. Public Ivy.\n\n**Outcomes:** Graduates have median earnings of $71,631 ten years after graduation, 62.0% employment rate within 2 years, 24.0% pursue graduate studies, top employers include Mass General Brigham, Fidelity Investments, The TJX Companies, Inc..", "media": null, "indexed_at": "2026-01-01T00:08:54.578637+00:00", "last_updated": "2025-12-07"}, {"university_id": "pennsylvania_state_university", "official_name": "The Pennsylvania State University", "location": {"city": "State College", "state": "PA", "type": "Public"}, "acceptance_rate": 60.5, "soft_fit_category": "SAFETY", "market_position": "Public Ivy", "us_news_rank": 59, "summary": "**The Pennsylvania State University** is a public university located in State College, PA, ranked #59 in US News National Universities with a 60.5% acceptance rate and a test optional testing policy.\n\n**Admissions:** SAT middle 50%: 1250-1410. ACT middle 50%: 27-32. EA acceptance rate: 68.0%.\n\n**Academics:** The university comprises 14 colleges/schools including College of Agricultural Sciences, College of Arts and Architecture, Smeal College of Business, Donald P. Bellisario College of Communications. Public Ivy.\n\n**Outcomes:** Graduates have median earnings of $63,435 ten years after graduation, top employers include IBM, Lockheed Martin, Merck.", "media": null, "indexed_at": "2026-01-01T00:08:55.685386+00:00", "last_updated": "2025-12-07"}, {"university_id": "kent_state_university", "official_name": "Kent State University", "location": {"city": "Kent", "state": "Ohio", "type": "Public"}, "acceptance_rate": 86.34, "soft_fit_category": "SAFETY", "market_position": "Strong regional public university with a focus on experiential learning and diverse academic programs.", "us_news_rank": 195, "summary": "**Kent State University** is a public university located in Kent, Ohio, ranked #195 in US News National Universities with a 86.34% acceptance rate and a kent state university is test-optional, meaning applicants are not required to submit standardized test scores (act or sat) for admission. the university allows self-reporting of scores. when applying, students are asked if they want their test scores to be considered; if yes, the application is reviewed with scores and other requirements. if no, the application is reviewed once all other requirements are fulfilled. this decision cannot be changed online once indicated. test scores are considered if submitted, but not required for admission. for first-year students, a holistic approach to admissions is used, evaluating applicants based on high school gpa, standardized test scores (if submitted), and college preparatory curriculum. a minimum gpa of 2.7 on a 4.0 scale with an act composite of 22 or an sat score of 1100 is considered, though scores are not required for admission. testing policy.\n\n**Admissions:** SAT middle 50%: 1020-1230. ACT middle 50%: 18-25. GPA middle 50%: N/A.\n\n**Academics:** The university comprises 11 colleges/schools including Ambassador Crawford College of Business and Entrepreneurship, College of Aeronautics and Engineering, College of Applied and Technical Studies, College of Architecture and Environmental Design. Strong regional public university with a focus on experiential learning and diverse academic programs..\n\n**Outcomes:** Graduates have median earnings of $45,390 ten years after graduation, top employers include Apple, Deloitte, EY (Ernst & Young).", "media": null, "indexed_at": "2026-01-01T00:08:56.771639+00:00", "last_updated": "2024-07-29"}, {"university_id": "morgan_state_university", "official_name": "Morgan State University", "location": {"city": "Baltimore", "state": "Maryland", "type": "Public"}, "acceptance_rate": 82.9, "soft_fit_category": "SAFETY", "market_position": "Leading public HBCU, strong regional draw for STEM and professional programs.", "us_news_rank": 12, "summary": "**Morgan State University** is a public university located in Baltimore, Maryland, ranked #12 in US News National Universities with a 82.9% acceptance rate and a morgan state university has a test-optional policy for freshman applicants and transfer students with fewer than 12 transferable credits, allowing them to choose whether to submit sat/act scores. test scores are not required for transfer students with more than 12 transferable credits or international applicants. self-reporting of scores is permitted. submitting strong scores can be advantageous, but all applicants are assessed equitably regardless of submission. testing policy.\n\n**Admissions:** SAT middle 50%: 860-1080. ACT middle 50%: 16-21. GPA middle 50%: 3.3-3.6.\n\n**Academics:** The university comprises 9 colleges/schools including James H. Gilliam, Jr. College of Liberal Arts, School of Architecture & Planning, Earl G. Graves School of Business & Management, School of Community Health & Policy. Leading public HBCU, strong regional draw for STEM and professional programs..\n\n**Outcomes:** Graduates have median earnings of $50,700 ten years after graduation, 94.0% employment rate within 2 years, 35.0% pursue graduate studies, top employers include Microsoft, IBM, Capital One.", "media": null, "indexed_at": "2026-01-01T00:08:57.869387+00:00", "last_updated": "2024-07-29"}, {"university_id": "california_state_university_fullerton", "official_name": "California State University, Fullerton", "location": {"city": "Fullerton", "state": "California", "type": "Public"}, "acceptance_rate": 90.5, "soft_fit_category": "SAFETY", "market_position": "A leading regional comprehensive university in Southern California, known for its strong undergraduate business, education, and health science programs. It serves as a primary pipeline for local industries and offers an affordable, high-quality education.", "us_news_rank": 15, "summary": "**California State University, Fullerton** is a public university located in Fullerton, California, ranked #15 in US News National Universities with a 90.5% acceptance rate and a the california state university (csu) system has permanently discontinued the use of act/sat examinations in determining admission eligibility. submitted test scores by admitted students would be considered only for purposes of student placement in math or english courses. testing policy.\n\n**Admissions:** SAT middle 50%: 1000-1180. ACT middle 50%: 22-30. GPA middle 50%: 3.30-3.70.\n\n**Academics:** The university comprises 9 colleges/schools including College of the Arts, College of Business and Economics, College of Communications, College of Education. A leading regional comprehensive university in Southern California, known for its strong undergraduate business, education, and health science programs. It serves as a primary pipeline for local industries and offers an affordable, high-quality education..\n\n**Outcomes:** Graduates have median earnings of $62,951 ten years after graduation, 93.0% employment rate within 2 years, top employers include Google, Goldman Sachs, McKinsey & Company.", "media": null, "indexed_at": "2026-01-01T00:08:58.974506+00:00", "last_updated": "2024-07-31"}, {"university_id": "santa_clara_university", "official_name": "Santa Clara University", "location": {"city": "Santa Clara", "state": "CA", "type": "Private"}, "acceptance_rate": 48.0, "soft_fit_category": "TARGET", "market_position": "Elite Private", "us_news_rank": 59, "summary": "**Santa Clara University** is a private university located in Santa Clara, CA, ranked #59 in US News National Universities with a 48.0% acceptance rate and a test optional testing policy.\n\n**Admissions:** SAT middle 50%: 1340-1500. ACT middle 50%: 31-34. EA acceptance rate: 52.0%.\n\n**Academics:** The university comprises 3 colleges/schools including College of Arts and Sciences, Leavey School of Business, School of Engineering. Elite Private.\n\n**Outcomes:** Graduates have median earnings of $109,183 ten years after graduation, 77.0% employment rate within 2 years, 10.0% pursue graduate studies, top employers include Google, Apple, Cisco.", "media": null, "indexed_at": "2026-01-01T00:08:59.985040+00:00", "last_updated": "2025-12-07"}, {"university_id": "stanford_university", "official_name": "Leland Stanford Junior University", "location": {"city": "Stanford", "state": "California", "type": "Private"}, "acceptance_rate": 3.6, "soft_fit_category": "SUPER_REACH", "market_position": "Elite Private", "us_news_rank": 4, "summary": "**Leland Stanford Junior University** is a private university located in Stanford, California, ranked #4 in US News National Universities with a 3.6% acceptance rate and a test required (sat or act required starting fall 2025 applications) testing policy.\n\n**Admissions:** SAT middle 50%: 1510-1570. ACT middle 50%: 34-35.\n\n**Academics:** The university comprises 3 colleges/schools including School of Humanities and Sciences, School of Engineering, Stanford Doerr School of Sustainability. Elite Private.\n\n**Outcomes:** Graduates have median earnings of $124,080 ten years after graduation, top employers include Google, Apple, Meta.", "media": null, "indexed_at": "2026-01-01T00:09:00.970030+00:00", "last_updated": "2025-12-24"}, {"university_id": "quinnipiac_university", "official_name": "Quinnipiac University", "location": {"city": "Hamden", "state": "Connecticut", "type": "Private"}, "acceptance_rate": 72.15, "soft_fit_category": "SAFETY", "market_position": "Occupies a strong regional position with national recognition for specific programs. Competes with mid-tier private universities, particularly those with a focus on pre-professional education. Growing reputation in journalism and communications.", "us_news_rank": 170, "summary": "**Quinnipiac University** is a private university located in Hamden, Connecticut, ranked #170 in US News National Universities with a 72.15% acceptance rate and a quinnipiac university is test-optional for most majors, but submitting sat/act scores is encouraged. test scores are required for applicants to the accelerated dual-degree bachelor's/jd (3+3) program, the entry-level dual-degree bs/mhs in physician assistant (4+27 months) program, homeschooled applicants, and international freshman applicants for english language proficiency. self-reported scores are considered during admission and scholarship review; however, official scores must be sent by june 1 if an applicant who self-reported is accepted and plans to enroll. testing policy.\n\n**Admissions:** SAT middle 50%: 1100-1300. ACT middle 50%: 25-29. EA acceptance rate: 92.6%.\n\n**Academics:** The university comprises 9 colleges/schools including College of Arts and Sciences, School of Business, School of Communications, School of Computing & Engineering. Occupies a strong regional position with national recognition for specific programs. Competes with mid-tier private universities, particularly those with a focus on pre-professional education. Growing reputation in journalism and communications..\n\n**Outcomes:** Graduates have median earnings of $65,500 ten years after graduation, 77.0% employment rate within 2 years, 44.0% pursue graduate studies, top employers include Google, Ernst & Young, New York Life Insurance Company.", "media": null, "indexed_at": "2026-01-01T00:09:01.983824+00:00", "last_updated": "2024-07-30"}, {"university_id": "university_of_st_thomas_minnesota", "official_name": "University of St. Thomas", "location": {"city": "St. Paul", "state": "Minnesota", "type": "Private"}, "acceptance_rate": 85.36, "soft_fit_category": "SAFETY", "market_position": "Leading Private, Catholic University", "us_news_rank": 160, "summary": "**University of St. Thomas** is a private university located in St. Paul, Minnesota, ranked #160 in US News National Universities with a 85.36% acceptance rate and a the university of st. thomas is a test-optional institution. students are not required to submit act or sat scores as part of their application. applicants can choose to apply \"with test\" or \"without test.\" if a student chooses to apply without test scores, these scores will not be considered in the application review process, even if submitted. while submitting a low score may negatively impact an admission decision, once a score is submitted for consideration, it cannot be removed. merit-based scholarships are considered regardless of whether a test score is submitted. applicants may self-report their highest composite and subject scores for the act and/or sat on the application. if self-reported scores are considered as part of the admission application, official test scores are required prior to the first day of classes. testing policy.\n\n**Admissions:** SAT middle 50%: 1130-1340. ACT middle 50%: 23-29. GPA middle 50%: 3.50-3.75.\n\n**Academics:** The university comprises 6 colleges/schools including College of Arts and Sciences, Opus College of Business, School of Engineering, Morrison Family College of Health - Susan S. Morrison School of Nursing. Leading Private, Catholic University.\n\n**Outcomes:** Graduates have median earnings of $62,000 ten years after graduation, 35.0% pursue graduate studies, top employers include Google, Goldman Sachs, McKinsey & Company.", "media": null, "indexed_at": "2026-01-01T00:09:03.083521+00:00", "last_updated": "2024-05-15"}, {"university_id": "tulane_university", "official_name": "Tulane University", "location": {"city": "New Orleans", "state": "LA", "type": "Private"}, "acceptance_rate": 14.7, "soft_fit_category": "REACH", "market_position": "Elite Private", "us_news_rank": 63, "summary": "**Tulane University** is a private university located in New Orleans, LA, ranked #63 in US News National Universities with a 14.7% acceptance rate and a test optional testing policy.\n\n**Admissions:** SAT middle 50%: 1430-1500. ACT middle 50%: 32-34. GPA middle 50%: 3.7-4.0. ED acceptance rate: 59.4%.\n\n**Academics:** The university comprises 6 colleges/schools including School of Architecture and Built Environment, A.B. Freeman School of Business, School of Liberal Arts, Celia Scott Weatherhead School of Public Health and Tropical Medicine. Elite Private.\n\n**Outcomes:** Graduates have median earnings of $63,268 ten years after graduation, 35.0% pursue graduate studies, top employers include JPMorgan Chase & Co., Amazon.com, Inc., Bloomberg L.P..", "media": null, "indexed_at": "2026-01-01T00:09:04.097989+00:00", "last_updated": "2025-12-07"}, {"university_id": "university_of_california_merced", "official_name": "University of California, Merced", "location": {"city": "Merced", "state": "California", "type": "Public"}, "acceptance_rate": 90.53, "soft_fit_category": "SAFETY", "market_position": "Emerging research institution with a strong commitment to sustainability and serving first-generation students. Known for its innovative curriculum and interdisciplinary approach, positioning itself as a challenger in the UC system.", "us_news_rank": 60, "summary": "**University of California, Merced** is a public university located in Merced, California, ranked #60 in US News National Universities with a 90.53% acceptance rate and a the university of california system, including uc merced, has a test-blind admissions policy, meaning sat and act scores are not considered in the admission process and are not required or recommended. testing policy.\n\n**Admissions:** SAT middle 50%: N/A. ACT middle 50%: N/A. GPA middle 50%: 3.48-4.08. Early Decision acceptance rate: None%.\n\n**Academics:** The university comprises 3 colleges/schools including School of Engineering, School of Natural Sciences, School of Social Sciences, Humanities and Arts. Emerging research institution with a strong commitment to sustainability and serving first-generation students. Known for its innovative curriculum and interdisciplinary approach, positioning itself as a challenger in the UC system..\n\n**Outcomes:** Graduates have median earnings of $64,368 ten years after graduation, top employers include Google, Goldman Sachs, Morgan Stanley.", "media": null, "indexed_at": "2026-01-01T00:09:05.080663+00:00", "last_updated": "2024-07-29"}, {"university_id": "simmons_university", "official_name": "Simmons University", "location": {"city": "Boston", "state": "Massachusetts", "type": "Private"}, "acceptance_rate": 69.98, "soft_fit_category": "SAFETY", "market_position": "Niche market leader in women-focused undergraduate education with strong co-ed graduate programs in high-demand fields; faces competition from larger research universities but offers a distinct, supportive learning environment.", "us_news_rank": 142, "summary": "**Simmons University** is a private university located in Boston, Massachusetts, ranked #142 in US News National Universities with a 69.98% acceptance rate and a simmons university is test-optional, meaning students may apply without submitting standardized test scores (sat or act) for admission or scholarship consideration. while not required, submitting high sat or act scores can enhance an application, especially for competitive programs. for international students, proof of english proficiency (toefl/ielts/duolingo english test or sat/act scores) is required if english is not their first language. testing policy.\n\n**Admissions:** SAT middle 50%: 1230-1390. ACT middle 50%: 26-31. EA acceptance rate: None%.\n\n**Academics:** The university comprises 7 colleges/schools including Gwen Ifill College of Media, Arts, and Humanities, College of Natural, Behavioral, and Health Sciences (excluding Nursing majors), School of Nursing, School of Business. Niche market leader in women-focused undergraduate education with strong co-ed graduate programs in high-demand fields; faces competition from larger research universities but offers a distinct, supportive learning environment..\n\n**Outcomes:** Graduates have median earnings of $52,800 ten years after graduation, 70.0% employment rate within 2 years, 13.0% pursue graduate studies, top employers include Massachusetts General Hospital, Brigham and Women's Hospital, Boston Children's Hospital.", "media": null, "indexed_at": "2026-01-01T00:09:06.182284+00:00", "last_updated": "2024-07-30"}, {"university_id": "university_of_wyoming", "official_name": "University of Wyoming", "location": {"city": "Laramie", "state": "Wyoming", "type": "Public"}, "acceptance_rate": 96.9, "soft_fit_category": "SAFETY", "market_position": "As the flagship institution of Wyoming, UW holds a unique and dominant market position within the state for higher education. It competes regionally with universities in Colorado and Montana, particularly for students interested in outdoor recreation and specific research fields. Its affordability for in-state students and specialized programs attract a dedicated student body, while national rankings help draw out-of-state talent.", "us_news_rank": 195, "summary": "**University of Wyoming** is a public university located in Laramie, Wyoming, ranked #195 in US News National Universities with a 96.9% acceptance rate and a the university of wyoming is test-optional for undergraduate admission decisions through at least summer 2026. this means that standardized test scores (act or sat) are not considered for admission even when submitted. however, submitting act or sat scores can be beneficial for securing financial aid and scholarships. for transfer students with fewer than 12 transferable credit hours who are under 21 years of age, act or sat scores are required. homeschooled students under 21 are also required to submit act or sat scores. for assured admission, a cumulative high school gpa of 3.00-4.00 is required, and students with a gpa of 2.50-2.99 may be admitted with support. test scores are not required for assured or supported admission for first-time students under the test-optional policy. testing policy.\n\n**Admissions:** SAT middle 50%: 1035-1260. ACT middle 50%: 21-27.\n\n**Academics:** The university comprises 9 colleges/schools including College of Agriculture, Life Sciences and Natural Resources, College of Arts and Sciences, College of Business, College of Education. As the flagship institution of Wyoming, UW holds a unique and dominant market position within the state for higher education. It competes regionally with universities in Colorado and Montana, particularly for students interested in outdoor recreation and specific research fields. Its affordability for in-state students and specialized programs attract a dedicated student body, while national rankings help draw out-of-state talent..\n\n**Outcomes:** Graduates have median earnings of $57,000 ten years after graduation, 25.6% pursue graduate studies, top employers include Amazon, Microsoft, McKinsey & Company.", "media": null, "indexed_at": "2026-01-01T00:09:07.287641+00:00", "last_updated": "2025-12-30"}, {"university_id": "indiana_university_bloomington", "official_name": "Indiana University Bloomington", "location": {"city": "Bloomington", "state": "IN", "type": "Public"}, "acceptance_rate": 78.0, "soft_fit_category": "SAFETY", "market_position": "Public Ivy", "us_news_rank": 73, "summary": "**Indiana University Bloomington** is a public university located in Bloomington, IN, ranked #73 in US News National Universities with a 78.0% acceptance rate and a test optional testing policy.\n\n**Admissions:** SAT middle 50%: 1250-1450. ACT middle 50%: 29-33. EA acceptance rate: None%.\n\n**Academics:** The university comprises 12 colleges/schools including College of Arts and Sciences, Kelley School of Business, Luddy School of Informatics, Computing, and Engineering, O'Neill School of Public and Environmental Affairs. Public Ivy.\n\n**Outcomes:** Graduates have median earnings of $63,742 ten years after graduation, 93.0% employment rate within 2 years, 30.7% pursue graduate studies, top employers include Amazon.com, Inc., American Express, Aon.", "media": null, "indexed_at": "2026-01-01T00:09:08.386285+00:00", "last_updated": "2025-12-07"}, {"university_id": "johns_hopkins_university", "official_name": "Johns Hopkins University", "location": {"city": "Baltimore", "state": "MD", "type": "Private"}, "acceptance_rate": 6.44, "soft_fit_category": "SUPER_REACH", "market_position": "Elite Private", "us_news_rank": 7, "summary": "**Johns Hopkins University** is a private university located in Baltimore, MD, ranked #7 in US News National Universities with a 6.44% acceptance rate and a test optional testing policy.\n\n**Admissions:** SAT middle 50%: 1530-1560. ACT middle 50%: 34-36. ED acceptance rate: None%.\n\n**Academics:** The university comprises 3 colleges/schools including Zanvyl Krieger School of Arts and Sciences, Whiting School of Engineering, Peabody Institute. Elite Private.\n\n**Outcomes:** Graduates have median earnings of $87,555 ten years after graduation, 38.0% pursue graduate studies, top employers include Amazon, Goldman Sachs, Deloitte.", "media": null, "indexed_at": "2026-01-01T00:09:09.382551+00:00", "last_updated": "2025-12-24"}, {"university_id": "university_of_north_texas", "official_name": "University of North Texas", "location": {"city": "Denton", "state": "Texas", "type": "Public"}, "acceptance_rate": 72.3, "soft_fit_category": "SAFETY", "market_position": "Large public research university with a strong focus on arts, music, business, and STEM fields, serving a diverse student body in the Dallas-Fort Worth metroplex.", "us_news_rank": 220, "summary": "**University of North Texas** is a public university located in Denton, Texas, ranked #220 in US News National Universities with a 72.3% acceptance rate and a the university of north texas is a test-optional institution, allowing applicants to choose whether to submit standardized test scores. submitting test scores can help determine admission decisions, testing exemptions, and scholarship opportunities. students can self-report their scores. for guaranteed admission, a minimum act score of 22 or sat score of 1100 is mentioned. students with a cumulative unweighted high school gpa of 3.0 or higher may be considered for admission without a standardized test score. testing policy.\n\n**Admissions:** SAT middle 50%: 980-1230. ACT middle 50%: 19-27. GPA middle 50%: 3.6-4.0.\n\n**Academics:** The university comprises 12 colleges/schools including G. Brint Ryan College of Business, College of Education, College of Engineering, College of Health and Public Service. Large public research university with a strong focus on arts, music, business, and STEM fields, serving a diverse student body in the Dallas-Fort Worth metroplex..\n\n**Outcomes:** Graduates have median earnings of $47,000 ten years after graduation, top employers include Google, Goldman Sachs, Amazon.", "media": null, "indexed_at": "2026-01-01T00:09:10.475048+00:00", "last_updated": "2024-05-15"}, {"university_id": "university_of_notre_dame", "official_name": "University of Notre Dame du Lac", "location": {"city": "Notre Dame", "state": "IN", "type": "Private"}, "acceptance_rate": 9.0, "soft_fit_category": "SUPER_REACH", "market_position": "Elite Private", "us_news_rank": 20, "summary": "**University of Notre Dame du Lac** is a private university located in Notre Dame, IN, ranked #20 in US News National Universities with a 9.0% acceptance rate and a test optional testing policy.\n\n**Admissions:** SAT middle 50%: 1470-1540. ACT middle 50%: 33-35. REA acceptance rate: 12.9%.\n\n**Academics:** The university comprises 7 colleges/schools including College of Arts and Letters, College of Science, Notre Dame Law School, School of Architecture. Elite Private.\n\n**Outcomes:** Graduates have median earnings of $99,980 ten years after graduation, 25.0% pursue graduate studies, top employers include Google, Microsoft, Amazon.", "media": null, "indexed_at": "2026-01-01T00:09:11.487199+00:00", "last_updated": "2025-12-07"}, {"university_id": "university_of_michigan_ann_arbor", "official_name": "University of Michigan-Ann Arbor", "location": {"city": "Ann Arbor", "state": "MI", "type": "Public"}, "acceptance_rate": 15.6, "soft_fit_category": "REACH", "market_position": "Public Ivy", "us_news_rank": 20, "summary": "**University of Michigan-Ann Arbor** is a public university located in Ann Arbor, MI, ranked #20 in US News National Universities with a 15.6% acceptance rate and a test optional testing policy.\n\n**Admissions:** SAT middle 50%: 1360-1530. ACT middle 50%: 31-35. EA acceptance rate: 22.5%.\n\n**Academics:** The university comprises 11 colleges/schools including College of Literature, Science, and the Arts (LSA), College of Engineering, Ross School of Business, School of Music, Theatre & Dance (SMTD). Public Ivy.\n\n**Outcomes:** Graduates have median earnings of $153,297 ten years after graduation, 95.0% employment rate within 2 years, top employers include Google, Amazon, Microsoft.", "media": null, "indexed_at": "2026-01-01T00:09:12.485669+00:00", "last_updated": "2025-12-07"}, {"university_id": "louisiana_state_university", "official_name": "Louisiana State University and Agricultural & Mechanical College", "location": {"city": "Baton Rouge", "state": "Louisiana", "type": "Public"}, "acceptance_rate": 73.33, "soft_fit_category": "SAFETY", "market_position": "Dominant public institution in Louisiana, attracting a significant portion of in-state talent while also drawing students from neighboring states. Strong brand recognition through SEC athletics and specific academic programs such as petroleum engineering, veterinary medicine, and coastal environmental science. Competes with other regional public flagships for top students.", "us_news_rank": 170, "summary": "**Louisiana State University and Agricultural & Mechanical College** is a public university located in Baton Rouge, Louisiana, ranked #170 in US News National Universities with a 73.33% acceptance rate and a lsu is a test-optional institution. applicants can indicate on the common application whether or not they would like their act or sat scores included in their evaluation for admission and university-administered scholarships. this policy aligns with lsu's admissions philosophy of full-file comprehensive review, where high school performance (grades and rigor of coursework) is the most important part of the application. if a student's super score (act 28 / sat 1260) falls at or above lsu's historical averages, submitting scores could benefit their application. if a student's gpa is strong but test scores are not, applying test-optional is recommended. choosing not to submit test scores will not negatively impact the application. testing policy.\n\n**Admissions:** SAT middle 50%: 1180-1320. ACT middle 50%: 24-30. GPA middle 50%: 3.50-4.10.\n\n**Academics:** The university comprises 12 colleges/schools including College of Agriculture, College of Art & Design, E. J. Ourso College of Business, College of the Coast & Environment. Dominant public institution in Louisiana, attracting a significant portion of in-state talent while also drawing students from neighboring states. Strong brand recognition through SEC athletics and specific academic programs such as petroleum engineering, veterinary medicine, and coastal environmental science. Competes with other regional public flagships for top students..\n\n**Outcomes:** Graduates have median earnings of $56,900 ten years after graduation, 94.0% employment rate within 2 years, 19.3% pursue graduate studies, top employers include Deloitte, JPMorgan Chase, Amazon.", "media": null, "indexed_at": "2026-01-01T00:09:13.581587+00:00", "last_updated": "2024-05-15"}, {"university_id": "ohio_state_university", "official_name": "The Ohio State University", "location": {"city": "Columbus", "state": "Ohio", "type": "Public"}, "acceptance_rate": 60.57, "soft_fit_category": "SAFETY", "market_position": "Public Ivy", "us_news_rank": 41, "summary": "**The Ohio State University** is a public university located in Columbus, Ohio, ranked #41 in US News National Universities with a 60.57% acceptance rate and a test optional testing policy.\n\n**Admissions:** SAT middle 50%: 1330-1480. ACT middle 50%: 29-32. GPA middle 50%: 3.70-4.30. EA acceptance rate: 66.6%.\n\n**Academics:** The university comprises 7 colleges/schools including College of Arts and Sciences, Fisher College of Business, College of Engineering, College of Education and Human Ecology. Public Ivy.\n\n**Outcomes:** Graduates have median earnings of $60,409 ten years after graduation, 94.0% employment rate within 2 years, 25.2% pursue graduate studies, top employers include JP Morgan Chase & Co., EY, PwC.", "media": null, "indexed_at": "2026-01-01T00:09:14.586471+00:00", "last_updated": "2025-12-07"}, {"university_id": "boston_university", "official_name": "Boston University", "location": {"city": "Boston", "state": "Massachusetts", "type": "Private"}, "acceptance_rate": 11.1, "soft_fit_category": "REACH", "market_position": "Elite Private", "us_news_rank": 42, "summary": "**Boston University** is a private university located in Boston, Massachusetts, ranked #42 in US News National Universities with a 11.1% acceptance rate and a test optional testing policy.\n\n**Admissions:** SAT middle 50%: 1400-1520. ACT middle 50%: 32-34. ED acceptance rate: 34.1%.\n\n**Academics:** The university comprises 11 colleges/schools including College of Arts & Sciences, College of Communication, College of Engineering, College of Fine Arts. Elite Private.\n\n**Outcomes:** Graduates have median earnings of $83,238 ten years after graduation, 31.0% pursue graduate studies, top employers include Amazon, Google, Microsoft.", "media": null, "indexed_at": "2026-01-01T00:09:15.578738+00:00", "last_updated": "2025-12-07"}, {"university_id": "university_of_southern_california", "official_name": "University of Southern California", "location": {"city": "Los Angeles", "state": "CA", "type": "Private"}, "acceptance_rate": 9.2, "soft_fit_category": "SUPER_REACH", "market_position": "Elite Private", "us_news_rank": 28, "summary": "**University of Southern California** is a private university located in Los Angeles, CA, ranked #28 in US News National Universities with a 9.2% acceptance rate and a test optional testing policy.\n\n**Admissions:** SAT middle 50%: 1440-1550. ACT middle 50%: 32-35. GPA middle 50%: 4.10-4.30. EA acceptance rate: 7.2%.\n\n**Academics:** The university comprises 17 colleges/schools including USC Viterbi School of Engineering, USC Dornsife College of Letters, Arts and Sciences, USC Marshall School of Business, USC School of Cinematic Arts. Elite Private.\n\n**Outcomes:** Graduates have median earnings of $92,498 ten years after graduation, top employers include Google, Amazon, Microsoft.", "media": null, "indexed_at": "2026-01-01T00:09:16.676235+00:00", "last_updated": "2025-12-24"}, {"university_id": "university_of_miami", "official_name": "University of Miami", "location": {"city": "Coral Gables", "state": "FL", "type": "Private"}, "acceptance_rate": 18.5, "soft_fit_category": "REACH", "market_position": "Elite Private", "us_news_rank": 63, "summary": "**University of Miami** is a private university located in Coral Gables, FL, ranked #63 in US News National Universities with a 18.5% acceptance rate and a test optional testing policy.\n\n**Admissions:** SAT middle 50%: 1360-1480. ACT middle 50%: 30-34. ED acceptance rate: 47.57%.\n\n**Academics:** The university comprises 9 colleges/schools including School of Architecture, College of Arts and Sciences, Miami Herbert Business School, School of Communication. Elite Private.\n\n**Outcomes:** Graduates have median earnings of $75,328 ten years after graduation, 12.0% pursue graduate studies, top employers include Google, Apple, Deloitte.", "media": null, "indexed_at": "2026-01-01T00:09:17.730740+00:00", "last_updated": "2025-12-07"}, {"university_id": "university_of_rochester", "official_name": "University of Rochester", "location": {"city": "Rochester", "state": "NY", "type": "Private"}, "acceptance_rate": 40.0, "soft_fit_category": "TARGET", "market_position": "Elite Private", "us_news_rank": 40, "summary": "**University of Rochester** is a private university located in Rochester, NY, ranked #40 in US News National Universities with a 40.0% acceptance rate and a test optional testing policy.\n\n**Admissions:** SAT middle 50%: 1420-1500. ACT middle 50%: 32-35. ED acceptance rate: 38.0%.\n\n**Academics:** The university comprises 3 colleges/schools including College of Arts, Sciences and Engineering, Eastman School of Music, School of Nursing. Elite Private.\n\n**Outcomes:** Graduates have median earnings of $71,000 ten years after graduation, top employers include Google, Deloitte, Amazon.", "media": null, "indexed_at": "2026-01-01T00:09:18.868704+00:00", "last_updated": "2025-12-07"}, {"university_id": "temple_university", "official_name": "Temple University", "location": {"city": "Philadelphia", "state": "PA", "type": "Public"}, "acceptance_rate": 80.5, "soft_fit_category": "SAFETY", "market_position": "Urban Public Research University", "us_news_rank": 102, "summary": "**Temple University** is a public university located in Philadelphia, PA, ranked #102 in US News National Universities with a 80.5% acceptance rate and a test optional testing policy.\n\n**Admissions:** SAT middle 50%: 1130-1358. ACT middle 50%: 24-31. EA acceptance rate: 93.2%.\n\n**Academics:** The university comprises 17 colleges/schools including Tyler School of Art and Architecture, Boyer College of Music and Dance, College of Education and Human Development, College of Engineering. Urban Public Research University.\n\n**Outcomes:** Graduates have median earnings of $63,727 ten years after graduation, 18.0% pursue graduate studies, top employers include School District of Philadelphia, Vanguard, SEI.", "media": null, "indexed_at": "2026-01-01T00:09:19.976598+00:00", "last_updated": "2025-12-07"}, {"university_id": "illinois_state_university", "official_name": "Illinois State University", "location": {"city": "Normal", "state": "Illinois", "type": "Public"}, "acceptance_rate": 89.0, "soft_fit_category": "SAFETY", "market_position": "Established Public Research University", "us_news_rank": 222, "summary": "**Illinois State University** is a public university located in Normal, Illinois, ranked #222 in US News National Universities with a 89.0% acceptance rate and a the higher education fair admissions act requires each public university to adopt a test-optional admissions policy for prospective students. at illinois state university, no prospective student is required to submit any standardized test scores with their application. standardized test scores will be evaluated only at the request of the applicant. submitting an sat or act score is optional and will not negatively affect an applicant's standing. applicants who opt not to include an sat or act score will be required to submit a high school transcript in order to complete their application for admission. testing policy.\n\n**Admissions:** SAT middle 50%: 1010-1220. ACT middle 50%: 21-27. GPA middle 50%: 4.00-4.50.\n\n**Academics:** The university comprises 7 colleges/schools including College of Applied Science and Technology, College of Arts and Sciences, College of Business, College of Education. Established Public Research University.\n\n**Outcomes:** Graduates have median earnings of $87,600 ten years after graduation, 95.0% employment rate within 2 years, top employers include State Farm, Caterpillar Inc., Country Financial.", "media": null, "indexed_at": "2026-01-01T00:09:21.095975+00:00", "last_updated": "2025-12-30"}, {"university_id": "texas_christian_university", "official_name": "Texas Christian University", "location": {"city": "Fort Worth", "state": "Texas", "type": "Private"}, "acceptance_rate": 44.5, "soft_fit_category": "TARGET", "market_position": "Elite Private", "us_news_rank": 97, "summary": "**Texas Christian University** is a private university located in Fort Worth, Texas, ranked #97 in US News National Universities with a 44.5% acceptance rate and a test optional testing policy.\n\n**Admissions:** SAT middle 50%: 1280-1430. ACT middle 50%: 29-33. GPA middle 50%: 3.60-4.27. ED acceptance rate: 58.7%.\n\n**Academics:** The university comprises 9 colleges/schools including Neeley School of Business, Harris College of Nursing & Health Sciences, Davis College of Science & Engineering, AddRan College of Liberal Arts. Elite Private.\n\n**Outcomes:** Graduates have median earnings of $68,424 ten years after graduation, 81.0% employment rate within 2 years, 14.1% pursue graduate studies, top employers include Amazon, Deloitte, Accenture.", "media": null, "indexed_at": "2026-01-01T00:09:22.185579+00:00", "last_updated": "2025-12-19"}, {"university_id": "university-at-buffalo-suny", "official_name": "University at Buffalo-SUNY", "location": {"city": "Buffalo and Amherst", "state": "NY", "type": "Public"}, "acceptance_rate": 70.94, "soft_fit_category": "SAFETY", "market_position": "Public Ivy", "us_news_rank": 75, "summary": "**University at Buffalo-SUNY** is a public university located in Buffalo and Amherst, NY, ranked #75 in US News National Universities with a 70.94% acceptance rate and a test optional testing policy.\n\n**Admissions:** SAT middle 50%: 1210-1380. ACT middle 50%: 27-32. EA acceptance rate: None%.\n\n**Academics:** The university comprises 13 colleges/schools including School of Engineering and Applied Sciences, College of Arts and Sciences, School of Management, School of Architecture and Planning. Public Ivy.\n\n**Outcomes:** Graduates have median earnings of $70,814 ten years after graduation, top employers include M&T Bank, Citi, Amazon.", "media": null, "indexed_at": "2026-01-01T00:09:23.230814+00:00", "last_updated": "2025-12-07"}, {"university_id": "lehigh_university", "official_name": "Lehigh University", "location": {"city": "Bethlehem", "state": "PA", "type": "Private"}, "acceptance_rate": 28.96, "soft_fit_category": "TARGET", "market_position": "Elite Private", "us_news_rank": 46, "summary": "**Lehigh University** is a private university located in Bethlehem, PA, ranked #46 in US News National Universities with a 28.96% acceptance rate and a test optional testing policy.\n\n**Admissions:** SAT middle 50%: 1420-1520. ACT middle 50%: 32-35. ED acceptance rate: 47.4%.\n\n**Academics:** The university comprises 4 colleges/schools including College of Arts and Sciences, College of Business, P.C. Rossin College of Engineering and Applied Science, College of Health. Elite Private.\n\n**Outcomes:** Graduates have median earnings of $105,584 ten years after graduation, 23.0% pursue graduate studies, top employers include Bain & Company, Citi, EY.", "media": null, "indexed_at": "2026-01-01T00:09:24.230031+00:00", "last_updated": "2025-12-07"}, {"university_id": "state_university_of_new_york_at_binghamton", "official_name": "State University of New York at Binghamton", "location": {"city": "Binghamton", "state": "New York", "type": "Public"}, "acceptance_rate": 38.61, "soft_fit_category": "TARGET", "market_position": "A highly-regarded public Ivy, known for strong academics, value, and research focus within the SUNY system.", "us_news_rank": 73, "summary": "**State University of New York at Binghamton** is a public university located in Binghamton, New York, ranked #73 in US News National Universities with a 38.61% acceptance rate and a binghamton university is test-optional, meaning standardized test scores (sat or act) are not required for first-year applicants. students have the choice to submit scores, and if they do, binghamton will superscore, combining the highest section scores from multiple administrations of the same test type (sat or act). self-reported sat scores are accepted, but official scores are required upon enrollment. for transfer students, test scores are optional if they have completed fewer than 24 semester credits or 36 quarter credits since high school graduation. international students may submit act/sat scores for academic review or to fulfill english proficiency requirements, though other tests are also accepted for english proficiency. binghamton does not require the act writing or science sections, or the sat essay section. testing policy.\n\n**Admissions:** SAT middle 50%: 1340-1500. ACT middle 50%: 31-34. GPA middle 50%: 3.60-3.90. EA acceptance rate: 50.0%.\n\n**Academics:** The university comprises 6 colleges/schools including Harpur College of Arts and Sciences, Thomas J. Watson College of Engineering and Applied Science, School of Management, Decker College of Nursing and Health Sciences. A highly-regarded public Ivy, known for strong academics, value, and research focus within the SUNY system..\n\n**Outcomes:** Graduates have median earnings of $80,596 ten years after graduation, 95.0% employment rate within 2 years, 36.0% pursue graduate studies, top employers include Google, Goldman Sachs, McKinsey & Company.", "media": null, "indexed_at": "2026-01-01T00:09:25.330417+00:00", "last_updated": "2024-07-29"}, {"university_id": "michigan_state_university", "official_name": "Michigan State University", "location": {"city": "East Lansing", "state": "MI", "type": "Public"}, "acceptance_rate": 84.7, "soft_fit_category": "SAFETY", "market_position": "Public Ivy", "us_news_rank": 66, "summary": "**Michigan State University** is a public university located in East Lansing, MI, ranked #66 in US News National Universities with a 84.7% acceptance rate and a test optional testing policy.\n\n**Admissions:** SAT middle 50%: 1100-1310. ACT middle 50%: 24-30. EA acceptance rate: None%.\n\n**Academics:** The university comprises 18 colleges/schools including College of Agriculture and Natural Resources, College of Arts and Letters, Eli Broad College of Business, College of Communication Arts and Sciences. Public Ivy.\n\n**Outcomes:** Graduates have median earnings of $67,253 ten years after graduation, 26.0% pursue graduate studies, top employers include Amazon, Microsoft, Google.", "media": null, "indexed_at": "2026-01-01T00:09:26.378712+00:00", "last_updated": "2025-12-07"}, {"university_id": "wake_forest_university", "official_name": "Wake Forest University", "location": {"city": "Winston-Salem", "state": "NC", "type": "Private"}, "acceptance_rate": 21.5, "soft_fit_category": "REACH", "market_position": "Elite Private", "us_news_rank": 47, "summary": "**Wake Forest University** is a private university located in Winston-Salem, NC, ranked #47 in US News National Universities with a 21.5% acceptance rate and a test optional testing policy.\n\n**Admissions:** SAT middle 50%: 1420-1500. ACT middle 50%: 32-34. GPA middle 50%: 4.10-4.40 (estimated). ED acceptance rate: 34.5%.\n\n**Academics:** The university comprises 2 colleges/schools including The Undergraduate College, School of Business. Elite Private.\n\n**Outcomes:** Graduates have median earnings of $78,158 ten years after graduation, 31.5% pursue graduate studies, top employers include Deloitte, Bank of America, EY.", "media": null, "indexed_at": "2026-01-01T00:09:27.377314+00:00", "last_updated": "2025-12-07"}, {"university_id": "new_york_university", "official_name": "New York University", "location": {"city": "New York City", "state": "New York", "type": "Private"}, "acceptance_rate": 9.2, "soft_fit_category": "SUPER_REACH", "market_position": "Elite Private", "us_news_rank": 32, "summary": "**New York University** is a private university located in New York City, New York, ranked #32 in US News National Universities with a 9.2% acceptance rate and a test optional testing policy.\n\n**Admissions:** SAT middle 50%: 1470-1570. ACT middle 50%: 33-35. ED acceptance rate: None%.\n\n**Academics:** The university comprises 9 colleges/schools including College of Arts & Science, Leonard N. Stern School of Business, Tandon School of Engineering, Tisch School of the Arts. Elite Private.\n\n**Outcomes:** Graduates have median earnings of $82,509 ten years after graduation, 10.8% pursue graduate studies, top employers include Google, Amazon, Meta.", "media": null, "indexed_at": "2026-01-01T00:09:28.470404+00:00", "last_updated": "2025-12-07"}, {"university_id": "georgetown_university", "official_name": "Georgetown University", "location": {"city": "Washington", "state": "DC", "type": "Private"}, "acceptance_rate": 12.9, "soft_fit_category": "REACH", "market_position": "Elite Private", "us_news_rank": 24, "summary": "**Georgetown University** is a private university located in Washington, DC, ranked #24 in US News National Universities with a 12.9% acceptance rate and a test required testing policy.\n\n**Admissions:** SAT middle 50%: 1400-1540. ACT middle 50%: 31-35. EA acceptance rate: 11.0%.\n\n**Academics:** The university comprises 6 colleges/schools including Georgetown College of Arts & Sciences, Walsh School of Foreign Service (SFS), McDonough School of Business (MSB), Berkley School of Nursing. Elite Private.\n\n**Outcomes:** Graduates have median earnings of $103,494 ten years after graduation, top employers include Amazon, Bank of America, Bain & Company.", "media": null, "indexed_at": "2026-01-01T00:09:29.480322+00:00", "last_updated": "2025-12-07"}, {"university_id": "clemson_university", "official_name": "Clemson University", "location": {"city": "Clemson", "state": "SC", "type": "Public"}, "acceptance_rate": 38.3, "soft_fit_category": "TARGET", "market_position": "Public Ivy", "us_news_rank": 80, "summary": "**Clemson University** is a public university located in Clemson, SC, ranked #80 in US News National Universities with a 38.3% acceptance rate and a test optional testing policy.\n\n**Admissions:** SAT middle 50%: 1250-1400. ACT middle 50%: 28-32. GPA middle 50%: 4.10-4.70. EA acceptance rate: 22.8%.\n\n**Academics:** The university comprises 9 colleges/schools including College of Agriculture, Forestry and Life Sciences, College of Architecture, Art and Construction, College of Arts and Humanities, College of Behavioral, Social and Health Sciences. Public Ivy.\n\n**Outcomes:** Graduates have median earnings of $71,513 ten years after graduation, 72.3% employment rate within 2 years, 19.0% pursue graduate studies, top employers include Deloitte, Prisma Health, Bank of America.", "media": null, "indexed_at": "2026-01-01T00:09:30.581850+00:00", "last_updated": "2025-12-07"}, {"university_id": "tufts_university", "official_name": "Tufts University", "location": {"city": "Medford", "state": "MA", "type": "Private"}, "acceptance_rate": 11.5, "soft_fit_category": "REACH", "market_position": "Elite Private", "us_news_rank": 36, "summary": "**Tufts University** is a private university located in Medford, MA, ranked #36 in US News National Universities with a 11.5% acceptance rate and a test optional testing policy.\n\n**Admissions:** SAT middle 50%: 1470-1560. ACT middle 50%: 33-35. ED acceptance rate: 38.0%.\n\n**Academics:** The university comprises 3 colleges/schools including School of Arts and Sciences, School of Engineering, School of the Museum of Fine Arts at Tufts University (SMFA at Tufts). Elite Private.\n\n**Outcomes:** Graduates have median earnings of $83,214 ten years after graduation, 96.0% employment rate within 2 years, 20.0% pursue graduate studies, top employers include Amazon, Microsoft, Deloitte.", "media": null, "indexed_at": "2026-01-01T00:09:31.569957+00:00", "last_updated": "2025-12-07"}, {"university_id": "drexel_university", "official_name": "Drexel University", "location": {"city": "Philadelphia", "state": "Pennsylvania", "type": "Private"}, "acceptance_rate": 79.4, "soft_fit_category": "SAFETY", "market_position": "Experiential Learning Leader", "us_news_rank": 80, "summary": "**Drexel University** is a private university located in Philadelphia, Pennsylvania, ranked #80 in US News National Universities with a 79.4% acceptance rate and a test optional testing policy.\n\n**Admissions:** SAT middle 50%: 1310-1470. ACT middle 50%: 29-33.\n\n**Academics:** The university comprises 10 colleges/schools including Antoinette Westphal College of Media Arts & Design, Bennett S. LeBow College of Business, College of Arts and Sciences, College of Computing & Informatics. Experiential Learning Leader.\n\n**Outcomes:** Graduates have median earnings of $84,648 ten years after graduation, top employers include Comcast Corporation, Deloitte, Goldman Sachs.", "media": null, "indexed_at": "2026-01-01T00:09:32.677046+00:00", "last_updated": "2025-12-07"}, {"university_id": "boston_college", "official_name": "Boston College", "location": {"city": "Chestnut Hill", "state": "MA", "type": "Private"}, "acceptance_rate": 12.6, "soft_fit_category": "REACH", "market_position": "Elite Private", "us_news_rank": 36, "summary": "**Boston College** is a private university located in Chestnut Hill, MA, ranked #36 in US News National Universities with a 12.6% acceptance rate and a test optional testing policy.\n\n**Admissions:** SAT middle 50%: 1450-1520. ACT middle 50%: 33-34. ED acceptance rate: 30.0%.\n\n**Academics:** The university comprises 4 colleges/schools including Morrissey College of Arts & Sciences, Carroll School of Management, Lynch School of Education and Human Development, Connell School of Nursing. Elite Private.\n\n**Outcomes:** Graduates have median earnings of $103,937 ten years after graduation, 75.0% employment rate within 2 years, 19.0% pursue graduate studies, top employers include PwC, Deloitte, JPMorganChase.", "media": null, "indexed_at": "2026-01-01T00:09:33.670008+00:00", "last_updated": "2025-12-07"}, {"university_id": "washington_university_in_st_louis", "official_name": "Washington University in St. Louis", "location": {"city": "St. Louis", "state": "Missouri", "type": "Private"}, "acceptance_rate": 11.92, "soft_fit_category": "REACH", "market_position": "Elite Private", "us_news_rank": 21, "summary": "**Washington University in St. Louis** is a private university located in St. Louis, Missouri, ranked #21 in US News National Universities with a 11.92% acceptance rate and a washington university in st. louis has adopted a test-optional policy for applicants for admission in the fall semester of 2026. applicants have the option of whether to submit standardized test scores. students who are unable to or who elect not to submit their test scores will have the requirement automatically waived and will not be penalized. for those who do submit test scores, either sat or act scores are acceptable, and neither the writing section nor sat subject tests are required. test results from any of the student's high school years are acceptable. washu accepts self-reported scores on the common and coalition applications. if a student enrolls at washu and submitted unofficial scores, official score reports from testing agencies will then be required. for the act, washu considers the highest section scores across all the test dates submitted. if a student takes both the act and sat, washu will consider whichever set of scores is most advantageous. washu will 'super score' act or sat scores and consider the highest section scores across all test dates submitted (individual section retakes are accepted on the act). the last test date accepted will be the december testing (october if applying early decision i). testing policy.\n\n**Admissions:** SAT middle 50%: 1500-1570. ACT middle 50%: 33-35. GPA middle 50%: 3.80-4.00. ED acceptance rate: 25.0%.\n\n**Academics:** The university comprises 5 colleges/schools including College of Arts & Sciences, McKelvey School of Engineering, Olin Business School, Sam Fox School of Design & Visual Arts. Elite Private.\n\n**Outcomes:** Graduates have median earnings of $86,182 ten years after graduation, 94.0% employment rate within 2 years, top employers include Amazon, Apple, Boston Consulting Group (BCG).", "media": null, "indexed_at": "2026-01-01T00:09:34.774268+00:00", "last_updated": "2024-05-16"}, {"university_id": "university_of_denver", "official_name": "University of Denver", "location": {"city": "Denver", "state": "CO", "type": "Private"}, "acceptance_rate": 77.3, "soft_fit_category": "SAFETY", "market_position": "Elite Private", "us_news_rank": 114, "summary": "**University of Denver** is a private university located in Denver, CO, ranked #114 in US News National Universities with a 77.3% acceptance rate and a test optional testing policy.\n\n**Admissions:** SAT middle 50%: 1210-1380. ACT middle 50%: 28-32. ED acceptance rate: 31.0%.\n\n**Academics:** The university comprises 9 colleges/schools including College of Arts, Humanities & Social Sciences, College of Natural Sciences & Mathematics, Daniels College of Business, Daniel Felix Ritchie School of Engineering and Computer Science. Elite Private.\n\n**Outcomes:** Graduates have median earnings of $71,155 ten years after graduation, 26.7% pursue graduate studies, top employers include University of Denver, Deloitte, KPMG.", "media": null, "indexed_at": "2026-01-01T00:09:35.830619+00:00", "last_updated": "2025-12-07"}, {"university_id": "wichita_state_university", "official_name": "Wichita State University", "location": {"city": "Wichita", "state": "Kansas", "type": "Public"}, "acceptance_rate": 72.13, "soft_fit_category": "SAFETY", "market_position": "Public Research University with a focus on Applied Learning and Affordability", "us_news_rank": 296, "summary": "**Wichita State University** is a public university located in Wichita, Kansas, ranked #296 in US News National Universities with a 72.13% acceptance rate and a wichita state university is test optional for admissions, allowing applicants to self-report scores. while test scores are not required for general admission, they are recommended to potentially improve application chances. additionally, some specific departments or scholarship considerations may still recommend or require sat/act scores. guaranteed admission can be achieved with either a cumulative 2.25 high school gpa or an act composite score of 21, or an sat erw+m score of 1060. testing policy.\n\n**Admissions:** SAT middle 50%: 970-1250. ACT middle 50%: 18-26. GPA middle 50%: Not disclosed.\n\n**Academics:** The university comprises 7 colleges/schools including Dorothy and Bill Cohen Honors College, College of Health Professions, Fairmount College of Liberal Arts and Sciences, College of Engineering. Public Research University with a focus on Applied Learning and Affordability.\n\n**Outcomes:** Graduates have median earnings of $43,800 ten years after graduation, 77.0% employment rate within 2 years, top employers include Deloitte, Amazon, Airbus.", "media": null, "indexed_at": "2026-01-01T00:09:37.068208+00:00", "last_updated": "2024-07-30"}, {"university_id": "villanova_university", "official_name": "Villanova University", "location": {"city": "Villanova", "state": "PA", "type": "Private"}, "acceptance_rate": 23.5, "soft_fit_category": "REACH", "market_position": "Elite Private", "us_news_rank": 56, "summary": "**Villanova University** is a private university located in Villanova, PA, ranked #56 in US News National Universities with a 23.5% acceptance rate and a test optional testing policy.\n\n**Admissions:** SAT middle 50%: 1450-1520. ACT middle 50%: 33-35. ED acceptance rate: 49.5%.\n\n**Academics:** The university comprises 6 colleges/schools including College of Liberal Arts and Sciences, College of Engineering, Villanova School of Business, M. Louise Fitzpatrick College of Nursing. Elite Private.\n\n**Outcomes:** Graduates have median earnings of $100,423 ten years after graduation, 72.5% employment rate within 2 years, 19.7% pursue graduate studies, top employers include Amazon Web Services, Bank of America, Boston Scientific.", "media": null, "indexed_at": "2026-01-01T00:09:38.170857+00:00", "last_updated": "2025-12-07"}, {"university_id": "university_of_new_hampshire", "official_name": "University of New Hampshire", "location": {"city": "Durham", "state": "New Hampshire", "type": "main_campus"}, "acceptance_rate": 88.1, "soft_fit_category": "SAFETY", "market_position": "Regional public research university with strong marine and environmental science programs.", "us_news_rank": 137, "summary": "**University of New Hampshire** is a main_campus university located in Durham, New Hampshire, ranked #137 in US News National Universities with a 88.1% acceptance rate and a the university of new hampshire is test-optional, meaning applicants are not required to submit sat or act scores for admission. this policy has been in place since fall 2020. more weight is given to a student's individual high school performance than standardized test scores. while scores are not required for admission, students who took a standardized test and enroll at unh will be required to submit their results for university research purposes only; these scores will not influence the admission decision. homeschooled students and those attending nontraditional schools are also eligible for the test-optional program and are encouraged to provide detailed curriculum information or supporting documents. testing policy.\n\n**Admissions:** SAT middle 50%: 1100-1320. ACT middle 50%: 26-30. GPA middle 50%: 3.11-3.91. EA acceptance rate: None%.\n\n**Academics:** The university comprises 8 colleges/schools including College of Engineering & Physical Sciences, College of Health & Human Services, College of Liberal Arts, College of Life Sciences and Agriculture. Regional public research university with strong marine and environmental science programs..\n\n**Outcomes:** Graduates have median earnings of $66,479 ten years after graduation, 17.0% pursue graduate studies, top employers include Fidelity Investments, Liberty Mutual Insurance, Goldman Sachs.", "media": null, "indexed_at": "2026-01-01T00:09:39.232309+00:00", "last_updated": "2024-07-30"}, {"university_id": "american_university", "official_name": "American University", "location": {"city": "Washington", "state": "DC", "type": "Private"}, "acceptance_rate": 61.8, "soft_fit_category": "SAFETY", "market_position": "Elite Private", "us_news_rank": 91, "summary": "**American University** is a private university located in Washington, DC, ranked #91 in US News National Universities with a 61.8% acceptance rate and a test optional testing policy.\n\n**Admissions:** SAT middle 50%: 1300-1450. ACT middle 50%: 29-33. EA acceptance rate: 79.7%.\n\n**Academics:** The university comprises 8 colleges/schools including College of Arts & Sciences, Kogod School of Business, School of Communication, School of Education. Elite Private.\n\n**Outcomes:** Graduates have median earnings of $77,370 ten years after graduation, 28.0% pursue graduate studies, top employers include Microsoft Corporation, Lockheed Martin Corporation, U.S. Department of State.", "media": null, "indexed_at": "2026-01-01T00:09:40.381554+00:00", "last_updated": "2025-12-07"}, {"university_id": "pepperdine_university", "official_name": "Pepperdine University", "location": {"city": "Malibu", "state": "CA", "type": "Private"}, "acceptance_rate": 67.36, "soft_fit_category": "SAFETY", "market_position": "Elite Private Christian University / Scenic Liberal Arts Institution", "us_news_rank": 84, "summary": "**Pepperdine University** is a private university located in Malibu, CA, ranked #84 in US News National Universities with a 67.36% acceptance rate and a test optional testing policy.\n\n**Admissions:** SAT middle 50%: 1300-1440. ACT middle 50%: 26-32. EA acceptance rate: None%.\n\n**Academics:** The university comprises 6 colleges/schools including Seaver College of Letters, Arts, and Sciences, Caruso School of Law, Graziadio Business School, Graduate School of Education and Psychology. Elite Private Christian University / Scenic Liberal Arts Institution.\n\n**Outcomes:** Graduates have median earnings of $82,939 ten years after graduation, 27.0% pursue graduate studies, top employers include Boeing, Northrop Grumman, Amgen.", "media": null, "indexed_at": "2026-01-01T00:09:41.371451+00:00", "last_updated": "2025-12-07"}, {"university_id": "belmont_university", "official_name": "Belmont University", "location": {"city": "Nashville", "state": "Tennessee", "type": "Private"}, "acceptance_rate": 95.3, "soft_fit_category": "SAFETY", "market_position": "Nationally Recognized Private University", "us_news_rank": 220, "summary": "**Belmont University** is a private university located in Nashville, Tennessee, ranked #220 in US News National Universities with a 95.3% acceptance rate and a belmont university is test-optional for the 2024-2025 application cycle, allowing applicants to decide whether or not to submit act or sat scores. if scores are submitted, official reports are required directly from the testing agency or via an official high school transcript; self-reported test scores are not accepted. the university does not consider the writing section of either exam, and the science section is no longer factored into act composite scores. testing policy.\n\n**Admissions:** SAT middle 50%: 1170-1360. ACT middle 50%: 24-30. GPA middle 50%: 3.58-4.00.\n\n**Academics:** The university comprises 11 colleges/schools including Jack C. Massey College of Business, College of Education, Mike Curb College of Entertainment & Music Business, Gordon E. Inman College of Health Sciences & Nursing. Nationally Recognized Private University.\n\n**Outcomes:** Graduates have median earnings of $49,100 ten years after graduation, 12% pursue graduate studies.", "media": null, "indexed_at": "2026-01-01T00:09:42.385748+00:00", "last_updated": "2024-07-30"}, {"university_id": "university_of_washington", "official_name": "University of Washington", "location": {"city": "Seattle", "state": "WA", "type": "Public"}, "acceptance_rate": 39.15, "soft_fit_category": "TARGET", "market_position": "Public Ivy", "us_news_rank": 42, "summary": "**University of Washington** is a public university located in Seattle, WA, ranked #42 in US News National Universities with a 39.15% acceptance rate and a test blind testing policy.\n\n**Admissions:** SAT middle 50%: 1330-1500. ACT middle 50%: 28-33.\n\n**Academics:** The university comprises 10 colleges/schools including College of Arts and Sciences, College of Engineering, Paul G. Allen School of Computer Science and Engineering, Foster School of Business. Public Ivy.\n\n**Outcomes:** Graduates have median earnings of $78,466 ten years after graduation, 17.1% pursue graduate studies, top employers include Amazon, Microsoft, Google.", "media": null, "indexed_at": "2026-01-01T00:09:43.576169+00:00", "last_updated": "2025-12-07"}, {"university_id": "yale_university", "official_name": "Yale University", "location": {"city": "New Haven", "state": "CT", "type": "Private"}, "acceptance_rate": 4.59, "soft_fit_category": "SUPER_REACH", "market_position": "Elite Private", "us_news_rank": 4, "summary": "**Yale University** is a private university located in New Haven, CT, ranked #4 in US News National Universities with a 4.59% acceptance rate and a test flexible testing policy.\n\n**Admissions:** SAT middle 50%: 1510-1570. ACT middle 50%: 34-36. REA acceptance rate: 10.82%.\n\n**Academics:** The university comprises 2 colleges/schools including Yale School of Engineering & Applied Science, Yale College. Elite Private.\n\n**Outcomes:** Graduates have median earnings of $100,533 ten years after graduation, 18.0% pursue graduate studies, top employers include McKinsey & Company, Bain & Company, Goldman Sachs Group.", "media": null, "indexed_at": "2026-01-01T00:09:44.691858+00:00", "last_updated": "2025-12-24"}, {"university_id": "cornell_university", "official_name": "Cornell University", "location": {"city": "Ithaca", "state": "NY", "type": "Private"}, "acceptance_rate": 8.4, "soft_fit_category": "SUPER_REACH", "market_position": "Elite Private", "us_news_rank": 12, "summary": "**Cornell University** is a private university located in Ithaca, NY, ranked #12 in US News National Universities with a 8.4% acceptance rate and a for fall 2025 enrollment, cornell university is test-optional for the college of arts and sciences, cornell engineering, the college of human ecology, the cornell jeb e. brooks school of public policy, and the school of industrial and labor relations. certain colleges (college of agriculture and life sciences, college of architecture, art and planning, and cornell sc johnson college of business) will remain score-free for one more year. standardized testing will be required for all undergraduate colleges starting fall 2026. testing policy.\n\n**Admissions:** SAT middle 50%: 1510-1560. ACT middle 50%: 33-35. ED acceptance rate: 18.8%.\n\n**Academics:** The university comprises 9 colleges/schools including College of Agriculture and Life Sciences, College of Architecture, Art, and Planning, College of Arts and Sciences, Cornell SC Johnson College of Business: Charles H. Dyson School of Applied Economics and Management. Elite Private.\n\n**Outcomes:** Graduates have median earnings of $104,043 ten years after graduation, 60.0% employment rate within 2 years, 31.0% pursue graduate studies, top employers include Cornell University, Capital One, J.P. Morgan Chase & Co..", "media": null, "indexed_at": "2026-01-01T00:09:45.695797+00:00", "last_updated": "2025-12-07"}, {"university_id": "northern_illinois_university", "official_name": "Northern Illinois University", "location": {"city": "DeKalb", "state": "Illinois", "type": "Public"}, "acceptance_rate": 70.4, "soft_fit_category": "SAFETY", "market_position": "Public Research University", "us_news_rank": 301, "summary": "**Northern Illinois University** is a public university located in DeKalb, Illinois, ranked #301 in US News National Universities with a 70.4% acceptance rate and a northern illinois university is test-optional, meaning applicants are not required to submit standardized test scores (sat/act) for admission. the university also allows self-reporting of scores, enabling students to include their test results on their application without sending official documents. for applicants with a cumulative high school gpa of 3.0 or above, the university has adopted a 'test-blind' policy, guaranteeing admission and automatically considering them for merit scholarships based solely on their gpa, starting with the fall 2021 applicants. applicants with a gpa below 3.0 are considered for admission based on a holistic review of factors such as academic preparation, performance, motivation, resilience, and resourcefulness. testing policy.\n\n**Admissions:** SAT middle 50%: 1010-1180. ACT middle 50%: 19-25. GPA middle 50%: 3.39-3.88.\n\n**Academics:** The university comprises 6 colleges/schools including College of Business, College of Education, College of Engineering and Engineering Technology, College of Health and Human Sciences. Public Research University.\n\n**Outcomes:** Graduates have median earnings of $57,808 ten years after graduation, 95.0% employment rate within 2 years, top employers include Amazon, Microsoft, PwC.", "media": null, "indexed_at": "2026-01-01T00:09:46.778893+00:00", "last_updated": "2024-07-29"}, {"university_id": "northwestern_university", "official_name": "Northwestern University", "location": {"city": "Evanston", "state": "IL", "type": "Private"}, "acceptance_rate": 7.5, "soft_fit_category": "SUPER_REACH", "market_position": "Elite Private", "us_news_rank": 7, "summary": "**Northwestern University** is a private university located in Evanston, IL, ranked #7 in US News National Universities with a 7.5% acceptance rate and a test optional testing policy.\n\n**Admissions:** SAT middle 50%: 1500-1560. ACT middle 50%: 33-35. ED acceptance rate: 20.0%.\n\n**Academics:** The university comprises 6 colleges/schools including Weinberg College of Arts and Sciences, McCormick School of Engineering & Applied Science, School of Communication, Medill School of Journalism, Media, Integrated Marketing Communications. Elite Private.\n\n**Outcomes:** Graduates have median earnings of $89,363 ten years after graduation, 71.0% employment rate within 2 years, 25.0% pursue graduate studies, top employers include McKinsey & Co., Bain & Company, The Boston Consulting Group.", "media": null, "indexed_at": "2026-01-01T00:09:47.870882+00:00", "last_updated": "2025-12-07"}, {"university_id": "worcester_polytechnic_institute", "official_name": "Worcester Polytechnic Institute", "location": {"city": "Worcester", "state": "Massachusetts", "type": "main_campus"}, "acceptance_rate": 60.16, "soft_fit_category": "SAFETY", "market_position": "A leading STEM-focused university known for its project-based learning and interdisciplinary approach, attracting students interested in hands-on innovation and applied research. Strong in engineering, computer science, and business.", "us_news_rank": 83, "summary": "**Worcester Polytechnic Institute** is a main_campus university located in Worcester, Massachusetts, ranked #83 in US News National Universities with a 60.16% acceptance rate and a wpi is a test-optional university. sat and act scores may be submitted but are not required and will never negatively impact an applicant's competitiveness. from 2021-2024, wpi was test-blind but has since reverted to its test-optional policy. applicants can self-report scores via the common or coalition application, email, or applicant portal; official scores are only required upon enrollment. international students whose first language is not english are required to submit toefl, ielts, or duolingo scores. testing policy.\n\n**Admissions:** SAT middle 50%: 1340-1480. ACT middle 50%: 30-34. GPA middle 50%: Not explicitly reported in this format. Average weighted GPA reported as 3.9 in some sources, but 25th and 75th percentiles are also listed as 3.9, which is inconsistent with a range.. ED acceptance rate: 68.9%.\n\n**Academics:** The university comprises 1 colleges/schools including Worcester Polytechnic Institute. A leading STEM-focused university known for its project-based learning and interdisciplinary approach, attracting students interested in hands-on innovation and applied research. Strong in engineering, computer science, and business..\n\n**Outcomes:** Graduates have median earnings of $103,470 ten years after graduation, 97.0% employment rate within 2 years, 35.0% pursue graduate studies, top employers include Google, Amazon, Microsoft.", "media": null, "indexed_at": "2026-01-01T00:09:48.881685+00:00", "last_updated": "2024-07-29"}, {"university_id": "Purdue_University", "official_name": "Purdue University", "location": {"city": "West Lafayette", "state": "IN", "type": "Public"}, "acceptance_rate": 43.4, "soft_fit_category": "TARGET", "market_position": "Public Ivy", "us_news_rank": 46, "summary": "**Purdue University** is a public university located in West Lafayette, IN, ranked #46 in US News National Universities with a 43.4% acceptance rate and a test required testing policy.\n\n**Admissions:** SAT middle 50%: 1210-1470. ACT middle 50%: 26-33. EA acceptance rate: 60.0%.\n\n**Academics:** The university comprises 12 colleges/schools including College of Agriculture, Daniels School of Business, College of Education, College of Engineering. Public Ivy.\n\n**Outcomes:** Graduates have median earnings of $72,424 ten years after graduation, 90.0% employment rate within 2 years, 25.8% pursue graduate studies, top employers include Amazon, Boeing, Caterpillar Inc..", "media": null, "indexed_at": "2026-01-01T00:09:49.979489+00:00", "last_updated": "2025-12-07"}, {"university_id": "southern_methodist_university", "official_name": "Southern Methodist University", "location": {"city": "University Park", "state": "TX", "type": "Private"}, "acceptance_rate": 61.2, "soft_fit_category": "SAFETY", "market_position": "Elite Private", "us_news_rank": 91, "summary": "**Southern Methodist University** is a private university located in University Park, TX, ranked #91 in US News National Universities with a 61.2% acceptance rate and a test optional testing policy.\n\n**Admissions:** SAT middle 50%: 1340-1480. ACT middle 50%: 30-34. ED acceptance rate: None%.\n\n**Academics:** The university comprises 7 colleges/schools including Dedman College of Humanities and Sciences, Edwin L. Cox School of Business, Bobby B. Lyle School of Engineering, Algur H. Meadows School of the Arts. Elite Private.\n\n**Outcomes:** Graduates have median earnings of $84,753 ten years after graduation, 95.0% employment rate within 2 years, 13.9% pursue graduate studies, top employers include Fidelity Investments, Gartner, Goldman Sachs.", "media": null, "indexed_at": "2026-01-01T00:09:52.085556+00:00", "last_updated": "2025-08-28"}, {"university_id": "hofstra_university", "official_name": "Hofstra University", "location": {"city": "Hempstead", "state": "New York", "type": "Private"}, "acceptance_rate": 68.09, "soft_fit_category": "SAFETY", "market_position": "A private, mid-sized university known for its strong programs in communication, business, and performing arts, often attracting students from the tri-state area.", "us_news_rank": 163, "summary": "**Hofstra University** is a private university located in Hempstead, New York, ranked #163 in US News National Universities with a 68.09% acceptance rate and a hofstra university is test-optional for most full-time undergraduate applicants, meaning standardized test scores (sat/act) are not required. students can choose whether or not to submit their scores. if submitted, hofstra superscores all scores. for those who opt not to submit scores, the admission committee conducts a comprehensive and holistic review, with a stronger emphasis on the high school transcript. while not required, hofstra recommends submitting strong test scores, and they may be considered for competitive programs or for admission to the honors college. students can self-report their scores initially. testing policy.\n\n**Admissions:** SAT middle 50%: 1280-1450. ACT middle 50%: 29-34. GPA middle 50%: N/A. EA acceptance rate: 77.2%.\n\n**Academics:** The university comprises 9 colleges/schools including Hofstra College of Liberal Arts and Sciences, Frank G. Zarb School of Business, The Lawrence Herbert School of Communication, School of Education. A private, mid-sized university known for its strong programs in communication, business, and performing arts, often attracting students from the tri-state area..\n\n**Outcomes:** Graduates have median earnings of $69,040 ten years after graduation, 95.0% employment rate within 2 years, 38.0% pursue graduate studies, top employers include Google, Goldman Sachs, Amazon.", "media": null, "indexed_at": "2026-01-01T00:09:53.080083+00:00", "last_updated": "2024-07-30"}, {"university_id": "washington_state_university", "official_name": "Washington State University", "location": {"city": "Pullman", "state": "Washington", "type": "Public"}, "acceptance_rate": 86.64, "soft_fit_category": "SAFETY", "market_position": "A comprehensive public research university, known for its strong agricultural and veterinary medicine programs, and its land-grant mission. It serves a broad range of students, particularly those from Washington state, and maintains a strong regional identity.", "us_news_rank": 179, "summary": "**Washington State University** is a public university located in Pullman, Washington, ranked #179 in US News National Universities with a 86.64% acceptance rate and a washington state university (wsu) is test-optional for the 2024-2025 application cycle. wsu does not require students to submit sat/act test scores as part of the application process and will not use them in admission decisions. testing policy.\n\n**Admissions:** SAT middle 50%: 1020-1260. ACT middle 50%: 20-27. GPA middle 50%: 3.00-3.75.\n\n**Academics:** The university comprises 11 colleges/schools including College of Agricultural, Human, and Natural Resource Sciences, College of Arts and Sciences, Carson College of Business, Edward R. Murrow College of Communication. A comprehensive public research university, known for its strong agricultural and veterinary medicine programs, and its land-grant mission. It serves a broad range of students, particularly those from Washington state, and maintains a strong regional identity..\n\n**Outcomes:** Graduates have median earnings of $54,400 ten years after graduation, 95.0% employment rate within 2 years, top employers include Amazon, Google, Microsoft.", "media": null, "indexed_at": "2026-01-01T00:09:54.173977+00:00", "last_updated": "2024-05-15"}, {"university_id": "university_of_maryland_baltimore_county", "official_name": "University of Maryland, Baltimore County", "location": {"city": "Catonsville", "state": "Maryland", "type": "Public"}, "acceptance_rate": 72.4, "soft_fit_category": "SAFETY", "market_position": "A public research university known for STEM and innovation, particularly strong in computer science and engineering, attracting students seeking value and strong career outcomes.", "us_news_rank": 160, "summary": "**University of Maryland, Baltimore County** is a public university located in Catonsville, Maryland, ranked #160 in US News National Universities with a 72.4% acceptance rate and a umbc is test-optional for the 2024-2025 application cycle, meaning applicants can choose whether or not to submit sat or act scores. if scores are submitted, they should be sent directly from the testing agency. standardized test scores are considered if submitted, with the middle 50% sat score range for admitted students typically falling between 1240-1420 and act composite scores ranging from 23-30. testing policy.\n\n**Admissions:** SAT middle 50%: 1240-1420. ACT middle 50%: 25-31. GPA middle 50%: 3.66-4.20.\n\n**Academics:** The university comprises 6 colleges/schools including College of Arts, Humanities and Social Sciences, College of Engineering and Information Technology, College of Natural and Mathematical Sciences, The Erickson School of Aging Studies. A public research university known for STEM and innovation, particularly strong in computer science and engineering, attracting students seeking value and strong career outcomes..\n\n**Outcomes:** Graduates have median earnings of $69,960 ten years after graduation, 93.0% employment rate within 2 years, 25.0% pursue graduate studies, top employers include Google, Goldman Sachs, Amazon.", "media": null, "indexed_at": "2026-01-01T00:09:55.273606+00:00", "last_updated": "2024-05-15"}, {"university_id": "texas_tech_university", "official_name": "Texas Tech University", "location": {"city": "Lubbock", "state": "Texas", "type": "Public"}, "acceptance_rate": 72.7, "soft_fit_category": "SAFETY", "market_position": "Public Research University", "us_news_rank": 198, "summary": "**Texas Tech University** is a public university located in Lubbock, Texas, ranked #198 in US News National Universities with a 72.7% acceptance rate and a texas tech university has extended a test-optional admission policy through 2025 entry terms. this policy allows students the option to apply without consideration of sat or act scores. if students choose not to submit test scores, their application will still be reviewed holistically, focusing on other aspects such as grades, course rigor, extracurricular activities, and essays. testing policy.\n\n**Admissions:** SAT middle 50%: 1110-1270. ACT middle 50%: 23-28. GPA middle 50%: 3.5-3.9.\n\n**Academics:** The university comprises 10 colleges/schools including Davis College of Agricultural Sciences & Natural Resources, Huckabee College of Architecture, College of Arts & Sciences, Jerry S. Rawls College of Business. Public Research University.\n\n**Outcomes:** Graduates have median earnings of $58,500 ten years after graduation, 95.0% employment rate within 2 years, top employers include Amazon, Deloitte, Accenture.", "media": null, "indexed_at": "2026-01-01T00:09:56.373738+00:00", "last_updated": "2024-07-27"}, {"university_id": "university_of_alabama_at_birmingham", "official_name": "University of Alabama at Birmingham", "location": {"city": "Birmingham", "state": "AL", "region": "", "type": "main_campus"}, "acceptance_rate": 88.18, "soft_fit_category": "SAFETY", "market_position": "A leading urban research university known for its medical center and health sciences programs.", "us_news_rank": 97, "summary": "**University of Alabama at Birmingham** is a main_campus university located in Birmingham, AL, ranked #97 in US News National Universities with a 88.18% acceptance rate and a the university of alabama at birmingham (uab) has a test-optional admission policy for summer and fall 2026, meaning act or sat scores are not required for admission or merit scholarship consideration. students indicate their preference to apply with or without a test score on their admission application (uab application or common application). for test-optional applicants, admission and merit scholarship consideration are based on high school gpa, grades in required coursework, and rigor of advanced courses (ap, ib, honors, etc.). for students applying with a test score, these factors are considered along with their highest composite act or sat score. uab does not 'superscore' act or sat results. some specific programs, such as early medical, dental, and optometry school acceptance programs, still require test scores. students admitted without a test score are required to take placement assessments in english and math. testing policy.\n\n**Admissions:** GPA middle 50%: 3.70-3.85.\n\n**Academics:** The university comprises 12 colleges/schools including College of Arts and Sciences, Collat School of Business, School of Education and Human Sciences, School of Engineering. A leading urban research university known for its medical center and health sciences programs..\n\n**Outcomes:** Graduates have median earnings of $46,400 ten years after graduation, 9.1% pursue graduate studies, top employers include UAB Medicine / UAB Health System, St. Vincent's Hospital, Jefferson County Board of Education.", "media": null, "indexed_at": "2026-01-01T00:09:57.468860+00:00", "last_updated": "2023-10-27"}, {"university_id": "rochester_institute_of_technology", "official_name": "Rochester Institute of Technology", "location": {"city": "Henrietta", "state": "New York", "type": "Private"}, "acceptance_rate": 66.93, "soft_fit_category": "SAFETY", "market_position": "Elite Private", "us_news_rank": 88, "summary": "**Rochester Institute of Technology** is a private university located in Henrietta, New York, ranked #88 in US News National Universities with a 66.93% acceptance rate and a rochester institute of technology (rit) is test-optional for all undergraduate programs for the 2024-2025 application cycle and beyond, meaning submitting sat or act scores is not required. applicants can choose whether or not to include their test scores. rit permits self-reporting of scores and will superscore the sat and/or act if multiple test results are provided. for applicants to stem (science, technology, engineering, or math) programs, including the optional act science section is recommended if act scores are submitted. testing policy.\n\n**Admissions:** SAT middle 50%: 1280-1430. ACT middle 50%: 29-33. GPA middle 50%: Data not consistently available in X.XX-X.XX format exceeding 4.0. RIT reports middle 50% on a 100-point scale, varying by college (e.g., 91-98).. ED acceptance rate: 73.0%.\n\n**Academics:** The university comprises 10 colleges/schools including College of Art and Design, Saunders College of Business, Golisano College of Computing and Information Sciences, Kate Gleason College of Engineering. Elite Private.\n\n**Outcomes:** Graduates have median earnings of $76,571 ten years after graduation, top employers include Google, Amazon, Apple.", "media": null, "indexed_at": "2026-01-01T00:09:58.482330+00:00", "last_updated": "2024-07-29"}, {"university_id": "samford_university", "official_name": "Samford University", "location": {"city": "Homewood", "state": "Alabama", "type": "Private"}, "acceptance_rate": 82.2, "soft_fit_category": "SAFETY", "market_position": "Regional leader in Christian higher education, strong in health sciences and arts.", "us_news_rank": 97, "summary": "**Samford University** is a private university located in Homewood, Alabama, ranked #97 in US News National Universities with a 82.2% acceptance rate and a samford university is test-optional for freshman applicants for the 2025-26 application cycle. while test scores are not required for general admission, the university strongly encourages students to submit them, and they are required for specific programs such as nursing. if a student applies test-optional, the test score is not considered in their application review; instead, emphasis is placed on curriculum strength and high school grades. however, admitted students who choose to enroll are asked to submit any standardized test scores they have taken prior to orientation for academic placement, retention, and student support services. the middle 50% of entering first-year students in fall 2025 had act scores ranging from 23-29 and sat scores from 1130-1350. testing policy.\n\n**Admissions:** SAT middle 50%: 1130-1350. ACT middle 50%: 23-29. GPA middle 50%: Not explicitly disclosed.\n\n**Academics:** The university comprises 9 colleges/schools including Howard College of Arts and Sciences, School of the Arts, Brock School of Business, Orlean Beeson School of Education. Regional leader in Christian higher education, strong in health sciences and arts..\n\n**Outcomes:** Graduates have median earnings of $60,876 ten years after graduation, 96.0% employment rate within 2 years, 37.0% pursue graduate studies, top employers include Children's Healthcare of Atlanta, Pizitz Middle School, Children's of Alabama.", "media": null, "indexed_at": "2026-01-01T00:09:59.568917+00:00", "last_updated": "2024-05-15"}, {"university_id": "university_of_illinois_urbana_champaign", "official_name": "University of Illinois Urbana-Champaign", "location": {"city": "Champaign", "state": "IL", "type": "Public"}, "acceptance_rate": 42.4, "soft_fit_category": "TARGET", "market_position": "Public Ivy", "us_news_rank": 41, "summary": "**University of Illinois Urbana-Champaign** is a public university located in Champaign, IL, ranked #41 in US News National Universities with a 42.4% acceptance rate and a test optional testing policy.\n\n**Admissions:** SAT middle 50%: 1390-1520. ACT middle 50%: 30-34. EA acceptance rate: None%.\n\n**Academics:** The university comprises 16 colleges/schools including Carle Illinois College of Medicine, College of Agricultural, Consumer & Environmental Sciences (ACES), College of Applied Health Sciences (AHS), College of Education. Public Ivy.\n\n**Outcomes:** Graduates have median earnings of $81,054 ten years after graduation, 40.0% pursue graduate studies, top employers include Amazon, Deloitte, KPMG.", "media": null, "indexed_at": "2026-01-01T00:10:00.583777+00:00", "last_updated": "2025-12-06"}, {"university_id": "james_madison_university", "official_name": "James Madison University", "location": {"city": "Harrisonburg", "state": "Virginia", "type": "Public"}, "acceptance_rate": 71.5, "soft_fit_category": "SAFETY", "market_position": "Public Ivy", "us_news_rank": 79, "summary": "**James Madison University** is a public university located in Harrisonburg, Virginia, ranked #79 in US News National Universities with a 71.5% acceptance rate and a james madison university is test-optional, meaning applicants are not required to submit standardized test scores like the sat or act as part of their application. this policy started with the fall 2021 application cycle. the university will not penalize applicants who choose not to submit test scores. however, if applicants believe their scores strengthen their application, they are welcome to submit them. official test results, if submitted, must be sent electronically from the testing agency by the application deadline. some specific programs or scholarships might still require standardized test scores. the university allows self-reporting of scores initially, with 23% of applicants choosing to submit sat scores and 3% submitting act scores. testing policy.\n\n**Admissions:** SAT middle 50%: 1190-1350. ACT middle 50%: 24-29. GPA middle 50%: 3.55-4.10. EA acceptance rate: 33.33%.\n\n**Academics:** The university comprises 10 colleges/schools including College of Arts and Letters, College of Business, College of Education, College of Health and Behavioral Studies. Public Ivy.\n\n**Outcomes:** Graduates have median earnings of $69,954 ten years after graduation, 72.8% employment rate within 2 years, 22.2% pursue graduate studies, top employers include Amazon, Deloitte, KPMG.", "media": null, "indexed_at": "2026-01-01T00:10:01.670305+00:00", "last_updated": "2024-07-30"}, {"university_id": "university_of_idaho", "official_name": "University of Idaho", "location": {"city": "Moscow", "state": "Idaho", "type": "Public"}, "acceptance_rate": 75.53, "soft_fit_category": "SAFETY", "market_position": "Public Research University with High Research Activity and Value Focus", "us_news_rank": 179, "summary": "**University of Idaho** is a public university located in Moscow, Idaho, ranked #179 in US News National Universities with a 75.53% acceptance rate and a the university of idaho is test-optional, allowing applicants the choice to submit standardized test scores. submitting strong sat or act scores can enhance an application, especially since many applicants choose to submit them. the university also permits self-reporting of scores. test scores are not required for students with a cumulative unweighted gpa of 3.00 or higher. for applicants with a gpa between 2.60-2.99, act or sat scores are required or they must opt into the vandal gateway program. those with gpas of 2.30-2.59 will be admitted through the vandal gateway program regardless of test scores. the university of idaho allows superscoring for standardized tests, considering the highest individual section scores across multiple test attempts. testing policy.\n\n**Admissions:** SAT middle 50%: 950-1200. ACT middle 50%: 20-29. GPA middle 50%: 2.30-3.70.\n\n**Academics:** The university comprises 8 colleges/schools including College of Agricultural and Life Sciences, College of Art and Architecture, College of Business and Economics, College of Education, Health and Human Sciences. Public Research University with High Research Activity and Value Focus.\n\n**Outcomes:** Graduates have median earnings of $55,000 ten years after graduation, top employers include Google, Goldman Sachs, Deloitte.", "media": null, "indexed_at": "2026-01-01T00:10:02.784886+00:00", "last_updated": "2024-05-15"}, {"university_id": "University_of_South_Florida", "official_name": "University of South Florida", "location": {"city": "Tampa", "state": "FL", "type": "Public"}, "acceptance_rate": 41.0, "soft_fit_category": "TARGET", "market_position": "Public Ivy", "us_news_rank": 88, "summary": "**University of South Florida** is a public university located in Tampa, FL, ranked #88 in US News National Universities with a 41.0% acceptance rate and a test required testing policy.\n\n**Admissions:** SAT middle 50%: 1230-1370. ACT middle 50%: 24-29. EA acceptance rate: None%.\n\n**Academics:** The university comprises 14 colleges/schools including Bellini College of Artificial Intelligence, Cybersecurity, and Computing, College of Arts and Sciences, College of Behavioral and Community Sciences, Muma College of Business. Public Ivy.\n\n**Outcomes:** Graduates have median earnings of $57,743 ten years after graduation, 90.0% employment rate within 2 years, top employers include Amazon, Microsoft, Google.", "media": null, "indexed_at": "2026-01-01T00:10:03.871753+00:00", "last_updated": "2025-12-07"}, {"university_id": "university_of_tulsa", "official_name": "University of Tulsa", "location": {"city": "Tulsa", "state": "Oklahoma", "type": "main_campus"}, "acceptance_rate": 58.0, "soft_fit_category": "SAFETY", "market_position": "A private, research-intensive university known for its strong engineering, law, and liberal arts programs, offering a personalized education experience. Competes with other regional private universities and specialized programs nationally.", "us_news_rank": 195, "summary": "**University of Tulsa** is a main_campus university located in Tulsa, Oklahoma, ranked #195 in US News National Universities with a 58.0% acceptance rate and a act or sat scores are not required for first-year and transfer students applying for the fall 2025, spring 2026, or fall 2026 entry terms. if submitted, scores will be reviewed and considered for admission and scholarships. only the early careers in medicine program requires test scores. the university of tulsa utilizes a holistic review process for every student regardless of the decision to submit test scores. the transfer acceptance rate is currently unavailable for recent application years (2023 and 2022). testing policy.\n\n**Admissions:** SAT middle 50%: 1220-1530. ACT middle 50%: 25-34. GPA middle 50%: 3.40-3.72. Early Decision acceptance rate: None%.\n\n**Academics:** The university comprises 4 colleges/schools including Henry Kendall College of Arts and Sciences, Collins College of Business, College of Engineering and Natural Sciences, Oxley College of Health and Natural Sciences. A private, research-intensive university known for its strong engineering, law, and liberal arts programs, offering a personalized education experience. Competes with other regional private universities and specialized programs nationally..\n\n**Outcomes:** Graduates have median earnings of $61,408 ten years after graduation, 22.0% pursue graduate studies, top employers include Paycom, HoganTaylor LLP, Magellan Midstream Partners.", "media": null, "indexed_at": "2026-01-01T00:10:05.884677+00:00", "last_updated": "2024-07-30"}, {"university_id": "montclair_state_university", "official_name": "Montclair State University", "location": {"city": "Montclair", "state": "New Jersey", "type": "Public"}, "acceptance_rate": 87.9, "soft_fit_category": "SAFETY", "market_position": "Public Ivy", "us_news_rank": 158, "summary": "**Montclair State University** is a public university located in Montclair, New Jersey, ranked #158 in US News National Universities with a 87.9% acceptance rate and a montclair state university has been test-optional for undergraduate admissions since fall 2015, meaning applicants are not required to submit sat or act scores. the university considers test scores if a student chooses to submit them, and applicants are neither hindered nor advantaged by submitting scores alone. montclair state also allows for self-reporting of scores without official verification at the application stage. for sat, the university has a 'highest section' policy, also known as superscoring, where the highest section scores across all submitted sat test dates are considered. the middle 50% sat scores for admitted students typically range from 970 to 1200, and an act score between 17-25 is generally associated with a higher chance of acceptance. testing policy.\n\n**Admissions:** GPA middle 50%: 3.40-3.40. EA acceptance rate: 90.4%.\n\n**Academics:** The university comprises 10 colleges/schools including Bloomfield College of Montclair State University, College of Communication and Media, College for Community Health, College for Education and Engaged Learning. Public Ivy.\n\n**Outcomes:** Graduates have median earnings of $51,100 ten years after graduation, 94.0% employment rate within 2 years, 20.0% pursue graduate studies, top employers include Amazon, Deloitte, PwC.", "media": null, "indexed_at": "2026-01-01T00:10:06.883596+00:00", "last_updated": "2024-05-15"}, {"university_id": "university_of_rhode_island", "official_name": "University of Rhode Island", "location": {"city": "Kingston", "state": "Rhode Island", "type": "Public"}, "acceptance_rate": 72.17, "soft_fit_category": "SAFETY", "market_position": "Public flagship known for marine sciences and nursing, strong regional presence.", "us_news_rank": 150, "summary": "**University of Rhode Island** is a public university located in Kingston, Rhode Island, ranked #150 in US News National Universities with a 72.17% acceptance rate and a the university of rhode island is a test-optional institution for the 2024-2025 admission cycle. if applicants choose to submit sat or act scores, official scores must be sent electronically by the testing service (uri id code is 3919 for sat and 3818 for act). the writing section of the act or the optional sat essay are not required. uri superscores, taking the highest combination of scores from each section across all test dates. when completing the common application, applicants will be asked if they would like their test scores to be considered. if 'yes', the application review will await receipt of test scores. test scores are not required for transfer applicants, particularly those with fewer than 24 credits; if submitted, they must be sent electronically. testing policy.\n\n**Admissions:** GPA middle 50%: 3.40-4.12. ED acceptance rate: None%.\n\n**Academics:** The university comprises 10 colleges/schools including University College for Academic Success, College of Arts and Sciences, College of Business, Feinstein College of Education. Public flagship known for marine sciences and nursing, strong regional presence..\n\n**Outcomes:** Graduates have median earnings of $56,200 ten years after graduation, 90.0% employment rate within 2 years, 15.0% pursue graduate studies, top employers include Google, Goldman Sachs, McKinsey & Company.", "media": null, "indexed_at": "2026-01-01T00:10:08.032483+00:00", "last_updated": "2024-07-29"}, {"university_id": "saint_louis_university", "official_name": "Saint Louis University", "location": {"city": "St. Louis", "state": "Missouri", "type": "Private"}, "acceptance_rate": 81.5, "soft_fit_category": "SAFETY", "market_position": "Prominent Private Jesuit Research University", "us_news_rank": 102, "summary": "**Saint Louis University** is a private university located in St. Louis, Missouri, ranked #102 in US News National Universities with a 81.5% acceptance rate and a saint louis university has a standardized-test-optional undergraduate admission process. students can choose whether or not to submit act/sat scores. test scores are not required for admission or scholarships. if students choose to submit scores, slu does not accept superscores; composite and and all subscores from each completed test should be sent. self-reported scores are also considered. international students are still required to demonstrate english proficiency, which may involve a test score. testing policy.\n\n**Admissions:** SAT middle 50%: 1130-1340. ACT middle 50%: 25-31. GPA middle 50%: 3.80-4.00. ED acceptance rate: 58.0%.\n\n**Academics:** The university comprises 8 colleges/schools including College of Arts and Sciences, Richard A. Chaifetz School of Business, Doisy College of Health Sciences, School of Education. Prominent Private Jesuit Research University.\n\n**Outcomes:** Graduates have median earnings of $61,800 ten years after graduation, 95.0% employment rate within 2 years, 29.0% pursue graduate studies, top employers include Google, Amazon, Microsoft.", "media": null, "indexed_at": "2026-01-01T00:10:09.070661+00:00", "last_updated": "2024-07-30"}, {"university_id": "university_of_north_carolina_at_chapel_hill", "official_name": "University of North Carolina at Chapel Hill", "location": {"city": "Chapel Hill", "state": "NC", "type": "Public"}, "acceptance_rate": 15.3, "soft_fit_category": "REACH", "market_position": "Public Ivy", "us_news_rank": 26, "summary": "**University of North Carolina at Chapel Hill** is a public university located in Chapel Hill, NC, ranked #26 in US News National Universities with a 15.3% acceptance rate and a test optional for applicants with a weighted gpa of 2.8 or higher; applicants with a weighted gpa below 2.8 must submit scores. testing policy.\n\n**Admissions:** SAT middle 50%: 1400-1530. ACT middle 50%: 28-34. GPA middle 50%: 4.00-4.49. EA acceptance rate: 23.0%.\n\n**Academics:** The university comprises 11 colleges/schools including College of Arts and Sciences, Kenan-Flagler Business School, Hussman School of Journalism and Media, School of Education. Public Ivy.\n\n**Outcomes:** Graduates have median earnings of $72,200 ten years after graduation, top employers include Ketchum, Deloitte, RTI International.", "media": null, "indexed_at": "2026-01-01T00:10:10.078613+00:00", "last_updated": "2025-12-07"}, {"university_id": "colorado_school_of_mines", "official_name": "Colorado School of Mines", "location": {"city": "Golden", "state": "Colorado", "type": "Public"}, "acceptance_rate": 59.7, "soft_fit_category": "SAFETY", "market_position": "Elite Public STEM University", "us_news_rank": 76, "summary": "**Colorado School of Mines** is a public university located in Golden, Colorado, ranked #76 in US News National Universities with a 59.7% acceptance rate and a colorado school of mines is a test-optional university. applications receive equal consideration in their holistic admissions and merit scholarship review process, with or without test scores. if applicants believe test scores will further highlight their academic ability, they are welcome to include them. the university superscores both the act and sat. self-reporting of scores is allowed, and scores can be submitted even after the application if desired. testing policy.\n\n**Admissions:** SAT middle 50%: 1320-1470. ACT middle 50%: 29-33. GPA middle 50%: 3.70-3.95.\n\n**Academics:** The university comprises 1 colleges/schools including Colorado School of Mines (encompassing all undergraduate engineering and applied science programs). Elite Public STEM University.\n\n**Outcomes:** Graduates have median earnings of $93,871 ten years after graduation, 95.0% employment rate within 2 years, 18.0% pursue graduate studies, top employers include Amazon, Microsoft, Lockheed Martin.", "media": null, "indexed_at": "2026-01-01T00:10:11.078225+00:00", "last_updated": "2024-06-11"}, {"university_id": "university_of_texas_at_austin", "official_name": "The University of Texas at Austin", "location": {"city": "Austin", "state": "TX", "type": "Public"}, "acceptance_rate": 22.2, "soft_fit_category": "REACH", "market_position": "Public Ivy", "us_news_rank": 30, "summary": "**The University of Texas at Austin** is a public university located in Austin, TX, ranked #30 in US News National Universities with a 22.2% acceptance rate and a test required testing policy.\n\n**Admissions:** SAT middle 50%: 1240-1470. ACT middle 50%: 27-33. EA acceptance rate: 32.0%.\n\n**Academics:** The university comprises 18 colleges/schools including Cockrell School of Engineering, McCombs School of Business, College of Liberal Arts, College of Natural Sciences. Public Ivy.\n\n**Outcomes:** Graduates have median earnings of $75,121 ten years after graduation, top employers include Tesla, Amazon, Apple.", "media": null, "indexed_at": "2026-01-01T00:10:12.170530+00:00", "last_updated": "2025-12-07"}, {"university_id": "harvard_university", "official_name": "Harvard University", "location": {"city": "Cambridge", "state": "MA", "type": "Private"}, "acceptance_rate": 4.2, "soft_fit_category": "SUPER_REACH", "market_position": "Elite Private", "us_news_rank": 3, "summary": "**Harvard University** is a private university located in Cambridge, MA, ranked #3 in US News National Universities with a 4.2% acceptance rate and a test required (sat or act required starting fall 2025 applications) testing policy.\n\n**Admissions:** SAT middle 50%: 1500-1580. ACT middle 50%: 34-36. GPA middle 50%: 4.10-4.30. REA acceptance rate: 8.74%.\n\n**Academics:** The university comprises 9 colleges/schools including Harvard College, Harvard Business School (HBS), Harvard Law School (HLS), Harvard Medical School (HMS). Elite Private.\n\n**Outcomes:** Graduates have median earnings of $101,817 ten years after graduation, top employers include McKinsey & Company, Boston Consulting Group (The), Bain & Company.", "media": null, "indexed_at": "2026-01-01T00:10:14.180787+00:00", "last_updated": "2025-12-24"}, {"university_id": "university_of_san_diego", "official_name": "University of San Diego", "location": {"city": "San Diego", "state": "California", "type": "Private"}, "acceptance_rate": 53.0, "soft_fit_category": "SAFETY", "market_position": "Elite Private", "us_news_rank": 106, "summary": "**University of San Diego** is a private university located in San Diego, California, ranked #106 in US News National Universities with a 53.0% acceptance rate and a test free testing policy.\n\n**Admissions:** SAT middle 50%: 1200-1350. ACT middle 50%: 26-31.\n\n**Academics:** The university comprises 6 colleges/schools including College of Arts and Sciences, Hahn School of Nursing and Health Science, Joan B. Kroc School of Peace Studies, Knauss School of Business. Elite Private.\n\n**Outcomes:** Graduates have median earnings of $86,522 ten years after graduation, 22.7% pursue graduate studies, top employers include Deloitte, EY, KPMG.", "media": null, "indexed_at": "2026-01-01T00:10:15.286490+00:00", "last_updated": "2025-12-07"}, {"university_id": "college_of_william_and_mary", "official_name": "The College of William & Mary", "location": {"city": "Williamsburg", "state": "VA", "type": "Public"}, "acceptance_rate": 37.0, "soft_fit_category": "TARGET", "market_position": "Public Ivy", "us_news_rank": 51, "summary": "**The College of William & Mary** is a public university located in Williamsburg, VA, ranked #51 in US News National Universities with a 37.0% acceptance rate and a test optional testing policy.\n\n**Admissions:** SAT middle 50%: 1390-1520. ACT middle 50%: 32-34. GPA middle 50%: 4.16-4.51. ED acceptance rate: 49.73%.\n\n**Academics:** The university comprises 5 colleges/schools including College of Arts & Sciences, Raymond A. Mason School of Business, William & Mary School of Education, Batten School of Coastal & Marine Sciences. Public Ivy.\n\n**Outcomes:** Graduates have median earnings of $73,490 ten years after graduation, 39.0% pursue graduate studies, top employers include Accenture, Amazon, Deloitte.", "media": null, "indexed_at": "2026-01-01T00:10:16.390857+00:00", "last_updated": "2025-12-07"}, {"university_id": "mercer_university", "official_name": "Mercer University", "location": {"city": "Macon", "state": "Georgia", "type": "Private"}, "acceptance_rate": 68.89, "soft_fit_category": "SAFETY", "market_position": "Strong National Private", "us_news_rank": 165, "summary": "**Mercer University** is a private university located in Macon, Georgia, ranked #165 in US News National Universities with a 68.89% acceptance rate and a mercer university is currently test-optional, allowing students to decide whether to submit standardized test scores. the university permits self-reporting of scores. however, mercer will return to a test-required admissions policy beginning with the fall 2026 application cycle. testing policy.\n\n**Admissions:** SAT middle 50%: 1170-1330. ACT middle 50%: 25-31. GPA middle 50%: N/A. EA acceptance rate: 84.4%.\n\n**Academics:** The university comprises 11 colleges/schools including College of Liberal Arts and Sciences, Stetson-Hatcher School of Business, School of Engineering, Tift College of Education. Strong National Private.\n\n**Outcomes:** Graduates have median earnings of $58,200 ten years after graduation, 95.0% employment rate within 2 years, 17.0% pursue graduate studies, top employers include Piedmont Healthcare, Emory Healthcare, Northside Hospital.", "media": null, "indexed_at": "2026-01-01T00:10:17.578805+00:00", "last_updated": "2024-07-30"}, {"university_id": "iowa_state_university", "official_name": "Iowa State University of Science and Technology", "location": {"city": "Ames", "state": "Iowa", "type": "Public"}, "acceptance_rate": 88.7, "soft_fit_category": "SAFETY", "market_position": "Strong regional presence, known for engineering, agriculture, and veterinary medicine. Increasingly competitive.", "us_news_rank": 121, "summary": "**Iowa State University of Science and Technology** is a public university located in Ames, Iowa, ranked #121 in US News National Universities with a 88.7% acceptance rate and a iowa state university is test-optional for first-year applicants. students may choose whether they wish to self-report their act/sat scores when they apply for admission. for those who choose not to submit an act or sat score, admission will be based on high school gpa and completion of core course requirements. submitted scores may be used for admissions purposes, course placement, and scholarship decisions. clt scores can also be submitted for consideration. testing policy.\n\n**Admissions:** SAT middle 50%: 1120-1330. ACT middle 50%: 21-28. GPA middle 50%: 3.50-3.90.\n\n**Academics:** The university comprises 8 colleges/schools including College of Agriculture and Life Sciences, Ivy College of Business, College of Design, College of Engineering. Strong regional presence, known for engineering, agriculture, and veterinary medicine. Increasingly competitive..\n\n**Outcomes:** Graduates have median earnings of $63,386 ten years after graduation, 97.0% employment rate within 2 years, top employers include Google, Amazon, Microsoft.", "media": null, "indexed_at": "2026-01-01T00:10:18.675683+00:00", "last_updated": "2024-05-15"}, {"university_id": "university_of_the_pacific", "official_name": "University of the Pacific", "location": {"city": "Stockton", "state": "California", "type": "Private"}, "acceptance_rate": 71.3, "soft_fit_category": "SAFETY", "market_position": "Known for strong pre-professional programs and a personalized learning environment in a mid-sized university setting.", "us_news_rank": 136, "summary": "**University of the Pacific** is a private university located in Stockton, California, ranked #136 in US News National Universities with a 71.3% acceptance rate and a university of the pacific is test-optional, meaning students are not required to submit sat or act scores for admission. applicants who do not submit test scores will not be disadvantaged in any way during the application review. if scores are submitted, they will be considered along with other application components such as gpa, transcripts, extracurricular activities, personal essay, and references. testing policy.\n\n**Admissions:** SAT middle 50%: 1190-1468. ACT middle 50%: 23-32. GPA middle 50%: 3.4-3.8.\n\n**Academics:** The university comprises 10 colleges/schools including College of the Pacific, Eberhardt School of Business, School of Engineering and Computer Science, Arthur A. Dugoni School of Dentistry. Known for strong pre-professional programs and a personalized learning environment in a mid-sized university setting..\n\n**Outcomes:** Graduates have median earnings of $78,445 ten years after graduation, 35.0% pursue graduate studies, top employers include Accenture, Amazon, Bank of America.", "media": null, "indexed_at": "2026-01-01T00:10:20.974339+00:00", "last_updated": "2024-05-15"}, {"university_id": "university_of_california_berkeley", "official_name": "University of California, Berkeley", "location": {"city": "Berkeley", "state": "CA", "type": "Public"}, "acceptance_rate": 11, "soft_fit_category": "REACH", "market_position": "Public Ivy", "us_news_rank": 15, "summary": "**University of California, Berkeley** is a public university located in Berkeley, CA, ranked #15 in US News National Universities with a 11% acceptance rate and a test free testing policy.\n\n**Admissions:** GPA middle 50%: 4.31-4.65.\n\n**Academics:** The university comprises 7 colleges/schools including College of Chemistry, College of Computing, Data Science, and Society, College of Engineering, College of Environmental Design. Public Ivy.\n\n**Outcomes:** Graduates have median earnings of $126,322 ten years after graduation, top employers include Google, Amazon, Microsoft.", "media": null, "indexed_at": "2026-01-01T00:10:24.173972+00:00", "last_updated": "2025-12-06"}, {"university_id": "Auburn University", "official_name": "Auburn University", "location": {"city": "Auburn", "state": "Alabama", "type": "Public"}, "acceptance_rate": 46.0, "soft_fit_category": "TARGET", "market_position": "Leading Public Research University", "us_news_rank": 102, "summary": "**Auburn University** is a public university located in Auburn, Alabama, ranked #102 in US News National Universities with a 46.0% acceptance rate and a auburn university is currently test-optional for fall 2026 admissions for exceptionally qualified applicants with at least a 3.6 gpa, though submission of test scores is strongly encouraged and preferred. less than 5% of the applicant pool is considered via the test-optional pathway. beginning fall 2027, all first-year applicants will be required to submit act or sat scores. testing policy.\n\n**Admissions:** SAT middle 50%: 1260-1380. ACT middle 50%: 26-31. EA acceptance rate: 44.0%.\n\n**Academics:** The university comprises 12 colleges/schools including College of Agriculture, College of Architecture, Design & Construction, Raymond J. Harbert College of Business, College of Education. Leading Public Research University.\n\n**Outcomes:** Graduates have median earnings of $65,337 ten years after graduation, top employers include Google, Microsoft, Delta Airlines.", "media": null, "indexed_at": "2026-01-01T00:10:23.077713+00:00", "last_updated": "2025-12-07"}, {"university_id": "university_of_florida", "official_name": "University of Florida", "location": {"city": "Gainesville", "state": "FL", "type": "Public"}, "acceptance_rate": 24.2, "soft_fit_category": "REACH", "market_position": "Public Ivy", "us_news_rank": 30, "summary": "**University of Florida** is a public university located in Gainesville, FL, ranked #30 in US News National Universities with a 24.2% acceptance rate and a test required testing policy.\n\n**Admissions:** SAT middle 50%: 1380-1510. ACT middle 50%: 31-34. GPA middle 50%: 4.5-4.7. EA acceptance rate: None%.\n\n**Academics:** The university comprises 16 colleges/schools including College of Agricultural and Life Sciences, College of the Arts, Warrington College of Business, College of Dentistry. Public Ivy.\n\n**Outcomes:** Graduates have median earnings of $71,588 ten years after graduation, top employers include Deloitte, JPMorgan Chase, Apple.", "media": null, "indexed_at": "2026-01-01T00:10:25.373502+00:00", "last_updated": "2025-12-07"}, {"university_id": "university_of_wisconsin-madison", "official_name": "University of Wisconsin-Madison", "location": {"city": "Madison", "state": "WI", "type": "Public"}, "acceptance_rate": 40.8, "soft_fit_category": "TARGET", "market_position": "Public Ivy", "us_news_rank": 36, "summary": "**University of Wisconsin-Madison** is a public university located in Madison, WI, ranked #36 in US News National Universities with a 40.8% acceptance rate and a test optional testing policy.\n\n**Admissions:** SAT middle 50%: 1360-1510. ACT middle 50%: 28-33. EA acceptance rate: None%.\n\n**Academics:** The university comprises 8 colleges/schools including College of Agricultural and Life Sciences, Wisconsin School of Business, School of Education, College of Engineering. Public Ivy.\n\n**Outcomes:** Graduates have median earnings of $73,792 ten years after graduation, 26.0% pursue graduate studies, top employers include Epic, Deloitte, JP Morgan Chase.", "media": null, "indexed_at": "2026-01-01T00:10:26.474652+00:00", "last_updated": "2025-12-07"}, {"university_id": "howard_university", "official_name": "Howard University", "location": {"city": "Washington", "state": "DC", "type": "Private"}, "acceptance_rate": 41.3, "soft_fit_category": "TARGET", "market_position": "Elite Private", "us_news_rank": 86, "summary": "**Howard University** is a private university located in Washington, DC, ranked #86 in US News National Universities with a 41.3% acceptance rate and a test optional testing policy.\n\n**Admissions:** ED acceptance rate: 49.4%.\n\n**Academics:** The university comprises 14 colleges/schools including College of Arts and Sciences, School of Business, Cathy Hughes School of Communications, College of Engineering and Architecture. Elite Private.\n\n**Outcomes:** Graduates have median earnings of $51,800 ten years after graduation, top employers include Deloitte, Ernst & Young, KPMG.", "media": null, "indexed_at": "2026-01-01T00:10:19.789504+00:00", "last_updated": "2025-12-07"}, {"university_id": "university_of_montana", "official_name": "University of Montana", "location": {"city": "Missoula", "state": "Montana", "type": "Public"}, "acceptance_rate": 73.3, "soft_fit_category": "SAFETY", "market_position": "Regional Public Research University", "us_news_rank": 377, "summary": "**University of Montana** is a public university located in Missoula, Montana, ranked #377 in US News National Universities with a 73.3% acceptance rate and a the university of montana is test-optional for admissions. students may apply without submitting standardized test scores (sat/act). while scores are considered if submitted, they are not required for general admission. for placement in certain courses (like math, writing, foreign language, and chemistry), act or sat scores may be used in combination with other criteria. the sat essay/act writing section is optional and may not be included in admissions consideration. testing policy.\n\n**Admissions:** SAT middle 50%: 1070-1280. ACT middle 50%: 23-28.\n\n**Academics:** The university comprises 12 colleges/schools including College of Humanities and Sciences, Phyllis J. Washington College of Education and Human Sciences, W.A. Franke College of Forestry and Conservation, College of Health Professions and Biomedical Sciences. Regional Public Research University.\n\n**Outcomes:** Graduates have median earnings of $41,000 ten years after graduation, top employers include Google, Microsoft, Meta.", "media": null, "indexed_at": "2026-01-01T00:10:36.178632+00:00", "last_updated": "2024-07-28"}, {"university_id": "san_jose_state_university", "official_name": "San Jos\u00e9 State University", "location": {"city": "San Jose", "state": "California", "type": "Public"}, "acceptance_rate": 84.61, "soft_fit_category": "SAFETY", "market_position": "Leading Public for Tech Careers", "us_news_rank": null, "summary": "**San Jos\u00e9 State University** is a public university located in San Jose, California with a 84.61% acceptance rate and a san jose state university is test optional, allowing applicants the choice to submit standardized test scores if they wish. official test scores will not be used in the consideration of applicants for admission. the university permits self-reporting of scores, meaning students can indicate their test scores on their application without initially needing official documentation. if offered admission, students may submit official sat and/or act scores for course placement purposes. testing policy.\n\n**Admissions:** SAT middle 50%: 1090-1330. ACT middle 50%: 24-30. GPA middle 50%: 3.3-3.7.\n\n**Academics:** The university comprises 8 colleges/schools including Lucas College and Graduate School of Business, Connie L. Lurie College of Education, Charles W. Davidson College of Engineering, College of Health and Human Sciences. Leading Public for Tech Careers.\n\n**Outcomes:** Graduates have median earnings of $59,900 ten years after graduation, 88.0% employment rate within 2 years, top employers include Google, Amazon, Deloitte.", "media": null, "indexed_at": "2026-01-01T00:10:31.865070+00:00", "last_updated": "2024-07-29"}, {"university_id": "appalachian_state_university", "official_name": "Appalachian State University", "location": {"city": "Boone", "state": "North Carolina", "type": "Public"}, "acceptance_rate": 90.0, "soft_fit_category": "SAFETY", "market_position": "Strong regional university with a focus on experiential learning and community engagement.", "us_news_rank": 15, "summary": "**Appalachian State University** is a public university located in Boone, North Carolina, ranked #15 in US News National Universities with a 90.0% acceptance rate and a test scores are optional for first-year applicants with a weighted gpa of 2.8 or above. however, students with a weighted high school gpa below 2.8 must submit a standardized test score (17 or higher on the act or 930 or higher on the sat) to be considered for admission. self-reporting of scores is permitted initially, with official scores required upon enrollment for admitted students who self-reported. testing policy.\n\n**Admissions:** SAT middle 50%: 1100-1280. ACT middle 50%: 21-27. GPA middle 50%: 3.82-4.34. EA acceptance rate: None%.\n\n**Academics:** The university comprises 8 colleges/schools including Beaver College of Health Sciences, College of Arts and Sciences, College of Fine and Applied Arts, Hayes School of Music. Strong regional university with a focus on experiential learning and community engagement..\n\n**Outcomes:** Graduates have median earnings of $48,352 ten years after graduation, 95.0% employment rate within 2 years, 30.0% pursue graduate studies, top employers include Google, Goldman Sachs, McKinsey & Company.", "media": null, "indexed_at": "2026-01-01T00:10:35.073744+00:00", "last_updated": "2025-12-30"}, {"university_id": "carnegie_mellon_university", "official_name": "Carnegie Mellon University", "location": {"city": "Pittsburgh", "state": "PA", "type": "Private"}, "acceptance_rate": 11.6, "soft_fit_category": "REACH", "market_position": "Elite Private", "us_news_rank": 20, "summary": "**Carnegie Mellon University** is a private university located in Pittsburgh, PA, ranked #20 in US News National Universities with a 11.6% acceptance rate and a carnegie mellon university is test-optional through fall 2025 for most programs. applicants are not required to submit sat or act results, but results will be considered if submitted. the school of computer science strongly encourages applicants to submit either an sat or act score, including the math subscore. the college of fine arts remains test-optional and requires portfolios or auditions. testing policy.\n\n**Admissions:** SAT middle 50%: 1500-1560. ACT middle 50%: 34-35.\n\n**Academics:** The university comprises 7 colleges/schools including College of Engineering, College of Fine Arts, Dietrich College of Humanities and Social Sciences, Heinz College of Information Systems and Public Policy. Elite Private.\n\n**Outcomes:** Graduates have median earnings of $114,862 ten years after graduation, 25.0% pursue graduate studies, top employers include Amazon, Google, Microsoft.", "media": null, "indexed_at": "2026-01-01T00:10:27.490212+00:00", "last_updated": "2025-12-07"}, {"university_id": "seattle_university", "official_name": "Seattle University", "location": {"city": "Seattle", "state": "Washington", "type": "Private"}, "acceptance_rate": 76.0, "soft_fit_category": "SAFETY", "market_position": "Leading Private Jesuit University", "us_news_rank": 152, "summary": "**Seattle University** is a private university located in Seattle, Washington, ranked #152 in US News National Universities with a 76.0% acceptance rate and a seattle university is test-optional for all first-year applicants, meaning sat or act scores are not required for admission. applicants can choose whether or not to submit their scores. if scores are submitted, seattle university accepts self-reported scores provisionally but requires official scores if the student enrolls. the university uses a 'superscoring' policy, considering the highest section scores across all sat test dates submitted. the sat essay/act writing section is optional and may not be included in admissions consideration. testing policy.\n\n**Admissions:** SAT middle 50%: 1130-1350. ACT middle 50%: 23-30. GPA middle 50%: 3.9-4.2. Early Action acceptance rate: None%.\n\n**Academics:** The university comprises 6 colleges/schools including Albers School of Business & Economics, College of Arts and Sciences, College of Education, College of Nursing & Health Sciences. Leading Private Jesuit University.\n\n**Outcomes:** Graduates have median earnings of $75,272 ten years after graduation, 95.0% employment rate within 2 years, 35.0% pursue graduate studies.", "media": null, "indexed_at": "2026-01-01T00:10:33.986094+00:00", "last_updated": "2024-07-30"}, {"university_id": "university_of_connecticut", "official_name": "University of Connecticut", "location": {"city": "Storrs", "state": "CT", "type": "Public"}, "acceptance_rate": 52.4, "soft_fit_category": "SAFETY", "market_position": "Public Ivy", "us_news_rank": 70, "summary": "**University of Connecticut** is a public university located in Storrs, CT, ranked #70 in US News National Universities with a 52.4% acceptance rate and a test optional testing policy.\n\n**Admissions:** SAT middle 50%: 1310-1500. ACT middle 50%: 31-34. ED acceptance rate: 60.0%.\n\n**Academics:** The university comprises 9 colleges/schools including College of Liberal Arts and Sciences, College of Agriculture, Health and Natural Resources, School of Business, Neag School of Education. Public Ivy.\n\n**Outcomes:** Graduates have median earnings of $73,997 ten years after graduation, 33.0% pursue graduate studies, top employers include Deloitte, Travelers, PricewaterhouseCoopers (PwC).", "media": null, "indexed_at": "2026-01-01T00:10:30.631551+00:00", "last_updated": "2025-12-07"}, {"university_id": "fordham_university", "official_name": "Fordham University", "location": {"city": "Bronx", "state": "NY", "type": "Private"}, "acceptance_rate": 54.0, "soft_fit_category": "SAFETY", "market_position": "Elite Private", "us_news_rank": 91, "summary": "**Fordham University** is a private university located in Bronx, NY, ranked #91 in US News National Universities with a 54.0% acceptance rate and a test optional testing policy.\n\n**Admissions:** SAT middle 50%: 1380-1490. ACT middle 50%: 31-34. ED acceptance rate: 58.82%.\n\n**Academics:** The university comprises 4 colleges/schools including Fordham College at Rose Hill, Fordham College at Lincoln Center, Gabelli School of Business, School of Professional and Continuing Studies. Elite Private.\n\n**Outcomes:** Graduates have median earnings of $64,200 ten years after graduation, 20.0% pursue graduate studies, top employers include JPMorgan Chase & Co., Goldman Sachs & Co., Citigroup.", "media": null, "indexed_at": "2026-01-01T00:10:22.030828+00:00", "last_updated": "2025-12-07"}, {"university_id": "university_of_oregon", "official_name": "University of Oregon", "location": {"city": "Eugene", "state": "OR", "type": "Public"}, "acceptance_rate": 88.31, "soft_fit_category": "SAFETY", "market_position": "Public Research University", "us_news_rank": 98, "summary": "**University of Oregon** is a public university located in Eugene, OR, ranked #98 in US News National Universities with a 88.31% acceptance rate and a test optional testing policy.\n\n**Admissions:** SAT middle 50%: 1130-1360. ACT middle 50%: 22-30. EA acceptance rate: 88.31%.\n\n**Academics:** The university comprises 8 colleges/schools including College of Arts and Sciences, Charles H. Lundquist College of Business, College of Design, College of Education. Public Research University.\n\n**Outcomes:** Graduates have median earnings of $61,324 ten years after graduation, 15.1% pursue graduate studies, top employers include Deloitte, KPMG LLP, PricewaterhouseCoopers (PwC).", "media": null, "indexed_at": "2026-01-01T00:10:32.977432+00:00", "last_updated": "2025-12-07"}, {"university_id": "dartmouth_college", "official_name": "Dartmouth College", "location": {"city": "Hanover", "state": "NH", "type": "Private"}, "acceptance_rate": 5.3, "soft_fit_category": "SUPER_REACH", "market_position": "Elite Private", "us_news_rank": 13, "summary": "**Dartmouth College** is a private university located in Hanover, NH, ranked #13 in US News National Universities with a 5.3% acceptance rate and a test optional for class of 2028; test required for class of 2029 and beyond testing policy.\n\n**Admissions:** SAT middle 50%: 1430-1550. ACT middle 50%: 32-35. ED acceptance rate: 17.0%.\n\n**Academics:** The university comprises 2 colleges/schools including School of Arts and Sciences, Thayer School of Engineering (Undergraduate). Elite Private.\n\n**Outcomes:** Graduates have median earnings of $97,434 ten years after graduation, top employers include AlphaSights, Amazon, Appian.", "media": null, "indexed_at": "2026-01-01T00:10:29.573953+00:00", "last_updated": "2025-12-07"}, {"university_id": "university_of_vermont", "official_name": "University of Vermont and State Agricultural College", "location": {"city": "Burlington", "state": "VT", "type": "Public"}, "acceptance_rate": 65.3, "soft_fit_category": "SAFETY", "market_position": "Public Ivy", "us_news_rank": 121, "summary": "**University of Vermont and State Agricultural College** is a public university located in Burlington, VT, ranked #121 in US News National Universities with a 65.3% acceptance rate and a test optional testing policy.\n\n**Admissions:** SAT middle 50%: 1320-1480. ACT middle 50%: 31-34. ED acceptance rate: 93.7%.\n\n**Academics:** The university comprises 7 colleges/schools including College of Arts and Sciences (CAS), Grossman School of Business (GSB), College of Engineering and Mathematical Sciences (CEMS), Rubenstein School of Environment and Natural Resources (RSENR). Public Ivy.\n\n**Outcomes:** Graduates have median earnings of $62,472 ten years after graduation, 76.5% employment rate within 2 years, 17.4% pursue graduate studies, top employers include University of Vermont Medical Center, GlobalFoundries, State of Vermont.", "media": null, "indexed_at": "2026-01-01T00:10:28.571030+00:00", "last_updated": "2025-12-19"}, {"university_id": "university_of_tennessee_knoxville", "official_name": "University of Tennessee, Knoxville", "location": {"city": "Knoxville", "state": "Tennessee", "type": "Public"}, "acceptance_rate": 38.3, "soft_fit_category": "TARGET", "market_position": "A leading public research university in the Southeast, known for strong state support and robust alumni network.", "us_news_rank": 103, "summary": "**University of Tennessee, Knoxville** is a public university located in Knoxville, Tennessee, ranked #103 in US News National Universities with a 38.3% acceptance rate and a all first-year undergraduate students are required to self-report their act or sat scores as part of their application for admission by january 15, 2026. only tests taken through december 2025 will be accepted for admission and institutional merit scholarship consideration. official scores must be sent to ut from the testing agency and received by april 1, 2026. ut uses the superscoring method, meaning they take your highest section scores of each test taken to determine your new composite score for application review. testing policy.\n\n**Admissions:** SAT middle 50%: 1190-1340. ACT middle 50%: 25-31. GPA middle 50%: 4.04-4.46.\n\n**Academics:** The university comprises 11 colleges/schools including Herbert College of Agriculture, College of Architecture & Design, College of Arts & Sciences, College of Emerging and Collaborative Studies. A leading public research university in the Southeast, known for strong state support and robust alumni network..\n\n**Outcomes:** Graduates have median earnings of $60,249 ten years after graduation, 84.0% employment rate within 2 years, 29.7% pursue graduate studies, top employers include University of Tennessee Medical Center, Axle Logistics, Vanderbilt University Medical Center.", "media": null, "indexed_at": "2026-01-01T00:10:39.378430+00:00", "last_updated": "2024-07-30"}, {"university_id": "ball_state_university", "official_name": "Ball State University", "location": {"city": "Muncie", "state": "Indiana", "type": "Public"}, "acceptance_rate": 85.5, "soft_fit_category": "SAFETY", "market_position": "Regional leader in Indiana for teacher education and architectural studies, with a growing national reputation for immersive learning and digital media programs. Competes strongly within the Midwest for public university applicants seeking a mid-sized, hands-on educational experience.", "us_news_rank": 201, "summary": "**Ball State University** is a public university located in Muncie, Indiana, ranked #201 in US News National Universities with a 85.5% acceptance rate and a ball state university is a test-optional institution. applicants can choose whether to provide sat and/or act scores as part of their application. not providing scores will not count against an applicant. test scores are generally only required for students who attended a high school that does not provide grades. the university superscores, considering the highest section scores across all submitted test dates. testing policy.\n\n**Admissions:** SAT middle 50%: 1080-1250. ACT middle 50%: 21-23. GPA middle 50%: 3.65-3.95.\n\n**Academics:** The university comprises 9 colleges/schools including Estopinal College of Architecture and Planning, Miller College of Business, College of Communication, Information, and Media, College of Fine Arts. Regional leader in Indiana for teacher education and architectural studies, with a growing national reputation for immersive learning and digital media programs. Competes strongly within the Midwest for public university applicants seeking a mid-sized, hands-on educational experience..\n\n**Outcomes:** Graduates have median earnings of $51,830 ten years after graduation, 69.0% employment rate within 2 years, 17.0% pursue graduate studies, top employers include Google, Amazon, Microsoft.", "media": null, "indexed_at": "2026-01-01T00:10:42.531841+00:00", "last_updated": "2024-07-28"}, {"university_id": "university_of_california_los_angeles", "official_name": "University of California, Los Angeles", "location": {"city": "Los Angeles", "state": "CA", "type": "Public"}, "acceptance_rate": 9.0, "soft_fit_category": "SUPER_REACH", "market_position": "Public Ivy", "us_news_rank": 17, "summary": "**University of California, Los Angeles** is a public university located in Los Angeles, CA, ranked #17 in US News National Universities with a 9.0% acceptance rate and a test blind testing policy.\n\n**Admissions:** GPA middle 50%: 4.18-4.32.\n\n**Academics:** The university comprises 8 colleges/schools including College of Letters and Science, Henry Samueli School of Engineering and Applied Science, School of the Arts and Architecture, Herb Alpert School of Music. Public Ivy.\n\n**Outcomes:** Graduates have median earnings of $82,511 ten years after graduation, top employers include Accenture, Amazon, Apple.", "media": null, "indexed_at": "2026-01-01T00:10:38.174581+00:00", "last_updated": "2025-12-06"}, {"university_id": "case_western_reserve_university", "official_name": "Case Western Reserve University", "location": {"city": "Cleveland", "state": "OH", "type": "Private"}, "acceptance_rate": 37.7, "soft_fit_category": "TARGET", "market_position": "Elite Private", "us_news_rank": 48, "summary": "**Case Western Reserve University** is a private university located in Cleveland, OH, ranked #48 in US News National Universities with a 37.7% acceptance rate and a test optional testing policy.\n\n**Admissions:** SAT middle 50%: 1450-1530. ACT middle 50%: 32-35. GPA middle 50%: 4.10-4.30. EA acceptance rate: 37.0%.\n\n**Academics:** The university comprises 6 colleges/schools including College of Arts and Sciences, Case School of Engineering, Frances Payne Bolton School of Nursing, Weatherhead School of Management. Elite Private.\n\n**Outcomes:** Graduates have median earnings of $87,989 ten years after graduation, 42.0% pursue graduate studies, top employers include Amazon, Cleveland Clinic, Deloitte.", "media": null, "indexed_at": "2026-01-01T00:10:45.582386+00:00", "last_updated": "2025-12-07"}, {"university_id": "stony_brook_university", "official_name": "Stony Brook University", "location": {"city": "Stony Brook", "state": "NY", "type": "Public"}, "acceptance_rate": 49.05, "soft_fit_category": "TARGET", "market_position": "Public Ivy", "us_news_rank": 59, "summary": "**Stony Brook University** is a public university located in Stony Brook, NY, ranked #59 in US News National Universities with a 49.05% acceptance rate and a test optional testing policy.\n\n**Admissions:** SAT middle 50%: 1330-1470. ACT middle 50%: 28-33. EA acceptance rate: None%.\n\n**Academics:** The university comprises 7 colleges/schools including College of Arts and Sciences, College of Engineering and Applied Sciences, College of Business, School of Marine and Atmospheric Sciences. Public Ivy.\n\n**Outcomes:** Graduates have median earnings of $74,502 ten years after graduation, 61.0% employment rate within 2 years, 34.0% pursue graduate studies, top employers include Accenture, Amazon, Bloomberg.", "media": null, "indexed_at": "2026-01-01T00:10:37.169122+00:00", "last_updated": "2025-12-07"}, {"university_id": "university_of_pennsylvania", "official_name": "University of Pennsylvania", "location": {"city": "Philadelphia", "state": "PA", "type": "Private"}, "acceptance_rate": 4.9, "soft_fit_category": "SUPER_REACH", "market_position": "Elite Private", "us_news_rank": 7, "summary": "**University of Pennsylvania** is a private university located in Philadelphia, PA, ranked #7 in US News National Universities with a 4.9% acceptance rate and a test optional testing policy.\n\n**Admissions:** SAT middle 50%: 1510-1560. ACT middle 50%: 34-35. ED acceptance rate: 13.6%.\n\n**Academics:** The university comprises 4 colleges/schools including College of Arts and Sciences, School of Engineering and Applied Science, The Wharton School, School of Nursing. Elite Private.\n\n**Outcomes:** Graduates have median earnings of $111,371 ten years after graduation, top employers include McKinsey & Company, Goldman Sachs, Morgan Stanley.", "media": null, "indexed_at": "2026-01-01T00:10:40.475903+00:00", "last_updated": "2025-12-24"}, {"university_id": "san_diego_state_university", "official_name": "San Diego State University", "location": {"city": "San Diego", "state": "CA", "type": "Public"}, "acceptance_rate": 36.0, "soft_fit_category": "TARGET", "market_position": "Elite Public", "us_news_rank": 117, "summary": "**San Diego State University** is a public university located in San Diego, CA, ranked #117 in US News National Universities with a 36.0% acceptance rate and a test blind testing policy.\n\n**Admissions:** SAT middle 50%: 1130-1340. ACT middle 50%: 22-29. GPA middle 50%: 3.90-4.25.\n\n**Academics:** The university comprises 8 colleges/schools including Fowler College of Business, College of Engineering, College of Health and Human Services, College of Professional Studies and Fine Arts. Elite Public.\n\n**Outcomes:** Graduates have median earnings of $63,296 ten years after graduation, 92.0% employment rate within 2 years, 17.0% pursue graduate studies, top employers include Amazon, Meta, Google.", "media": null, "indexed_at": "2026-01-01T00:10:43.577439+00:00", "last_updated": "2025-12-19"}, {"university_id": "emory_university", "official_name": "Emory University", "location": {"city": "Atlanta", "state": "GA", "type": "Private"}, "acceptance_rate": 10.3, "soft_fit_category": "REACH", "market_position": "Elite Private / New Ivy", "us_news_rank": 24, "summary": "**Emory University** is a private university located in Atlanta, GA, ranked #24 in US News National Universities with a 10.3% acceptance rate and a test optional testing policy.\n\n**Admissions:** SAT middle 50%: 1480-1540. ACT middle 50%: 32-35. ED acceptance rate: 30.1%.\n\n**Academics:** The university comprises 4 colleges/schools including Emory College of Arts and Sciences, Oxford College, Goizueta Business School, Nell Hodgson Woodruff School of Nursing. Elite Private / New Ivy.\n\n**Outcomes:** Graduates have median earnings of $80,137 ten years after graduation, 92.0% employment rate within 2 years, 37.6% pursue graduate studies, top employers include Emory, Epic, Goldman Sachs.", "media": null, "indexed_at": "2026-01-01T00:10:44.572814+00:00", "last_updated": "2025-12-07"}, {"university_id": "rensselaer_polytechnic_institute_profile", "official_name": "Rensselaer Polytechnic Institute", "location": {"city": "Troy", "state": "NY", "type": "Private"}, "acceptance_rate": 63.4, "soft_fit_category": "SAFETY", "market_position": "Elite Private Technological Research University", "us_news_rank": 70, "summary": "**Rensselaer Polytechnic Institute** is a private university located in Troy, NY, ranked #70 in US News National Universities with a 63.4% acceptance rate and a test optional (physician-scientist program requires scores; self-reported scores accepted, official scores required upon enrollment) testing policy.\n\n**Admissions:** SAT middle 50%: 1360-1520. ACT middle 50%: 30-34. EA acceptance rate: 57.9%.\n\n**Academics:** The university comprises 5 colleges/schools including School of Architecture, School of Engineering, School of Humanities, Arts, and Social Sciences, Lally School of Management. Elite Private Technological Research University.\n\n**Outcomes:** Graduates have median earnings of $102,051 ten years after graduation, 33.0% pursue graduate studies, top employers include Google, Apple, Microsoft.", "media": null, "indexed_at": "2026-01-01T00:10:41.475732+00:00", "last_updated": "2025-12-07"}], "total": 191}